keyword,video_id
must see,"{'video_id': '9NFxi2NzQrk', 'channel_title': 'LKO - MOMENTS HUB', 'channel_id': 'UCY1BFvXZMIziSHj5pW751ew', 'video_publish_date': 1735898953.0, 'video_title': 'Moments You Must See To Believe | Best of 2024 #28', 'video_description': 'Moments You Must See To Believe | Best of 2024 #28   \nDon’t miss out on these unforgettable scenes that you truly must see to believe. Like, share, and subscribe for more mind-blowing content\nThank you for watching! If any of your copyrighted content appears in this video, please let us know, and LKO - Incredible Moments will work with you to resolve it.\n✍ Note: Video thumbnails are a composite image and may not correspond to the content. Thank you for your understanding!\n#lkoincrediblemoments \n#incrediblemoments \n#incrediblemomentscaughtoncctvcamera', 'video_category': '24', 'video_view_count': '1498884', 'video_comment_count': '226', 'video_like_count': '7943', 'video_dislike_count': None, 'video_thumbnail': 'https://i.ytimg.com/vi/9NFxi2NzQrk/hqdefault.jpg', 'video_tags': 'incredible moments caught on camera|incredible moments caught on cctv camera|incredible moments|incredible|incredible moments caught on cctv|incredible videos|moments caught on camera|caught on camera|cctv camera|satisfying|interesting|unbelievable|interesting facts|top 10|lko incredible moments|Moments You Must See To Believe | Best of 2024|lko moments', 'collection_date': datetime.datetime(2025, 4, 25, 17, 24, 18, 880975)}"
must see,"{'video_id': 'IQsTWgL84P0', 'channel_title': 'Max TV', 'channel_id': 'UCX3tM-sW2NpWvy-xpmicGRA', 'video_publish_date': 1695477611.0, 'video_title': 'Moments You Must See To Believe', 'video_description': ""Subscribe @maxtv7944 \n\nAt the same time, you don't have to be a super photographer, or even understand the camera settings to get it out of your pocket and make an unusual photo or even a video. However, if you are lucky to catch something interesting and rare, then you can easily say that you have the jackpot! In addition, many photos and videos can be truly amazing, so people from all around the world will talk about them. And why am I trying to describe it to you? You can see it for yourself...\n\n**\n\nFor copyright matters please contact us at: djaxent@gmail.com \n\nProduction Music courtesy of Epidemic Sound!"", 'video_category': '24', 'video_view_count': '3136706', 'video_comment_count': '310', 'video_like_count': '13150', 'video_dislike_count': None, 'video_thumbnail': 'https://i.ytimg.com/vi/IQsTWgL84P0/hqdefault.jpg', 'video_tags': 'funny moments|must see moments|caught on camera|instant regret|instant regret compilation|people|funny fails compilations|try not to laugh impossible|funny fails videos|unexpected moments|fails of the week|fails compilation|try not to laugh challenge|tik tok fails|moments caught on camera|security camera moments|caught on video|caught on cctv|security cameras|weird things|caught on security cameras|maxtv|2023|Moments You Must SEE To Believe', 'collection_date': datetime.datetime(2025, 4, 25, 17, 24, 18, 880993)}"
must see,"{'video_id': '_2c3q_noc-Q', 'channel_title': 'DEEPFACE', 'channel_id': 'UC6B6RDo6cGgtvwF6-k-tEuA', 'video_publish_date': 1739941237.0, 'video_title': 'Woman Stuns AGT Judges by Dancing with a Giant Hyena – Must-See Performance! #agt #magic #talent #ai', 'video_description': ""Woman Stuns AGT Judges by Dancing with a Giant Hyena – Must-See Performance! 🦁🔥\n\nYou won’t believe your eyes! A fearless woman takes the America’s Got Talent stage by storm, dancing with a realistic, giant AI-generated hyena—leaving the judges and audience in absolute shock! 🤯 From jaw-dropping choreography to an unexpected wild twist, this must-see performance is breaking the internet.\n\n🔹 Watch as the judges react in disbelief!\n🔹 Experience the mind-blowing AI-enhanced performance.\n🔹 Witness a never-before-seen act that’s going viral!\n\n📢 Don't miss out! Watch now and share your thoughts in the comments.\n\n#AGT #ViralTalent #MustSee #HyenaDance #TalentShow #AGTAudition #AIArt #AIShow"", 'video_category': '24', 'video_view_count': '1336118', 'video_comment_count': '109', 'video_like_count': '27506', 'video_dislike_count': None, 'video_thumbnail': 'https://i.ytimg.com/vi/_2c3q_noc-Q/hqdefault.jpg', 'video_tags': ""AGT hyena dance|America's Got Talent wild animal act|AGT 2025 shocking audition|woman dances with hyena AGT|must-see AGT performance|AGT viral moment|AGT judges stunned|incredible AGT animal act|best AGT auditions 2025|AGT golden buzzer act|breathtaking AGT performance|wildest AGT acts|AGT most unbelievable auditions|AGT best dance performances|AGT trending video|agt|magic|talent|shorts|dance|performance|deepface|hyena"", 'collection_date': datetime.datetime(2025, 4, 25, 17, 24, 18, 881005)}"
must see,"{'video_id': 'YRfz3M6jTKo', 'channel_title': 'FunkyDunky', 'channel_id': 'UCF0OnudMSkqzh-y6KBT_GYw', 'video_publish_date': 1743272050.0, 'video_title': 'Didn’t see that coming!! #viralvideo #disaster #mustsee #trendingnow #shortsviral #clips', 'video_description': '#viralvideo #mustsee #foryou #trendingnow #shortsviral #funny #youtubeshorts #mini #shortsvideo \n\nAi generated for entertainment only', 'video_category': '22', 'video_view_count': '35122862', 'video_comment_count': '669', 'video_like_count': '89041', 'video_dislike_count': None, 'video_thumbnail': 'https://i.ytimg.com/vi/YRfz3M6jTKo/hqdefault.jpg', 'video_tags': '', 'collection_date': datetime.datetime(2025, 4, 25, 17, 24, 18, 881109)}"
must see,"{'video_id': 'cnx93AJGh-w', 'channel_title': 'Binge Central', 'channel_id': 'UCSu7x-J8ESHojsq8mCvFOZw', 'video_publish_date': 1669916580.0, 'video_title': '200 MOMENTS YOU MUST SEE TO BELIEVE | BEST OF THE MONTH', 'video_description': '200 MOMENTS YOU MUST SEE TO BELIEVE. BEST OF THE MONTH\n\nThese are our very best moments, hand picked for you to enjoy! This list features incredible funny and amazing moments caught on camera!\nWhich of these did you think was the most incredible, or made you laugh the most? Was it the instant regret moments, or the hilarious fails? \n.\n.\nFeaturing the best incredible moments, the funniest moments caught on camera of instant regret and funny fails! instant regret! as well as instant regret moments, the funniest moments caught on camera.', 'video_category': '24', 'video_view_count': '5723947', 'video_comment_count': '872', 'video_like_count': '28000', 'video_dislike_count': None, 'video_thumbnail': 'https://i.ytimg.com/vi/cnx93AJGh-w/hqdefault.jpg', 'video_tags': 'funny moments|must see moments|caught on camera|instant regret|instant regret compilation|people|funny fails compilations|try not to laugh impossible|funny fails videos|unexpected moments|fails of the week|fails compilation|try not to laugh challenge|tik tok fails|moments caught on camera|security camera moments|caught on video|caught on cctv|security cameras|weird things|security camera fails|cctv compilation|caught on security cameras|cctv cameras', 'collection_date': datetime.datetime(2025, 4, 25, 17, 24, 18, 881120)}"
must see,"{'video_id': 'X0OIIeyOFJo', 'channel_title': 'Retrocast', 'channel_id': 'UCI5Hyw6Cp4PC0RZURRxWWJw', 'video_publish_date': 1728642616.0, 'video_title': 'Moments You Must See To Believe - Best of Compilation!', 'video_description': 'Moments You Must See To Believe - Best of Compilation!\n\nSubscribe: @retrocast1', 'video_category': '22', 'video_view_count': '3132576', 'video_comment_count': '281', 'video_like_count': '13676', 'video_dislike_count': None, 'video_thumbnail': 'https://i.ytimg.com/vi/X0OIIeyOFJo/hqdefault.jpg', 'video_tags': 'retrocast', 'collection_date': datetime.datetime(2025, 4, 25, 17, 24, 18, 881129)}"
must see,"{'video_id': 'PqQufuvhyLo', 'channel_title': 'Elegantnaija', 'channel_id': 'UChpWFGd7IqlwmUfPJtb3gdg', 'video_publish_date': 1730746811.0, 'video_title': 'Wedding Entrance That Will SHOCK You! 😲💍 | Must-See #shorts', 'video_description': ""🔥 You won't believe this wedding entrance! Watch as this unforgettable moment unfolds and leaves everyone in awe! 😲💍 Can you guess what happens next? Comment below! If you love jaw-dropping moments, hit that like button and subscribe for more amazing content! ❤️✨\n\n🔔 Don’t miss out on more incredible wedding highlights!\n\n#wedding  #entrance  #shockingwedding  #viralweddings  #videos  #mustsee #trending  #shorts"", 'video_category': '22', 'video_view_count': '1107711', 'video_comment_count': '2054', 'video_like_count': '10578', 'video_dislike_count': None, 'video_thumbnail': 'https://i.ytimg.com/vi/PqQufuvhyLo/hqdefault.jpg', 'video_tags': 'wedding entrance|shocking wedding|viral wedding videos|wedding highlights|must-see weddings|wedding trends|#shorts', 'collection_date': datetime.datetime(2025, 4, 25, 17, 24, 18, 881138)}"
must see,"{'video_id': 'MDBgOyEN2OU', 'channel_title': 'tomoyoshi katayama 片山智義', 'channel_id': 'UCvBfgDsEcBnhlsBiJXHAKpg', 'video_publish_date': 1503622785.0, 'video_title': 'must-see! “Stand by Me” Cover Story  （Acapella Soul） Wonderful！New York  Central Park', 'video_description': '* Please watch headphones. You can listen to a base with a sense of weight \n\n2017 8.21  Cover Story Acapella Soul Stand by Me NY  Central Park', 'video_category': '22', 'video_view_count': '26441457', 'video_comment_count': '8897', 'video_like_count': '476643', 'video_dislike_count': None, 'video_thumbnail': 'https://i.ytimg.com/vi/MDBgOyEN2OU/hqdefault.jpg', 'video_tags': '', 'collection_date': datetime.datetime(2025, 4, 25, 17, 24, 18, 881146)}"
must see,"{'video_id': 'FK_KUdRzVBA', 'channel_title': 'Antarex', 'channel_id': 'UCSwKSNpZPX7hzmsbC-E2Z5g', 'video_publish_date': 1745390546.0, 'video_title': 'Little Yellow monster on AGT – Must-See Performance! 🐔💃 #agt #talent #dance #deepface', 'video_description': 'Little Yellow monster  on AGT – Must-See Performance! 🐍💃\n\nLittle Yellow monster  on America’s Got Talent? You have to see this to believe it! 🤯 Watch this jaw-dropping AGT audition as a fearless performer wows the judges and audience with a hypnotic, elegant, and unexpected dance routine alongside her slithering partner. Will she get the Golden Buzzer or leave the judges in awe?\n\n🔥 Don’t miss this unforgettable AGT moment—watch now!\n#AGT #AmericasGotTalent #SnakeDance #ViralVideo #TalentShow #MustSee #EpicAudition #Shorts\u200b #YouTubeShorts\u200b #FYP #Viral #Trending', 'video_category': '24', 'video_view_count': '1759', 'video_comment_count': '0', 'video_like_count': '16', 'video_dislike_count': None, 'video_thumbnail': 'https://i.ytimg.com/vi/FK_KUdRzVBA/hqdefault.jpg', 'video_tags': '#AGT|#AmericasGotTalent|#SnakeDance|#ViralVideo|#TalentShow|#EpicAudition|#Shorts|#YouTubeShorts|#FYP|#Viral|#Trending', 'collection_date': datetime.datetime(2025, 4, 25, 17, 24, 18, 881155)}"
must see,"{'video_id': 'JfLnZ-XFALE', 'channel_title': 'Outlaws', 'channel_id': 'UCCOmvSHUQHoCntnNJfcyl_w', 'video_publish_date': 1740210355.0, 'video_title': 'Hilarious Moments Caught on Camera – Must See!', 'video_description': 'The funniest moments ever caught on camera! You won’t believe what happens in this video! 😂\n\n\n\n\n#FunnyMoments #CaughtOnCamera #HilariousFails #LOL #Unbelievable #CrazyLaughs #MustSee #ComedyGold #EpicFails #FunnyVideos\n\n\n\n\nOur Values In This Video*🤟\n\n1. Respect for All: We believe in treating every individual with kindness and dignity, no matter who they are.\n2. Diversity Matters: Embracing different perspectives and backgrounds enriches our conversations.\n3. Open Dialogue: We encourage constructive discussions that lead to understanding and growth.\n\nDisclaimer:👉\nThe content shared on (outlaws dream) Only To entertainment and educational purposes. Opinions expressed by individuals in videos and comments are their own and may not represent the views of the channel. We are not responsible for the accuracy or reliability of external links or information shared.\n\n🙂Copyright Credit for music credit\nCheck out official Original Video music\n\n✨All Right to above Music Label & No Copyrights Infringement intended\nDisclaimer:🙂\nCopyright Disclaimer under section 107 of the copyright Act 1976 allowance is made ""fair use"" for purposes such as criticism coment, news reporting, teaching and research fair use is a use primated by copyright statue that might otherwise be infringing non profit educational or personal use tips the balance in favor of fair use.\n\nThis video\'s is only for entertainment. \nOur porpuse to entertain audience not any creators!! so please don\'t sand any copyright issue, if you have any copyright issue 😕 please sand a single mail 💌 I will delete video on this channel.\n\noutlawzdream@gmail.com', 'video_category': '22', 'video_view_count': '34007', 'video_comment_count': '4', 'video_like_count': '469', 'video_dislike_count': None, 'video_thumbnail': 'https://i.ytimg.com/vi/JfLnZ-XFALE/hqdefault.jpg', 'video_tags': '', 'collection_date': datetime.datetime(2025, 4, 25, 17, 24, 18, 881165)}"
must see,"{'video_id': 'WB3qTVg3hhs', 'channel_title': 'ProCrafts', 'channel_id': 'UC7XDwu8JJRMPen-ZIjewhmA', 'video_publish_date': 1556173801.0, 'video_title': 'Girl Biker Performs - You Must See', 'video_description': ""Bike Stunt: Viola Brand (Artistic Cycling European Champion & Vice World Champion)\nLocation: Unibike Expo 2019 Istanbul - Bicycle and Equipment Fair\n\n❤️❤️❤️❤️❤️❤️❤️❤️❤️❤️❤️❤️❤️❤️❤️❤️❤️❤️❤️❤️❤️\n\nHere are Viola's official accounts, don't forget to follow!\n@violalovescycling\n►https://www.instagram.com/violalovescycling/\n►https://www.facebook.com/violalovescycling\n►https://www.twitch.tv/violalovescycling\n►https://www.youtube.com/channel/UC3zot4-OqYcyfEHtP5SKDEw"", 'video_category': '26', 'video_view_count': '74434745', 'video_comment_count': '59689', 'video_like_count': '662430', 'video_dislike_count': None, 'video_thumbnail': 'https://i.ytimg.com/vi/WB3qTVg3hhs/hqdefault.jpg', 'video_tags': 'female stunt rider|ayarsız motovlog|girl biker|biker|bike stunts|motorbike|awesome|viola brand|stunt|stunt bike|amazing', 'collection_date': datetime.datetime(2025, 4, 25, 17, 24, 18, 881174)}"
must see,"{'video_id': 'PfdcauFX4cE', 'channel_title': 'Loom', 'channel_id': 'UCgcz-vmOVo0A2e55S5nWvQw', 'video_publish_date': 1738072536.0, 'video_title': 'Must-See Bomb Action Movie 💥 One Soldier’s Fight Against a Ruthless Enemy', 'video_description': '', 'video_category': '22', 'video_view_count': '4761575', 'video_comment_count': '493', 'video_like_count': '15979', 'video_dislike_count': None, 'video_thumbnail': 'https://i.ytimg.com/vi/PfdcauFX4cE/hqdefault.jpg', 'video_tags': '', 'collection_date': datetime.datetime(2025, 4, 25, 17, 24, 18, 881183)}"
unthinkable,"{'video_id': 'ZRhYuFSjm6U', 'channel_title': 'DreamFilm', 'channel_id': 'UCHbqVBMNyrMphHRXZgdZkIQ', 'video_publish_date': 1727693943.0, 'video_title': 'Unthinkable 2010 | Samuel L Jackson | Crime Mystery Full Movie  Like & Subscribe', 'video_description': 'Follows a black-ops interrogator and an F.B.I. agent who try to press a suspect terrorist into divulging the location of three nuclear weapons set to detonate in the U.S.\n\n\n#hollywood #action #crime #drama #survival #cinema #english #full #thriller \nLike & Subscribe', 'video_category': '22', 'video_view_count': '189868', 'video_comment_count': '265', 'video_like_count': '2516', 'video_dislike_count': None, 'video_thumbnail': 'https://i.ytimg.com/vi/ZRhYuFSjm6U/hqdefault.jpg', 'video_tags': '', 'collection_date': datetime.datetime(2025, 4, 25, 17, 24, 18, 914337)}"
unthinkable,"{'video_id': '-ps7Fba1FtA', 'channel_title': 'Movies Cult', 'channel_id': 'UC1VXTNcUl2kJO9KrRoX9fCg', 'video_publish_date': 1723302849.0, 'video_title': 'Unthinkable (2010) – Final Scene', 'video_description': '#unthinkable  #gregorjordan #movie #clips #mystery #youtube', 'video_category': '22', 'video_view_count': '251626', 'video_comment_count': '845', 'video_like_count': '4422', 'video_dislike_count': None, 'video_thumbnail': 'https://i.ytimg.com/vi/-ps7Fba1FtA/hqdefault.jpg', 'video_tags': '', 'collection_date': datetime.datetime(2025, 4, 25, 17, 24, 18, 914346)}"
unthinkable,"{'video_id': 'KYms8VsAkzc', 'channel_title': 'Cult Classics', 'channel_id': 'UCu9WMxFB-5dDBDN--WD1xUQ', 'video_publish_date': 1725524116.0, 'video_title': 'Unthinkable Full Movie 2010 | Samuel L. Jackson, Michael Sheen', 'video_description': 'Unthinkable Full Movie 2010 | Samuel L. Jackson, Michael Sheen\n\nFBI agent Helen seeks the help of a CIA agent to find three nuclear bombs planted in undisclosed locations in the U.S. The pressure keeps mounting on them as they try to locate the bombs.\n\nInitial release: May 26, 2010\n\nDirector: Gregor Jordan', 'video_category': '22', 'video_view_count': '41293', 'video_comment_count': '56', 'video_like_count': '628', 'video_dislike_count': None, 'video_thumbnail': 'https://i.ytimg.com/vi/KYms8VsAkzc/hqdefault.jpg', 'video_tags': '', 'collection_date': datetime.datetime(2025, 4, 25, 17, 24, 18, 914353)}"
unthinkable,"{'video_id': 'gyYnt-hJlWo', 'channel_title': 'Film Trailer Channel', 'channel_id': 'UC2-FWL7Qtc-bvrS5AhiIeBw', 'video_publish_date': 1499283776.0, 'video_title': 'Unthinkable (2010) Trailer | Samuel L. Jackson | Carrie-Anne Moss', 'video_description': 'Unthinkable (2010) \n\nA psychological thriller centered around a black-ops interrogator and an FBI agent who press a suspect terrorist into divulging the location of three nuclear weapons set to detonate in the U.S.\n\nDirector: Gregor Jordan\nWriter: Peter Woodward\nStars: Samuel L. Jackson, Carrie-Anne Moss, Michael Sheen', 'video_category': '1', 'video_view_count': '870145', 'video_comment_count': '206', 'video_like_count': '3351', 'video_dislike_count': None, 'video_thumbnail': 'https://i.ytimg.com/vi/gyYnt-hJlWo/hqdefault.jpg', 'video_tags': 'Unthinkable 2010 Trailer|unthinkable trailer|Samuel L. Jackson|Carrie-Anne Moss|Michael Sheen', 'collection_date': datetime.datetime(2025, 4, 25, 17, 24, 18, 914360)}"
unthinkable,"{'video_id': 'B2vZIN_5n9g', 'channel_title': 'DanceHype', 'channel_id': 'UCXWf7qS2OkGvRSHy0WIkJ4A', 'video_publish_date': 1712509620.0, 'video_title': ""Alicia Keys - Un-thinkable (I'm Ready)"", 'video_description': 'Alicia Keys - Un-thinkable (I\'m Ready)\nStream/Download:\n\nFollow Alicia Keys:\nFacebook: https://AliciaKeys.lnk.to/followFI\nTwitter: https://AliciaKeys.lnk.to/followTI\nInstagram: https://AliciaKeys.lnk.to/followII\nWebsite: https://AliciaKeys.lnk.to/followWI\nSpotify: https://AliciaKeys.lnk.to/followSI\n\n(Lyrics):\n[Verse 1]\nMoment of honesty\nSomeone\'s gotta take the lead tonight\nWho\'s it gonna be?\nI\'m gonna sit right here and tell you all that comes to me\nIf you have somethin\' to say, you should say it right now\n(You should say it right now)\n(You ready)\n\n[Pre-Chorus]\nYou give me a feeling that I never felt before\nAnd I deserve it, I think I deserve it\nIt\'s becoming something that\'s impossible to ignore\nAnd I can\'t take it\n\n[Chorus]\nI was wonderin\', maybe, could I make you my baby?\nIf we do the unthinkable, would it make us look crazy?\nIf you ask me, I\'m ready (I\'m ready)\nIf you ask me, I\'m ready (I\'m ready)\n\n[Verse 2]\nI know you said to me\n""This is exactly how it should feel when it\'s meant to be\nTime is only wasting, so why wait for eventually?""\nIf we gon\' do somethin\' \'bout it, we should do it right now\n(We should do it right now)\nSee Alicia Keys Live\n\n[Pre-Chorus]\nYou give me a feeling that I never felt before\nAnd I deserve it, I know I deserve it\nIt\'s becoming something that\'s impossible to ignore\nIt is what we make it\n\n[Chorus]\nI was wonderin\', maybe, could I make you my baby?\nIf we do the unthinkable, would it make us look crazy\nOr would it be so beautiful?\nEither way, I\'m sayin\'\nIf you ask me, I\'m ready (I\'m ready)\nIf you ask me, I\'m ready (I\'m ready)\n\n[Bridge]\nYeah, yeah\nSayin\'\nWhy give up before we try?\nFeel the lows before the highs\nClip our wings before we fly away (Fly away)\nI can\'t say I came prepared\nI\'m suspended in the air\nWon\'t you come be in the sky with me?\n\n[Chorus]\nI was wonderin\', maybe, could I make you my baby?\nIf we do the unthinkable, would it make us look crazy\nOr would it be so beautiful?\nEither way, I\'m sayin\'\nIf you ask me, I\'m ready (I\'m ready)\nIf you ask me, I\'m ready (I\'m ready)\nIf you ask me, I\'m ready (I\'m ready)\nIf you ask me, I\'m ready (I\'m ready)\n\nTags:\nUn-thinkable (I\'m Ready) Lyrics\nAlicia Keys Un-thinkable (I\'m Ready)\nUn-thinkable (I\'m Ready) Alicia Keys\nI was wondering maybe could I make you my baby?\nIf we do the unthinkable would it make us look crazy?\nIf you ask me I\'m ready \nUn-thinkable \n\n#AliciaKeys #Unthinkable #Lyrics \n\nContact: ypmamusic@gmail.com', 'video_category': '22', 'video_view_count': '2838664', 'video_comment_count': '263', 'video_like_count': '9381', 'video_dislike_count': None, 'video_thumbnail': 'https://i.ytimg.com/vi/B2vZIN_5n9g/hqdefault.jpg', 'video_tags': ""Un-thinkable (I'm Ready) Lyrics|Alicia Keys Un-thinkable (I'm Ready)|Un-thinkable (I'm Ready) Alicia Keys|I was wondering maybe could I make you my baby?|If we do the unthinkable would it make us look crazy?|If you ask me I'm ready|Un-thinkable|un-thinkable (i'm ready) lyrics|alicia keys un-thinkable (i'm ready)|un-thinkable (i'm ready) alicia keys|un-thinkable|alicia keys un-thinkable (i'm ready) lyrics|un-thinkable (i'm ready) alicia keys lyrics|alicia keys|unthikable"", 'collection_date': datetime.datetime(2025, 4, 25, 17, 24, 18, 914366)}"
unthinkable,"{'video_id': 'z__22dgFNfE', 'channel_title': 'Look2theBooks', 'channel_id': 'UC9Fkye8jLwbZeo4wLqQWPuw', 'video_publish_date': 1293051872.0, 'video_title': 'Best Scene from Unthinkable', 'video_description': 'Samuel L Jackson being a badass as usual.', 'video_category': '22', 'video_view_count': '1449446', 'video_comment_count': '2052', 'video_like_count': '7854', 'video_dislike_count': None, 'video_thumbnail': 'https://i.ytimg.com/vi/z__22dgFNfE/hqdefault.jpg', 'video_tags': 'Unthinkable', 'collection_date': datetime.datetime(2025, 4, 25, 17, 24, 18, 914372)}"
unthinkable,"{'video_id': 'AEZLbq5o4AE', 'channel_title': 'Alicia Keys', 'channel_id': 'UCK5X3f0fxO4YnVKVZP8p6hg', 'video_publish_date': 1274296763.0, 'video_title': ""Alicia Keys - Un-Thinkable (I'm Ready) Remix feat. Drake"", 'video_description': 'Already credited for his background vocals on the original version of ""Un-Thinkable (I\'m Ready),"" Drake drops a verse on the official remix. The remix kicks off with Drake reflecting on what it\'s like to grow old.\n\nCheck out the lyrics to Drake\'s verse here - http://bit.ly/amkG4X\n\nFollow Alicia on:\n\nhttp://aliciakeys.com\nFacebook: http://smarturl.it/AKFacebook \nTwitter: http://smarturl.it/AKTwitter \nInstagram: http://smarturl.it/AKInstagram \nTumblr: http://smarturl.it/AKTumblr \nYoutube: http://smarturl.it/AKYoutube \nGoogle+: http://smarturl.it/AKGoogleplus \nSpotify: http://smarturl.it/AKSpotifyc \nMySpace: http://smarturl.it/AKMyspace', 'video_category': '10', 'video_view_count': '36259901', 'video_comment_count': '3039', 'video_like_count': '142373', 'video_dislike_count': None, 'video_thumbnail': 'https://i.ytimg.com/vi/AEZLbq5o4AE/hqdefault.jpg', 'video_tags': ""drake|un-thinkable|i'm|ready|im|remix|alicia|keys|element|of|freedom|new|song|unthinkable|alicia keys drake|alicia key drake|drak unthinkable|drake unthinkable|i'm ready|alicia keys i'm ready|alicia keys drake i'm ready"", 'collection_date': datetime.datetime(2025, 4, 25, 17, 24, 18, 914377)}"
unthinkable,"{'video_id': 'HhuGQUZJot8', 'channel_title': 'aliciakeysVEVO', 'channel_id': 'UCETZ7r1_8C1DNFDO-7UXwqw', 'video_publish_date': 1273608848.0, 'video_title': ""Alicia Keys - Un-thinkable (I'm Ready) (Official Video)"", 'video_description': 'Official video for ""Un-thinkable (I\'m Ready)"" by Alicia Keys\nListen to Alicia Keys: https://AliciaKeys.lnk.to/_listenYD\nWatch NOTED: Alicia Keys The Untold Stories 4 Part YouTube Originals Series https://aliciakeys.lnk.to/NOTED\n\nSubscribe to the official Alicia Keys YouTube channel: https://AliciaKeys.lnk.to/_subscribeYD\nWatch more videos by Alicia Keys: https://AliciaKeys.lnk.to/_listenID/youtube\n \nFollow Alicia Keys:\nFacebook: https://AliciaKeys.lnk.to/followFI\nTwitter: https://AliciaKeys.lnk.to/followTI\nInstagram: https://AliciaKeys.lnk.to/followII\nWebsite: https://AliciaKeys.lnk.to/followWI\nSpotify: https://AliciaKeys.lnk.to/followSI\n \nChorus:\nI was wondering maybe, could I make you my baby?\nIf we do the unthinkable, would it make us look crazy?\nIf you ask me, I\'m ready (I\'m ready)\nIf you ask me, I\'m ready (I\'m ready)\n \n#AliciaKeys #UnThinkable #TheElementofFreedom #TikTok #HeardOnTikTok #TikTokTrend', 'video_category': '10', 'video_view_count': '132813778', 'video_comment_count': '35533', 'video_like_count': '860873', 'video_dislike_count': None, 'video_thumbnail': 'https://i.ytimg.com/vi/HhuGQUZJot8/hqdefault.jpg', 'video_tags': ""Alicia keys|unthinkable Alicia keys|alicia keys unthinkable|unthinkable|was wondering maybe could have|back my baby|alicia keys I'm ready|I'm ready|i'm ready Alicia keys|un thinkable Alicia keys|if you ask me I'm ready|keyshia Cole|im ready|drake|unthinkable alicia keys ft drake|Contemporary R&B|Alicia Keys OFFICIAL GREATEST HITS|Alicia Keys Mix|Alicia Keys top tracks|You Don't Know My Name|Try|Sleeping|with|Broken"", 'collection_date': datetime.datetime(2025, 4, 25, 17, 24, 18, 914383)}"
