keyword,video_id
crazy,"{'video_id': 'n6B5gQXlB-0', 'channel_title': 'HYBE LABELS', 'channel_id': 'UC3IZKseVpdzPSBaWxBxundA', 'video_publish_date': 1724979488.0, 'video_title': ""LE SSERAFIM (르세라핌) 'CRAZY' OFFICIAL MV"", 'video_description': ""LE SSERAFIM (르세라핌) 'CRAZY' OFFICIAL MV \n\nCreative Director : Nu Kim  \n\nVisual Creative Coordinating : Yujoo Kim  \nStyle Directing : Yoon Cho, Soo Lee, Jay Kim\nBrand Experience Design : Yoovin Baek, Hyemin Yoo, Myungryol Shin  \nContent Production : Yurok Jang  \n\nA&R : Kyuyoung Kim, Yujeong Kim, Soyoon Park, Jennie Lee  \n\nPerformance Directing : Soyeon Park\nAssistant Directing : Yejin Lee\n\nDancers :  Lolita Juicy Couture, Tati Juicy Couture, Kimiyah Juicy Couture, Brooklyn Juicy Couture, Shakeem Juicy Couture, Dae Dae Juicy Couture, Antonio Juicy Couture, Mekhi Juicy Couture  (The Creative Director)\nSimba Juicy Couture (ICONIC HOUSE OF JUICY COUTURE)\n\nMusic Video Director : Yunah Sheep @amoramorsheep\nExecutive Producer : Joo-hun Kim(LIMINAL) @kimjuhne\nA.D : Heonryoung Yuk, EJ\n\nLine Producer : Chanyoung Park, Hyounggeun Kang\nP.A : Wonsung Yoon, Wonjeong Jeong, Yuseok Joung, Donghwan Youn, Chanhyuk Park, Olive, Hyunho Kim, Minju Kim, Minjun Lee\n\nDirector of Photography : Jinhyuk Lee\nFocus Puller : Kang Hong, Donghyeok Shin\n2nd AC : Gunwoo Jeong, Jinwook Lee\nDIT : Minho Kim\n3rd AC : Minseong Kim\n\nGaffer : Joonghyuk Jung\nLighting Crew : Hyunsuk Kim, Minhyeok Baek, Daejin Kim, Bonhyeop Gu, Hwayong Chung, Jihyeon Choi, Dongyun Sin, Byungjong Kim, Yerim Jin, Juhan Cho\n\nShow light : Sunggang Jeon, Wooseok Jang, Sunho Jang, Sangmin Park, Myeongun Park(J-Show company)\n\nArt Director : NOMESS\nArt Team Leader : JungSik Lee, ChaeJeong Kim, JiHyun Park, HyoJin Oh\nArt Team : TaeMin Kim, Hakju Kim, Jungkyun Kim, Seoyoung Lim, Junho Moon, Myeonghee Kim\nPaint : Murallife\nAntenna Helmets made by Hermit C - Lab\nGalileo Galilei Statue Made by Pygmalion\n\nJimmy jib Operator : Youngu Ji\n1st Assistant : Jinho You\n2nd Assistant : Seongjun You\n3rd Assistant : Mingi Jung\n\nRC Cordinator : Younghwan Kim\nRC Driver : Seoho Bae\nRC Assistant : Hongyun Won\n\nSFX : Changi Min(SF)\n\nKR Movement Director : Sukyung Yoo\nKR Dancer : Seungju Kwak, Nari Kim, Namhoon Kim, Jungju Kim, Junhee Kim, Jeonguk Park, Yijin Sea, Sangwoo Son, Minwoo Yu, Daegyo Han, Hyeonji Han\n\nDancer Styling : Yujae Chang, Hyebin Byun\n\nConti : Youseung Park\n\nEdit : Yunah Sheep\n\nVFX Supervisor : Soohwan Oh\n3D / FX Artist : Calars\nMatchmove : Wonho Jung\n2D Graphic Source : Dohyeong Kim\n\n2D VFX(graphic) : Hanbin Kim\n\n2D Cleaning : Kangho Jo\n\nColorist : Changbeen Yu\nDI Assistant : Soyeon Kim, Nayeon Kim, Seowoo Kang\n\nSOURCE MUSIC. Rights are reserved selectively in the video.\nUnauthorized reproduction is a violation of applicable laws.\nManufactured by SOURCE MUSIC, Seoul, Korea\n\nConnect with LE SSERAFIM:\nOFFICIAL INSTAGRAM https://www.instagram.com/le_sserafim/\nOFFICIAL X (TWITTER) https://x.com/le_sserafim\nOFFICIAL JAPAN X (TWITTER) https://x.com/le_sserafim_jp\nOFFICIAL FACEBOOK https://www.facebook.com/official.lesserafim/\nOFFICIAL WEVERSE https://weverse.onelink.me/qt3S/t2ra8uwj\nOFFICIAL TIKTOK https://www.tiktok.com/@le_sserafim\nOFFICIAL WEIBO https://weibo.com/LESSERAFIM\nOFFICIAL BILIBILI https://space.bilibili.com/627577002\nOFFICIAL DOUYIN https://v.douyin.com/iJgLJpUp/\nOFFICIAL SOUNDCLOUD https://soundcloud.com/le_sserafim_official\n\n#LE_SSERAFIM #르세라핌 #LE_SSERAFIM_CRAZY"", 'video_category': '10', 'video_view_count': '140124469', 'video_comment_count': '69177', 'video_like_count': '1479153', 'video_dislike_count': None, 'video_thumbnail': 'https://i.ytimg.com/vi/n6B5gQXlB-0/hqdefault.jpg', 'video_tags': 'HYBE|HYBE LABELS|하이브|하이브레이블즈', 'collection_date': datetime.datetime(2025, 4, 25, 17, 24, 19, 199899)}"
crazy,"{'video_id': 'k85mRPqvMbE', 'channel_title': 'Crazy Frog', 'channel_id': 'UC4XR0EZ0oHwSV2XhhShzX5A', 'video_publish_date': 1245202253.0, 'video_title': 'Crazy Frog - Axel F (Official Video)', 'video_description': 'Stream/Buy@crazyfrogMusic: https://bit.ly/CrazyFrogMusic\nSubscribe to@crazyfrogYT Channel: https://bit.ly/CrazyFrogYoutube\nEnjoy more @crazyfrogVideos: https://bit.ly/CrazyFrogOfficialPlaylist \n✘ Feel free to share it and don\'t forget to hit the 🛎️  \n\n✘ Tik Tok: https://www.tiktok.com/@crazyfrogofficial\n✘ Instagram: https://www.instagram.com/thecrazyfrogofficial\n✘ X (Twitter): https://twitter.com/TrueCrazyFrog\n✘ Facebook: https://www.facebook.com/thecrazyfrogofficial\n✘ Discord: http://www.discord.gg/crazyfrog\n✘ VK: https://vk.com/crazyfrogofficial\n✘ Reddit: https://www.reddit.com/user/TheCrazyFrogOfficial\n✘ Homepage: https://www.crazyfrog.tv\n\n@crazyfrogOfficial Video PLAYLIST: \n► Crazy Frog all official Videos https://bit.ly/CrazyFrogOfficialPlaylist ◀︎\n► Crazy Frog все официальные песни https://bit.ly/CrazyFrogOfficialPlaylist ◀︎\n► Crazy Frog todas as músicas oficiais https://bit.ly/CrazyFrogOfficialPlaylist ◀︎ \n► Crazy Frog tất cả các bài hát chính thức https://bit.ly/CrazyFrogOfficialPlaylist ◀︎\n► क्रेजी फ्रॉग सभी आधिकारिक गाने https://bit.ly/CrazyFrogOfficialPlaylist◀︎\n► Crazy Frog tüm resmi şarkıları https://bit.ly/CrazyFrogOfficialPlaylist◀︎\n► Crazy Frog tous les morceaux officiels https://bit.ly/CrazyFrogOfficialPlaylist◀︎\n\n2022 (p)&(c) Mach1 Records GmbH & Co KG\nAll music tracks are produced by Reinhard Raith, Henning Reith and Wolfgang Boss for voodoo music GmbH\n\nAll videos directed by Sigfrid Söderberg and Andreas Wicklund and produced by Kaktus for Mach 1 Records Gmbh & Co KG\n\n#crazyfrog #axelf #soundtrack \n\nLyrics: \n\nRing ding ding daa baa\nBaa aramba baa bom baa barooumba\n\nWh-wha-what\'s going on-on?\nDing, ding\nThis is the Crazy Frog\nDing, ding\n\nBem, bem!\n\nRing ding ding ding ding ding\nRing ding ding ding bem bem bem\nRing ding ding ding ding ding\nRing ding ding ding baa baa\n\nRing ding ding ding ding ding\nRing ding ding ding bem bem bem\nRing ding ding ding ding ding\nThis is the Crazy Frog\nBreakdown!\n\nDing, ding\n\nBr-br-break it, br-break it\nDum dum dumda dum dum dum\nDum dum dumda dum dum dum\nDum dum dumda dum dum dum\nBem, bem!\n\nDum dum dumda dum dum dum\nDum dum dumda dum dum dum\nDum dum dumda dum dum dum\nThis is the Crazy Frog\n\nA ram me ma bra ba bra bra rim bran\nDran drra ma mababa baabeeeaaaaaaa!\n\nDing, ding\nThis is the Crazy Frog\n\nDing, ding\n\nDa, da\nRing ding ding ding ding ding\nRing ding ding ding bem bem bem\nRing ding ding ding ding ding\nRing ding ding ding baa baa\n\nRing ding ding ding ding ding\nRing ding ding ding bem bem bem\nRing ding ding ding ding ding\nThis is the Crazy Frog\n\nDing, ding\n\nBr-br-break it, br-break it\n\nDum dum dumda dum dum dum\nDum dum dumda dum dum dum\nDum dum dumda dum dum dum\nBem, bem!\n\nDum dum dumda dum dum dum\nDum dum dumda dum dum dum\nDum dum dumda dum dum dum\nThis is the Crazy Frog\n\nBem, bem!\n\nCheck out the official music video for Crazy Frog\'s worldwide hit ""Axel F""! This catchy and fun tune is sure to get you dancing. Don\'t miss out on this crazy frog phenomenon that took the world by storm. Watch now and get ready to sing and dance along!\n\nIn this Crazy Frog Axel F official video, the wacky amphibian goes on a really fun adventure! He jumps through hoops, does flips and even dances to some catchy music.\n\nAxel F is the perfect meme for when you just need a little bit of comedic relief. Watch this hilarious animation and enjoy the laughs!', 'video_category': '10', 'video_view_count': '5180614150', 'video_comment_count': '753153', 'video_like_count': '19826745', 'video_dislike_count': None, 'video_thumbnail': 'https://i.ytimg.com/vi/k85mRPqvMbE/hqdefault.jpg', 'video_tags': 'Crazy Frog Axel F|crazy frog axel f|crazy frog dance|crazy frog cover|crazy frog remix|Frog|Crazy Frog|axel f remix|the crazy frog|ring ding ding|axel f anime|крейзи фрог|la rana loca|beng beng|الضفدع المجنون|rana loca|axelf|bem bem|axel foley|crazy|axel f|疯狂青蛙|crazy frog|krejzi frog|funny frog|axel f.|axel f song|axel f frog|crazy frog music|crazy frog meme|Crazy Frog - Axel F (Official Video)|axel f crazy|AxelF', 'collection_date': datetime.datetime(2025, 4, 25, 17, 24, 19, 199910)}"
crazy,"{'video_id': '-N4jf6rtyuw', 'channel_title': 'Gnarls Barkley Official', 'channel_id': 'UC6qCqY_Aftl3i6jA5Ynx0Yw', 'video_publish_date': 1256604826.0, 'video_title': 'Gnarls Barkley - Crazy (Official Video) [4K Remaster]', 'video_description': 'The official 4K video for ""Crazy"" by Gnarls Barkley from the album \'St. Elsewhere\' - available now!\n\nLyrics:\n\nI remember when\nI remember, I remember when I lost my mind\nThere was something so pleasant about that place\nEven your emotions have an echo in so much space\n\nAnd when you\'re out there without care\nYeah, I was out of touch\nBut it wasn\'t because I didn\'t know enough\nI just knew too much\n\nDoes that make me crazy?\nDoes that make me crazy?\nDoes that make me crazy?\nPossibly\n\nAnd I hope that you are having the time of your life\nBut think twice, that\'s my only advice\nCome on now, who do you, who do you, who do you\nWho do you think you are\nHa ha ha, bless your soul\nYou really think you\'re in control\n\nI think you\'re crazy\nI think you\'re crazy\nI think you\'re crazy\nJust like me\n\nMy heroes had the heart to lose their lives out on the limb\nAnd all I remember is thinking I want to be like them\n\nEver since I was little\nEver since I was little it looked like fun\nAnd it\'s no coincidence I\'ve come\nAnd I can die when I\'m done\n\nBut maybe I\'m crazy\nMaybe you\'re crazy\nMaybe we\'re crazy\nProbably', 'video_category': '10', 'video_view_count': '377463135', 'video_comment_count': '41250', 'video_like_count': '2855441', 'video_dislike_count': None, 'video_thumbnail': 'https://i.ytimg.com/vi/-N4jf6rtyuw/hqdefault.jpg', 'video_tags': 'Gnarls Barkley|Crazy|Pop|Atlantic Records|St. Elsewhere|i remember when lyrics|i remember when tiktok|i remember i remember when i lost my mind tiktok|i remember when i lost my mind tiktok|gnarls barkley crazy|crazy gnarls barkley|crazy lyrics|i remember when i lost my mind song|gnarls barkley crazy song|crazy song', 'collection_date': datetime.datetime(2025, 4, 25, 17, 24, 19, 199918)}"
crazy,"{'video_id': 'Sw120IXPv2Y', 'channel_title': 'imsurya', 'channel_id': 'UCF4H3tHUrfFl5OEfSnXYQgg', 'video_publish_date': 1724985623.0, 'video_title': 'LE SSERAFIM (르세라핌) ‘CRAZY’ [MUSIC AUDIO]', 'video_description': '#LE_SSERAFIM #CRAZY #LE_SSERAFIM_CRAZY #르세라핌 #르세라핌_CRAZY', 'video_category': '10', 'video_view_count': '2595485', 'video_comment_count': None, 'video_like_count': None, 'video_dislike_count': None, 'video_thumbnail': 'https://i.ytimg.com/vi/Sw120IXPv2Y/hqdefault.jpg', 'video_tags': 'LE SSERAFIM|르세라핌|CRAZY|LE SSERAFIM (CRAZY)|르세라핌 (CRAZY)', 'collection_date': datetime.datetime(2025, 4, 25, 17, 24, 19, 199925)}"
crazy,"{'video_id': 'wJwUjuKr_54', 'channel_title': 'STUDIO CHOOM [스튜디오 춤]', 'channel_id': 'UCEIi7zFR_wE23jFncVtd6-A', 'video_publish_date': 1725012012.0, 'video_title': ""LE SSERAFIM(르세라핌) 'CRAZY' (4K) | STUDIO CHOOM ORIGINAL"", 'video_description': '[STUDIO CHOOM ORIGINAL] LE SSERAFIM \'CRAZY\'\n[스튜디오 춤 오리지널] 르세라핌 \'크레이지\'\n\n르세라핌 이번 컴백 한 마디로 ""미쳤다""🔥\n(2:31) 적당히 미치는 거 그게 뭔데 어떻게 하는 건데\n\n#LE_SSERAFIM #르세라핌 #SC_ORIGINAL\n\nStream various performance video on #STUDIOCHOOM!\n\n👉SUBSCRIBE👈\nYouTube: https://www.youtube.com/STUDIOCHOOM\nFacebook:  https://www.facebook.com/StudioCHOOM\nInstagram: https://www.instagram.com/studio_choom/\nNaver TV: https://tv.naver.com/cjenm.STUDIOCHOOM', 'video_category': '24', 'video_view_count': '12267913', 'video_comment_count': '4611', 'video_like_count': '251068', 'video_dislike_count': None, 'video_thumbnail': 'https://i.ytimg.com/vi/wJwUjuKr_54/hqdefault.jpg', 'video_tags': 'AOTM|Artist Of The Month|BE ORIGINAL|COVER|COVERS|DANCE|DANCE THE X|Drop the dance|LE SSERAFIM|M2|Mix & Max|Studio choom|chaewon|crazy le sserafim|eunchae|hong eunchae|huh yunjin|kazuha|kim chaewon|le sserafim|le sserafim crazy|les serafim|les serafim crazy|sakura|yunjin|김채원|댄스|댄스 더 엑스|드롭더댄스|르세라핌|르세라핌 크레이지|믹스앤맥스|믹앤맥|비 오리지널|사쿠라|스춤|스튜디오 춤|엠투|윤진|은채|채원|카즈하|커버|커버스|허윤진|홍은채', 'collection_date': datetime.datetime(2025, 4, 25, 17, 24, 19, 199931)}"
crazy,"{'video_id': 'NMNgbISmF4I', 'channel_title': 'AerosmithVEVO', 'channel_id': 'UCiXsh6CVvfigg8psfsTekUA', 'video_publish_date': 1261722419.0, 'video_title': 'Aerosmith - Crazy (Official Music Video)', 'video_description': 'Official Music Video for “Crazy” performed by Aerosmith, REMASTERED IN HD! \n\nThe music video for ""Crazy"" features Alicia Silverstone for her third time in an Aerosmith video.\n\nListen to more from Aerosmith: https://stream.lnk.to/AerosmithYD\nSubscribe to Aerosmith’s YouTube channel: https://aerosmith.lnk.to/YTSignupYD\n \nFollow Aerosmith:\n💥 https://facebook.com/aerosmith\n💥 https://twitter.com/Aerosmith\n💥 https://instagram.com/aerosmith\n💥 https://tiktok.com/@aerosmith  \n\nShop official merch from Aerosmith: https://store.aerosmith.com\n\nSign up for Aerosmith’s official email newsletter: https://aerosmith.lnk.to/NewsletterYD\n\n#Aerosmith #Crazy\n\nMusic video by Aerosmith performing Crazy. (C) 1994 Geffen Records', 'video_category': '10', 'video_view_count': '705581513', 'video_comment_count': '47260', 'video_like_count': '2250110', 'video_dislike_count': None, 'video_thumbnail': 'https://i.ytimg.com/vi/NMNgbISmF4I/hqdefault.jpg', 'video_tags': 'AEROSMITH|AEROSMITH CRAZY|CRAZY|CRAZY AEROSMITH|CRAZY official music video|CRAZY remastered video|AEROSMITH remastered|AEROSMITH remastered videos|#remastered|hd music videos|remastered music videos|HDaerosmith crazy|crazy aerosmith original video hd', 'collection_date': datetime.datetime(2025, 4, 25, 17, 24, 19, 199937)}"
crazy,"{'video_id': 'ofkbJUBqFyw', 'channel_title': 'Boosie Badazz - Topic', 'channel_id': 'UC4ZUNBlvzlWWRWzz6-vTg9A', 'video_publish_date': 1412624936.0, 'video_title': 'Crazy', 'video_description': 'Provided to YouTube by Atlantic/Trill\n\nCrazy · Boosie BadAzz\n\nCrazy\n\n℗ 2014 Trill Entertainment/Atlantic Recording Corporation\n\nLead Vocals: Boosie BadAzz\n\nAuto-generated by YouTube.', 'video_category': '10', 'video_view_count': '37861091', 'video_comment_count': '1876', 'video_like_count': '420213', 'video_dislike_count': None, 'video_thumbnail': 'https://i.ytimg.com/vi/ofkbJUBqFyw/hqdefault.jpg', 'video_tags': 'Boosie BadAzz|Crazy', 'collection_date': datetime.datetime(2025, 4, 25, 17, 24, 19, 199943)}"
crazy,"{'video_id': 'fMpnuYBcA_I', 'channel_title': '湖南国际频道 Hunan TV International  Official Channel', 'channel_id': 'UCVLttLh5BDJanodvbmlNzHg', 'video_publish_date': 1715389226.0, 'video_title': '《歌手2024》第一期Faouzia《Crazy》""Singer 2024"" first issue Faouzia ""Crazy""', 'video_description': '', 'video_category': '29', 'video_view_count': '878974', 'video_comment_count': '994', 'video_like_count': '13420', 'video_dislike_count': None, 'video_thumbnail': 'https://i.ytimg.com/vi/fMpnuYBcA_I/hqdefault.jpg', 'video_tags': '', 'collection_date': datetime.datetime(2025, 4, 25, 17, 24, 19, 199950)}"
crazy,"{'video_id': 'tsS69gld8Ls', 'channel_title': 'HYBE LABELS', 'channel_id': 'UC3IZKseVpdzPSBaWxBxundA', 'video_publish_date': 1733832001.0, 'video_title': ""LE SSERAFIM (르세라핌) 'CRAZY -Japanese ver.-' Official MV"", 'video_description': ""LE SSERAFIM (르세라핌) 'CRAZY -Japanese ver.-' Official MV\n\nVisual Creative Coordinating : Yujoo Kim  \nStyle Directing : Yoon Cho, Soo Lee, Jay Kim\nBrand Experience Design : Yoovin Baek, Hyemin Yoo, Myungryol Shin  \nContent Production : Yurok Jang \n\nA&R : Kyuyoung Kim, Yujeong Kim, Soyoon Park, Jennie Lee  \n\nFilm Director: Jaeyeob Bang\nAD: Hyeji Kim, Kibeom Jang, Saro Kim, Hansol Kim, Jimin Ahn, Soyeon Bae\n\nExecutive Producer: Daye Noh (Studio Noot) \nProducer: Minju Kim \nPA: Changjun Kim, Kiwoong Kim\nProduction Team: Jonghoon Shim, Yonghyun Yoo, Hyodong Lee, Byungjin Lee, Changwook Park\n\nDirector of Photography: Inseok Jung\n1st AC: Yunhwan Park\n2nd AC: Jungeun Lee\n3rd AC: Jeongung Choi\nDIT: Sungeun Kim\n\nKey Grip: Sangjun Lee\nBest Boy: Junhee Lee\nGrip: Jaeman Kim, Seunghyeon Yoon\n\nGaffer: Jong Hwan Oh (High Light)\n1st: Hyung Gyun Kim\n2nd: Sung Hoon Park, Kyung Hwan Lee\n3rd: Seung Min Kim, Ji Ho Um, Seung Hyuk Yeom\n\nArt Director: Yerin Choi\nTeam Leader: Hyojung Choi\nArt Team: Hongyee Kim, Rhooney Lee\n\nLocation Manager: Sepil Jang, Jimin Son\n\nColorist: Changbeen Yu (Vision Commercial)\n\nSOURCE MUSIC. Rights are reserved selectively in the video.\nUnauthorized reproduction is a violation of applicable laws.\nManufactured by SOURCE MUSIC, Seoul, Korea\n\nConnect with LE SSERAFIM:\nOFFICIAL INSTAGRAM https://www.instagram.com/le_sserafim/\nOFFICIAL X (TWITTER) https://x.com/le_sserafim\nOFFICIAL JAPAN X (TWITTER) https://x.com/le_sserafim_jp\nOFFICIAL FACEBOOK https://www.facebook.com/official.lesserafim/\nOFFICIAL WEVERSE https://weverse.onelink.me/qt3S/t2ra8uwj\nOFFICIAL TIKTOK https://www.tiktok.com/@le_sserafim\nOFFICIAL WEIBO https://weibo.com/LESSERAFIM\nOFFICIAL BILIBILI https://space.bilibili.com/627577002\nOFFICIAL DOUYIN https://v.douyin.com/iJgLJpUp/\nOFFICIAL SOUNDCLOUD https://soundcloud.com/le_sserafim_official\n\n#LE_SSERAFIM #르세라핌 #CRAZY_JP"", 'video_category': '10', 'video_view_count': '6053517', 'video_comment_count': '3708', 'video_like_count': '152121', 'video_dislike_count': None, 'video_thumbnail': 'https://i.ytimg.com/vi/tsS69gld8Ls/hqdefault.jpg', 'video_tags': 'HYBE|HYBE LABELS|하이브|하이브레이블즈', 'collection_date': datetime.datetime(2025, 4, 25, 17, 24, 19, 199956)}"
crazy,"{'video_id': 'YhzF50WE3w0', 'channel_title': 'MBCkpop', 'channel_id': 'UCe52oeb7Xv_KaJsEzcKXJJg', 'video_publish_date': 1725078310.0, 'video_title': 'LE SSERAFIM (르세라핌) - CRAZY | Show! MusicCore | MBC240831방송', 'video_description': 'LE SSERAFIM (르세라핌) - CRAZY | Show! MusicCore | MBC240831방송\n\n#LESSERAFIM #CRAZY #MBCKPOP\n\n★★★More clips are available★★★\n\niMBC\nhttps://program.imbc.com/musiccore\n\nⓒ MBC&iMBC 무단 전재, 재배포 및 이용(AI학습 포함) 금지', 'video_category': '10', 'video_view_count': '1940817', 'video_comment_count': '5284', 'video_like_count': '60828', 'video_dislike_count': None, 'video_thumbnail': 'https://i.ytimg.com/vi/YhzF50WE3w0/hqdefault.jpg', 'video_tags': 'mbc|KPOP|dance|song|korea|korean|show|music core|live|stage|girl|boy|idol|한류|korean wave|ingigayo|show champion|mnet|엠넷|music bank|쇼 음악중심|쇼음악중심|쇼음중|음중|예능 연구소 르세라핌|르세라핌|LE SSERAFIM|CRAZY|LE SSERAFIM Fancam|CRAZY Fancam|르세라핌 직캠|LE SSERAFIM CRAZY|허윤진|김채원|카즈하|사쿠라|홍은채|SAKURA|KIM CHAEWON', 'collection_date': datetime.datetime(2025, 4, 25, 17, 24, 19, 199965)}"
crazy,"{'video_id': 'bbs_RSZwa-I', 'channel_title': 'LE SSERAFIM', 'channel_id': 'UCs-QBT4qkj_YiQw1ZntDO3g', 'video_publish_date': 1725523201.0, 'video_title': 'LE SSERAFIM (르세라핌) ‘CRAZY’ Dance Practice (Fix ver.)', 'video_description': '#LE_SSERAFIM #르세라핌 공식 채널\n#LE_SSERAFIM #르세라핌 OFFICIAL CHANNEL\n\nConnect with LE SSERAFIM:\nOFFICIAL INSTAGRAM https://www.instagram.com/le_sserafim/\nOFFICIAL X (TWITTER) https://x.com/le_sserafim\nOFFICIAL JAPAN X (TWITTER) https://x.com/le_sserafim_jp\nOFFICIAL FACEBOOK https://www.facebook.com/official.lesserafim/\nOFFICIAL WEVERSE https://weverse.onelink.me/qt3S/t2ra8uwj\nOFFICIAL TIKTOK https://www.tiktok.com/@le_sserafim\nOFFICIAL WEIBO https://weibo.com/LESSERAFIM\nOFFICIAL BILIBILI https://space.bilibili.com/627577002\nOFFICIAL DOUYIN https://v.douyin.com/iJgLJpUp/\nOFFICIAL SOUNDCLOUD https://soundcloud.com/le_sserafim_official \n\n#LE_SSERAFIM #르세라핌 #LE_SSERAFIM_CRAZY', 'video_category': '10', 'video_view_count': '3566433', 'video_comment_count': '957', 'video_like_count': '83078', 'video_dislike_count': None, 'video_thumbnail': 'https://i.ytimg.com/vi/bbs_RSZwa-I/hqdefault.jpg', 'video_tags': 'LE SSERAFIM|르세라핌|김채원|사쿠라|허윤진|카즈하|홍은채|KPOP|아이돌|걸그룹|4세대|Idol|하이브|hybe|케이팝|댄스|dance|음악|노래|music|KIMCHAEWON|SAKURA|HUHYUNJIN|KAZUHA|HONGEUNCHAE|르세라핌 김채원|르세라핌 사쿠라|르세라핌 허윤진|르세라핌 카즈하|르세라핌 홍은채|LE SSERAFIM KIMCHAEWON|LE SSERAFIM SAKURA|LE SSERAFIM HUHYUNJIN|LE SSERAFIM KAZUHA|LE SSERAFIM HONGEUNCHAE|ルセラフィム|キム・チェウォン|サクラ|ホ・ユンジン|カズハ|ホン・ウンチェ|춤|안무|퍼포먼스|choreography|performance|stage|연습|practice|시상식|무대|행사|축제|festival', 'collection_date': datetime.datetime(2025, 4, 25, 17, 24, 19, 199972)}"
crazy,"{'video_id': 'ziliGKfW2I0', 'channel_title': 'JulioIglesiasVEVO', 'channel_id': 'UC4UyuUdOuKEntzhEpmf0AFw', 'video_publish_date': 1320970162.0, 'video_title': 'Julio Iglesias - Crazy', 'video_description': 'Watch the official music video for ""Crazy"" by Julio Iglesias\nListen to the album “Crazy” by Julio Iglesias: https://JulioIglesias.lnk.to/listenYD\n\nSubscribe to the official Julio Iglesias YouTube channel: \nhttps://JulioIglesias.lnk.to/subscribeYD\n\nFollow Julio Iglesias: \nFacebook: https://JulioIglesias.lnk.to/followFI\nTwitter: https://JulioIglesias.lnk.to/followTI\nInstagram: https://JulioIglesias.lnk.to/followII\nWebsite: https://JulioIglesias.lnk.to/followWI\nSpotify: https://JulioIglesias.lnk.to/followSI\nYoutube: https://JulioIglesias.lnk.to/subscribeYD\n\n#JulioIglesias #OfficialVideo #Crazy', 'video_category': '10', 'video_view_count': '13382115', 'video_comment_count': '3111', 'video_like_count': '81758', 'video_dislike_count': None, 'video_thumbnail': 'https://i.ytimg.com/vi/ziliGKfW2I0/hqdefault.jpg', 'video_tags': 'julio iglesias|crazy|julio iglesias crazy|my love|me olvide de vivir|la media vuelta|jurame|usted|se que volveras|my way|ella|hey spanish version|la carretera|soy un truhan|soy un senor|live|spanish|lyrics|official|songs|Sony|moonlight lady', 'collection_date': datetime.datetime(2025, 4, 25, 17, 24, 19, 199977)}"
impossible,"{'video_id': 'mzAwKKRGXSk', 'channel_title': 'Dan Music', 'channel_id': 'UCq46lKycfqrBtUPTxUk_NRQ', 'video_publish_date': 1695978076.0, 'video_title': 'James Arthur - Impossible (Lyrics)', 'video_description': ""James Arthur - Impossible (Lyrics)\nJames Arthur - Impossible \nGet it here:\n\nFollow James Arthur\n http://www.jamesarthurofficial.com/\n https://www.facebook.com/JamesArthur/\n https://twitter.com/JamesArthur23\n  \nFollow Dan Music\n    https://www.instagram.com/dan___music/\n    https://web.facebook.com/Danmusic4/\n\nLyrics:\n\nHmm\nI remember years ago\nSomeone told me I should take\nCaution when it comes to love, I did\nAnd you were strong and I was not\nMy illusion, my mistake\nI was careless, I forgot, I did\nAnd now\nWhen all is done, there is nothing to say\nYou have gone and so effortlessly\nYou have won, you can go ahead tell them\nTell them all I know now\nShout it from the roof tops\nWrite it on the sky line\nAll we had is gone now\nTell them I was happy\nAnd my heart is broken\nAll my scars are open\nTell them what I hoped would be impossible\nImpossible\nImpossible\nImpossible\nFalling out of love is hard\nFalling for betrayal is worse\nBroken trust and broken hearts\nI know, I know\nAnd thinking all you need is there\nBuilding faith on love and words\nEmpty promises will wear\nI know\nI know and now\nWhen all is done, there is nothing to say\nAnd if you're done with embarrassing me\nOn your own you can go ahead tell them\nTell them all I know now\nShout it from the roof tops\nWrite it on the sky line\nAll we had is gone now\nTell them I was happy\nAnd my heart is broken\nAll my scars are open\nTell them what I hoped would be impossible\nImpossible\nImpossible\nImpossible\nI remember years ago\nSomeone told me I should take\nCaution when it comes to love\nI did\nTell them all I know now\nShout it from the roof tops\nWrite it on the sky line\nAll we had is gone now\nTell them I was happy\nAnd my heart is broken\nOh what I hoped would be impossible\nImpossible (impossible)\nImpossible (impossible)\n(Impossible)\nimpossible\n(Impossible) impossible\n(Impossible)\nImpossible\n\nLyric video for by on Dan Music\n\n#JamesArthur #Impossible #DanMusic \n\nDive into the emotive lyrics of 'Impossible' by James Arthur! \nExperience the poignant melody and powerful words of this unforgettable love song.\n\nContact - contact@danmusic.net"", 'video_category': '10', 'video_view_count': '64993219', 'video_comment_count': '5539', 'video_like_count': '311113', 'video_dislike_count': None, 'video_thumbnail': 'https://i.ytimg.com/vi/mzAwKKRGXSk/hqdefault.jpg', 'video_tags': 'Dan Music|Impossible|James Arthur|all my scars are open|falling like the stars|impossible cover|impossible lyric|impossible lyrics|impossible song|james arthur cover|james arthur falling like the stars|james arthur impossible|james arthur lyrics|james arthur new song|james arthur songs|lagu barat|love songs|official video james arthur|pop music|romantic music|sad songs|shout it from the rooftops|songs with lyrics|write it on the skyline|x factor', 'collection_date': datetime.datetime(2025, 4, 25, 17, 24, 19, 208944)}"
