keyword,video_id
amazing,"{'video_id': 'N_UFbCGVKnE', 'channel_title': 'Dan Music', 'channel_id': 'UCq46lKycfqrBtUPTxUk_NRQ', 'video_publish_date': 1644927795.0, 'video_title': 'Rex Orange County - AMAZING (Lyrics)', 'video_description': ""don't change a thing you are amazing lyrics song tiktok\nwhos gonna save me now i hope it's you my babe \n\nRex Orange County - AMAZING (Lyrics)\nGet it here:  https://ROC.lnk.to/AMAZING\n\nFollow Rex Orange County\n http://www.rexorangecounty.com\n http://www.twitter.com/rexorangecounty\n http://www.instagram.com/rexorangecounty\n http://www.facebook.com/rexorangecounty\n https://www.tiktok.com/@rex\n\n📸Image Taken From \n   https://unsplash.com/\n\n📱Follow me on\n    https://www.instagram.com/dan___music/\n    https://web.facebook.com/Danmusic4/\n\nSong Lyrics:\n\nThere's no way to time it\nAnd where you may find it\nIs unknown\nUntil then, you're a loner\nSo you see her (her)\nShe's over in the corner (corner)\nAnd you can't ignore her (you can't ignore her)\nThere must be a reason\nYou see it, believe it now\n\n Search the definition of shame\nI'm sure you'll see my face\nWho's gonna save me now?\nI hope it's you, my babe\n\n Don't change a thing, you are amazing\nI can't believe you've come and saved me\nWe can stay here, spend every day here\nI don't mind, no\nDon't change a thing, you are amazing\nI can't believe you've come and saved me\nWe can stay here, spend every day here\nI don't mind\n\n I see her\nShe's over in the corner\nAnd I can't ignore her\nI hope there's a reason\nTo see it, I see it now (now, oh)\n\n Search the definition of afraid\nAnd I'm sure you'll see my face\nWho's gonna save me now?\nI hope it's you, my babe\n\n Don't change a thing, you are amazing\nI can't believe you've come and saved me\nWe can stay here, spend every day dear\nI wouldn't mind\nDon't change a thing, you are amazing\nI can't believe you've come and saved me\nWe can stay here, spend every day here\nOh, I don't mind, that's alright\n\nLyric video for AMAZING  by Rex Orange County on Dan Music\n\nContact - danmusicwork@gmail.com\n\n#RexOrangeCounty #AMAZING #WHOCARES\n\nTags:\nrex orange county amazing\nrex orange county amazing lyrics\ndont change a thing you are amazing lyrics rex,\nwhos gonna save me now i hope it's you my babe lyrics song tiktok"", 'video_category': '10', 'video_view_count': '18509910', 'video_comment_count': '926', 'video_like_count': '81451', 'video_dislike_count': None, 'video_thumbnail': 'https://i.ytimg.com/vi/N_UFbCGVKnE/hqdefault.jpg', 'video_tags': ""dan music|Rex Orange County|AMAZING|Lyrics|rex orange county amazing|rex orange county|roc|rex|amazing|dont change a thing you are amazing|whos gonna save me now i hope it's you my babe|dont change a change u r amazing|dont change a thing u are amazing|roc dont change a thing you are amazing rex|roc amazing|rex amazing|amazing lyrics|rex orange county amazing lyrics video|amazing lyrics video|rex amazing lyric video|pop music|pop hits"", 'collection_date': datetime.datetime(2025, 4, 25, 17, 24, 19, 47857)}"
amazing,"{'video_id': 'zSmOvYzSeaQ', 'channel_title': 'AerosmithVEVO', 'channel_id': 'UCiXsh6CVvfigg8psfsTekUA', 'video_publish_date': 1261707367.0, 'video_title': 'Aerosmith - Amazing (Official Music Video)', 'video_description': 'REMASTERED IN HD!\nListen to more from Aerosmith: https://lnk.to/AeroBestOf\nExplore the incredible history of Aerosmith here: https://www.udiscovermusic.com/artists/aerosmith/\n\nStream a playlist of their biggest tracks: http://playlists.udiscovermusic.com/playlist/aerosmith-best-of\n\nExperience Aerosmith on Vinyl LP:\nhttps://lnk.to/tLBN1\n\nFollow Aerosmith\nhttps://www.facebook.com/aerosmith/\nhttps://twitter.com/Aerosmith\nhttps://www.instagram.com/aerosmith/\nhttp://www.aerosmith.com/\n\n#Aerosmith #Amazing #Remastered\n\nMusic video by Aerosmith performing Amazing.  YouTube view counts pre-VEVO: 3,587,475. (C) 1994 UMG Recordings, Inc.', 'video_category': '10', 'video_view_count': '307668549', 'video_comment_count': '20624', 'video_like_count': '804145', 'video_dislike_count': None, 'video_thumbnail': 'https://i.ytimg.com/vi/zSmOvYzSeaQ/hqdefault.jpg', 'video_tags': 'AEROSMITH|AEROSMITH AMAZING|AMAZING|AMAZING AEROSMITH|AMAZING official music video|AMAZING remastered video|AEROSMITH remastered|AEROSMITH remastered videos|#remastered|hd music videos|remastered music videos', 'collection_date': datetime.datetime(2025, 4, 25, 17, 24, 19, 47864)}"
amazing,"{'video_id': 'L52fgezcehQ', 'channel_title': 'Rich Baba', 'channel_id': 'UCVqI2QpteQwPCpIp0KKi0Tw', 'video_publish_date': 1717910273.0, 'video_title': 'Top - 3 Amazing Chinese Gadgets 😱', 'video_description': ""China's Amazing Invention 😱\nAmazing Chinese Gadgets \nTop - 3 Amazing Chinese Gadgets \n\nClick here to subscribe to my channel - https://youtube.com/@RichBaba?si=eDgb6ZpeoWhYrNG7\n\n#shorts #facts #amazing #china #chinagadgets #gadgets #trending #viral #experiment #comedy #funny #youtubeshorts"", 'video_category': '23', 'video_view_count': '19753122', 'video_comment_count': '124', 'video_like_count': None, 'video_dislike_count': None, 'video_thumbnail': 'https://i.ytimg.com/vi/L52fgezcehQ/hqdefault.jpg', 'video_tags': ""China's Amazing Invention 😱|Amazing Chinese Gadgets|Top - 3 Amazing Chinese Gadgets|Top - 3 Chinese amazing Gadgets|Top - 3 Awesome Invention|Top - 3 Amazing China's Unique Gadgets|Top - 3 Chinese Unique Gadgets|Amazing Unique Gadgets|China's Amazing Invention|Amazing Invention Of China|Facts|Trending Shorts|Facts'mine Viewser"", 'collection_date': datetime.datetime(2025, 4, 25, 17, 24, 19, 47870)}"
amazing,"{'video_id': 'bd6tY95dhgY', 'channel_title': 'Lyrixa', 'channel_id': 'UCk-gO5FJhBDZd08OURa2KfA', 'video_publish_date': 1709296689.0, 'video_title': 'Inna - Amazing (lyrics)', 'video_description': '🔔 Turn on Notifications to Stay Updated with New Uploads \nSubscribe My Other Youtube Channels :)\nhttps://www.youtube.com/@lyrixarapmusic\nwww.youtube.com/@lyrixaone\n\nFollow INNA\nhttps://www.facebook.com/Inna/\nhttps://www.instagram.com/inna/\nwww.youtube.com/@UCr8RbU-D7iSvpy0ZO-AasoQ \nhttps://x.com/inna_ro\nhttps://innaofficial.com/\n\n\n🎵 Follow Me On Social Media. \nhttps://www.instagram.com/lyrixaofficial/\nhttps://www.facebook.com/LyrixaOfficial1/\nhttps://x.com/lyrixaofficial\n\nbusiness inquiries 📩dissplayone1@gmail.com', 'video_category': '10', 'video_view_count': '1153718', 'video_comment_count': '137', 'video_like_count': '10306', 'video_dislike_count': None, 'video_thumbnail': 'https://i.ytimg.com/vi/bd6tY95dhgY/hqdefault.jpg', 'video_tags': '', 'collection_date': datetime.datetime(2025, 4, 25, 17, 24, 19, 47876)}"
amazing,"{'video_id': 'vnxIATyYBNA', 'channel_title': 'wouldfact', 'channel_id': 'UCArKD0zjhhpvd_iG6Viyrbg', 'video_publish_date': 1725874061.0, 'video_title': 'Top 3 small and amezing gedgets #shorts #shortsfeed #youtubeshorts', 'video_description': 'Top 3 small and amezing gedgets #shorts #shortsfeed #youtubeshorts\n\nsmart gadgets,\ngadgets,\ncool gadgets,\namazing gadgets,\ncool gadgets on amazon,\nsmart home gadgets,\ngadgets for small apartments,\nnew gadgets,\nsmart gadgets for home,\namazing smart gadgets,\nlatest gadgets,\ncreative & smart gadgets for your small apartment,\nsmart appliances gadgets for every home,\nhome gadgets,\namazon gadgets,\nmini gadgets on amazon,\ncoolest gadgets,\nkitchen gadgets,\nsmart gadgets shorts,\nnew must have item amazon home gadgets,\nsmall home gadgets', 'video_category': '27', 'video_view_count': '8199100', 'video_comment_count': '33837', 'video_like_count': '719692', 'video_dislike_count': None, 'video_thumbnail': 'https://i.ytimg.com/vi/vnxIATyYBNA/hqdefault.jpg', 'video_tags': '#shorts #shortsfeed #youtubeshorts', 'collection_date': datetime.datetime(2025, 4, 25, 17, 24, 19, 47883)}"
amazing,"{'video_id': 'ILBv4RLe9u0', 'channel_title': 'Muhaddis Creator ', 'channel_id': 'UCDEBoL7XLij5fly8HC0zV7g', 'video_publish_date': 1737783008.0, 'video_title': ""“ Puppy Dream House Bank! 😍 You Won't Believe This Amazing Review!”#shortsfeed #shorts #viralshort"", 'video_description': ""“ Puppy Dream House Bank! 😍 You Won't Believe This Amazing Review!”#shortsfeed #shorts #viralshort #youtubeshorts"", 'video_category': '22', 'video_view_count': '342692', 'video_comment_count': None, 'video_like_count': '3375', 'video_dislike_count': None, 'video_thumbnail': 'https://i.ytimg.com/vi/ILBv4RLe9u0/hqdefault.jpg', 'video_tags': '', 'collection_date': datetime.datetime(2025, 4, 25, 17, 24, 19, 47889)}"
amazing,"{'video_id': 'PH4JPgVD2SM', 'channel_title': 'KanyeWestVEVO', 'channel_id': 'UChpJbg7zMbi5jx9Gdjaxa9g', 'video_publish_date': 1245177784.0, 'video_title': 'Kanye West - Amazing ft. Young Jeezy', 'video_description': 'Music video by Kanye West performing Amazing. (C) 2009 Roc-A-Fella Records, LLC', 'video_category': '10', 'video_view_count': '75687934', 'video_comment_count': '23316', 'video_like_count': '385068', 'video_dislike_count': None, 'video_thumbnail': 'https://i.ytimg.com/vi/PH4JPgVD2SM/hqdefault.jpg', 'video_tags': 'Kanye|West|Roc-a-Fella|Records|Hip|Hop', 'collection_date': datetime.datetime(2025, 4, 25, 17, 24, 19, 47895)}"
amazing,"{'video_id': '0AJfryjihdA', 'channel_title': 'Smart home gadgets 2.0', 'channel_id': 'UCrhVvqy6Kn9czMTb8ED_Oxg', 'video_publish_date': 1729298572.0, 'video_title': 'Best viral and amazing gadgets short videos | Smart home gadgets 2024 #gadgets #reels #viral #shorts', 'video_description': '', 'video_category': '22', 'video_view_count': '194065628', 'video_comment_count': '5146', 'video_like_count': None, 'video_dislike_count': None, 'video_thumbnail': 'https://i.ytimg.com/vi/0AJfryjihdA/hqdefault.jpg', 'video_tags': '', 'collection_date': datetime.datetime(2025, 4, 25, 17, 24, 19, 47901)}"
amazing,"{'video_id': 'ky3h5rQTkxI', 'channel_title': 'Rich Baba', 'channel_id': 'UCVqI2QpteQwPCpIp0KKi0Tw', 'video_publish_date': 1716956252.0, 'video_title': 'Japanese Amazing Gadgets', 'video_description': 'Japanese Amazing Gadgets\nMost Amazing Gadgets Of Japan \n\nClick here to subscribe to my channel -\nhttps://youtube.com/@RichBaba?si=e_WIIj2vFIFDJQgV\n\n#shorts #facts #viral #gadgets #comedy #funny #japan #trending #amazing', 'video_category': '23', 'video_view_count': '7520288', 'video_comment_count': '130', 'video_like_count': None, 'video_dislike_count': None, 'video_thumbnail': 'https://i.ytimg.com/vi/ky3h5rQTkxI/hqdefault.jpg', 'video_tags': ""Japanese Amazing Gadgets|How Wigs Are Form|Japanese Unique Idea for Hair Growth|Japanese Amazing Invention|Top Best Invention of Japan|Top Most Unique Thing in Japan|Japan's Awesome Invention|Japan's Amazing Gadgets|Top - 3 Amazing Gadgets|Facts|Trending Facts|viral Videos|Facts'mine Viewser|comedy|Funny"", 'collection_date': datetime.datetime(2025, 4, 25, 17, 24, 19, 47907)}"
bizarre,"{'video_id': '3q7_iGWjlq4', 'channel_title': 'Netflix K-Content', 'channel_id': 'UCpiCK8c6PBktcxq7Az_t4RQ', 'video_publish_date': 1745560800.0, 'video_title': ""When the owner is away, the guests will play! | Kian's Bizarre B&B | Netflix [ENG SUB]"", 'video_description': ""Kian’s Bizarre B&B is now playing, only on Netflix: https://www.netflix.com/title/81902048\n\nOn a remote island, Kian84 hosts a quirky B&B escape, where BTS' Jin and Ji Ye-eun lead guests through playful exploits and delightful chaos. Kian's Bizarre B&B is now playing, only on Netflix\n\n#Netflix #KiansBizarreBnB #대환장기안장 #KContent\n\nSubscribe to Netflix K-Content: https://bit.ly/2IiIXqV\nFollow Netflix K-Content on Instagram, Twitter, and Tiktok: @netflixkcontent\n\nABOUT NETFLIX K-CONTENT\n\nNetflix K-Content is the channel that takes you deeper into all types of Netflix Korean Content you LOVE. Whether you’re in the mood for some fun with the stars, want to relive your favorite moments, need help deciding what to watch next based on your personal taste, or commiserate with like-minded fans, you’re in the right place.\n\nAll things NETFLIX K-CONTENT.\n\n*Shows featured might not be available in all markets."", 'video_category': '24', 'video_view_count': '8637', 'video_comment_count': '69', 'video_like_count': '1309', 'video_dislike_count': None, 'video_thumbnail': 'https://i.ytimg.com/vi/3q7_iGWjlq4/hqdefault.jpg', 'video_tags': 'BTS|JiYeeun|Jin|Kian84|KiansBizarreBnB|best scene|drakor|drama coreano|kdrama|kdrama watchlist|korean actors|korean drama|korean film|korean movie|netflix|netflix k drama|netflix recommendation|recommendation|show|top kdrama|ซีรี่ส์เกาหลี|韓劇|韓国ドラマ|기안84|넷프릭스|넷플릭스|대환장기안장|방탄소년단|지예은', 'collection_date': datetime.datetime(2025, 4, 25, 17, 24, 19, 51240)}"
bizarre,"{'video_id': '-LDDFrZTtQs', 'channel_title': 'NIKANOR', 'channel_id': 'UCxX8AhBymlUT3IEbvSe0vNw', 'video_publish_date': 1743771655.0, 'video_title': 'NIKANOR  - Bizarre (Clip Officiel)', 'video_description': 'Quand les mots ne suffisent plus, la musique prend le relais.\nÀ travers #bizarre, Nikanor montre que la vie est un long voyage sans fin où l’homme découvre et se redécouvre à chaque fois ...\n-------------------------------------------\n👉🏿https://onerpm.link/Bizarre\n-------------------------------------------\n🎵Prod.Composer: Constasbeats\n🎬 Director: Kevin Klidjo pour Studios Director \n--------------------------------------------\nSuivez  NIKANOR sur ses réseaux: \n 👉🏿https://linktr.ee/NikanorBj\n☆https://www.facebook.com/nikanorwab\n☆https://www.instagram.com/nikanor01/\n☆https://www.tiktok.com/@nikanorofficiel\n☆https://www.snapchat.com/add/nikanorofficiel?share_id=xJjC\n------------------------------------------------\n© & ℗ Assouka Music 2025\n\n#bizarre', 'video_category': '10', 'video_view_count': '666660', 'video_comment_count': '1545', 'video_like_count': '24329', 'video_dislike_count': None, 'video_thumbnail': 'https://i.ytimg.com/vi/-LDDFrZTtQs/hqdefault.jpg', 'video_tags': '', 'collection_date': datetime.datetime(2025, 4, 25, 17, 24, 19, 51249)}"
bizarre,"{'video_id': 'auUBhFghEdQ', 'channel_title': 'REMI', 'channel_id': 'UCb-ruk8nzVC95HcdHc_x6yg', 'video_publish_date': 1733054402.0, 'video_title': 'Le test BIZARRE pour entrer dans l’ARMÉE INDIENNE ! 😅', 'video_description': ""Le test BIZARRE pour entrer dans l’ARMÉE INDIENNE ! 😅, prépare-toi à découvrir un rituel d'entrée hors du commun !  \n\nDans cette vidéo, on te plonge dans les coulisses des tests physiques et mentaux les plus étranges qu'on puisse imaginer pour intégrer l'armée indienne. Entre défis physiques extrêmes, épreuves d'équilibre improbables et exercices inattendus, ces recrues doivent prouver qu'elles sont prêtes à tout, même à relever des challenges complètement décalés. 💪\n\nQu'est-ce qui rend ces tests si particuliers ? Pourquoi un tel mélange de traditions et de modernité ? Et surtout, est-ce que tu pourrais toi-même réussir ces épreuves ?  \n\nDécouvre l'incroyable préparation nécessaire pour faire partie de l’une des armées les plus impressionnantes du monde. Accroche-toi, tu risques d’être surpris !  \n\nAbonne-toi pour plus de découvertes fascinantes et insolites ! 👇🏼"", 'video_category': '24', 'video_view_count': '4630761', 'video_comment_count': '368', 'video_like_count': '180851', 'video_dislike_count': None, 'video_thumbnail': 'https://i.ytimg.com/vi/auUBhFghEdQ/hqdefault.jpg', 'video_tags': 'Le test BIZARRE pour entrer dans l’ARMÉE INDIENNE ! 😅|armee|larmée indienne|les forces armees dhaiti|armee inde|test armee inde|force speciale inde|armee indienne|commando inde|commando test|comando test|commando position|remi|remi abbou|remi short|poisson fécond|remi video|poisson fecond|poisson fécond short|shorts|short|remi abbou short|remi abbou shorts|ça fait quoi|ca fait quoi|trash|trash short|infosmile|batzair|batzair short|michou', 'collection_date': datetime.datetime(2025, 4, 25, 17, 24, 19, 51257)}"
bizarre,"{'video_id': 'NZT9nN8o9LI', 'channel_title': 'Netflix K-Content', 'channel_id': 'UCpiCK8c6PBktcxq7Az_t4RQ', 'video_publish_date': 1745452800.0, 'video_title': ""[Unreleased] Watch Jin one, two, punch! 👊 | Kian's Bizarre B&B | Netflix [ENG SUB]"", 'video_description': ""Kian’s Bizarre B&B is now playing, only on Netflix: https://www.netflix.com/title/81902048\r\n\r\nEnjoy this previously unreleased clip of Kian's Bizarre B&B, now playing, only on Netflix.\r\n\r\nSubscribe to Netflix K-Content: https://bit.ly/2IiIXqV\r\nFollow Netflix K-Content on Instagram, Twitter, and Tiktok: @netflixkcontent\r\n\r\n#Netflix #KiansBizarreBnB #대환장기안장 #KContent\r\n\r\nABOUT NETFLIX K-CONTENT\r\n\r\nNetflix K-Content is the channel that takes you deeper into all types of Netflix Korean Content you LOVE. Whether you’re in the mood for some fun with the stars, want to relive your favorite moments, need help deciding what to watch next based on your personal taste, or commiserate with like-minded fans, you’re in the right place.\r\n\r\nAll things NETFLIX K-CONTENT.\r\n\r\n*Shows featured might not be available in all markets."", 'video_category': '24', 'video_view_count': '83781', 'video_comment_count': '397', 'video_like_count': '8146', 'video_dislike_count': None, 'video_thumbnail': 'https://i.ytimg.com/vi/NZT9nN8o9LI/hqdefault.jpg', 'video_tags': 'BTS|JiYeeun|Jin|Kian84|KiansBizarreBnB|best scene|drakor|drama coreano|kdrama|kdrama watchlist|korean actors|korean drama|korean film|korean movie|netflix|netflix k drama|netflix recommendation|recommendation|show|top kdrama|ซีรี่ส์เกาหลี|韓劇|韓国ドラマ|기안84|넷프릭스|넷플릭스|대환장기안장|방탄소년단|지예은', 'collection_date': datetime.datetime(2025, 4, 25, 17, 24, 19, 51263)}"
bizarre,"{'video_id': 'QhItraZs5Uw', 'channel_title': 'BizarreBub', 'channel_id': 'UCn7Ef9w8dTXyk9kNgti9aWw', 'video_publish_date': 1744488784.0, 'video_title': 'Scary Comp. V102', 'video_description': ""Now that's creepy\n\nGot any scary videos? Send them over to scaryvideos444@gmail.com.\nPlease try to give some context or background info along with your submission. Thanks\n\n\n\n\nTwitter: https://twitter.com/bad_bub\n\n\n\n\nMusic: \nKevin MacLeod (incompetech.com)Licensed under Creative Commons: By Attribution 3.0 Licensehttp://creativecommons.org/licenses/b......\nCO.AG Music: https://www.youtube.com/channel/UCcav...\nMyuu: https://www.youtube.com/c/myuuji\nREPULSIVE: https://www.youtube.com/c/REPULSIVEMUSIC"", 'video_category': '24', 'video_view_count': '2234075', 'video_comment_count': '4846', 'video_like_count': '48765', 'video_dislike_count': None, 'video_thumbnail': 'https://i.ytimg.com/vi/QhItraZs5Uw/hqdefault.jpg', 'video_tags': ""scary comp|very scary video|don't watch alone|scary comp v102|new scary comp|handprint on bed|ghostprint on bed|footprints on bed|haunted new apartment|ghost opens door|imprints on bed|handprints on bed haunted|the sky is blue game|the sky is blue scary game|sky is blue haunted game|chandelier falls|haunted trailer|ghost boy RV trailer|ghost trailer|the sky is blue and i see you|ghost boy|ghost pulls boy bed|footprints|ghost cat litter"", 'collection_date': datetime.datetime(2025, 4, 25, 17, 24, 19, 51268)}"
bizarre,"{'video_id': 'gDlWTszVqgk', 'channel_title': 'Trap king', 'channel_id': 'UCTeo335PyMAuePx7FMlPI_w', 'video_publish_date': 1611234039.0, 'video_title': 'Trap King X Djalil Palermo - Bizzare (Official Music Video) Beat by Mhd Prod', 'video_description': 'Title:Bizzare\nArtists:Trap King X Djalil Palermo\nProducer:Tarek Bourahli\nBeat by:Mhd Prod\nVideo clip:Barakah Prod\nRealisation:Amire Meriane X Anis Belhoul\nProd & Distribution Digital:TCE Production\nMix & Mastering:Bre Som\n\n#la_dezederie\n\nSocial Media\n\nInstagram : https://www.instagram.com/trapkingofficiel16/?hl=fr\nFacebook : https://www.facebook.com/trapkingofficiel16', 'video_category': '10', 'video_view_count': '77682207', 'video_comment_count': '18434', 'video_like_count': '545540', 'video_dislike_count': None, 'video_thumbnail': 'https://i.ytimg.com/vi/gDlWTszVqgk/hqdefault.jpg', 'video_tags': 'rap dz|bizzare|dz|Didin canon 16|trap king|djalil palermo|throne|mazelni|gorilla|hip hop dz|rap|hip hop|courage|wesh dani|rck|mca|zen9aoui|didin klash|codeine|klash|bif|algeria|algerie|trap|king|rap maghrebin|maghreb united|la dezederie|mhd prod|mhd|xl energy drink algeria|luxury 61|tce production|bourahli tarek|master t|BARAKAH PROD|amir meriane|lina tv|تراب كينغ', 'collection_date': datetime.datetime(2025, 4, 25, 17, 24, 19, 51276)}"
bizarre,"{'video_id': 'QGOCZzvphbY', 'channel_title': ""Spinnin' Records"", 'channel_id': 'UCpDJl2EmP7Oh90Vylx0dZtA', 'video_publish_date': 1274958147.0, 'video_title': 'David Deejay ft. Dony - So Bizarre (Official Music Video)', 'video_description': ""Subscribe to Spinnin' TV : http://bit.ly/Subscribe2YT\nSpotify: http://bit.ly/SpinninSpotify\nG+ : https://www.google.com/+spinninrecords\nFacebook: http://facebook.com/SpinninRecords\nTwitter: http://twitter.com/SpinninRecords\n\nSpinnin'  Records presents David Deejay ft. Dony - So Bizarre Official Video\n---\n\nThe Spinnin’ Records YouTube channel is the home for all music videos of the world’s leading dance record label!\n\nWe feature the latest music videos by Spinnin’ artists like Oliver Heldens, Sam Feldt, KSHMR, Ummet Ozcan, Blasterjaxx, Merk & Kremont, Timmy Trumpet, Tujamo, Alok, Curbi, Mike Williams, Lucas & Steve and many, many more! Expect daily uploads of official music videos, lyric videos and artwork videos across genres like dance, house, electro house, future house, deep house, big room and trap.\n\nMake sure to subscribe to Spinnin' Records: http://bit.do/spinnintv \n..and turn on notifications to stay updated with all new uploads!🔔\n\nFollow Spinnin’ Records:\nhttps://open.spotify.com/user/spinninrecordsofficial\nhttps://soundcloud.com/spinninrecords\nhttps://facebook.com/SpinninRecords\nhttps://instagram.com/spinninrecords\nhttps://twitter.com/SpinninRecords\nhttps://spinninrecords.com"", 'video_category': '10', 'video_view_count': '26314567', 'video_comment_count': '3321', 'video_like_count': '101101', 'video_dislike_count': None, 'video_thumbnail': 'https://i.ytimg.com/vi/QGOCZzvphbY/hqdefault.jpg', 'video_tags': ""Spinnin'|Records|David|Deejay|Dony|So|Bizarre|[Official|Video]|video|dance|house|mp3|song|artist|and|the|of|2010|new|track|download|live|new york|united states|los angeles|miami|dj|album|euro|lyrics|itunes|facebook|radio|deejay|free music|youtube|official|musicvideo|electronic|mix|Ibiza"", 'collection_date': datetime.datetime(2025, 4, 25, 17, 24, 19, 51282)}"
bizarre,"{'video_id': 'C2cMG33mWVY', 'channel_title': 'OMCVEVO', 'channel_id': 'UCt8Nkzfc-VZEi61TVl9c5rw', 'video_publish_date': 1259695926.0, 'video_title': 'OMC - How Bizarre (Official Music Video)', 'video_description': 'Music video by OMC performing How Bizarre. (C) 1996 Universal Music NZ Ltd.\nListen to more: https://umusicNZ.lnk.to/OMC\n \n Lyrics:\n Brother Pele\'s in the back\n Sweet Zina\'s in the front\n Cruisin\' down the freeway in the hot, hot sun\n Suddenly red-blue lights flash us from behind\n Loud voice booming\n Please step out onto the line\n Pele preaches words of comfort\n Zina just hides her eyes\n Policeman taps his shades\n Is that a Chevy \'69?\n \n [Hook]\n How bizarre\n How bizarre, how bizarre\n \n Destination unknown, as we pull in for some gas\n Freshly pasted poster reveals a smile from the past\n Elephants and acrobats, lions snakes monkey\n Pele speaks ""righteous,"" Sister Zina says ""funky""\n \n [Hook]\n How bizarre\n How bizarre, how bizarre\n \n [Break]\n Ooh, baby, (ooh, baby)\n It\'s making me crazy, (it\'s making me crazy)\n Every time I look around (look around)\n Every time I look around (Every time I look around)\n Every time I look around\n It\'s in my face\n \n Ring master steps out and says ""the elephants left town""\n People jump and jive and the clowns have stuck around\n TV news and cameras, there\'s choppers in the sky\n Marines, police, reporters ask where, for and why\n Pele yells, ""We\'re outta here,"" Zina says, ""Right on""\n Making moves and starting grooves before they knew we were gone\n Jumped into the Chevy and headed for big lights\n Wanna know the rest? Hey, buy the rights\n \n [Hook]\n How bizarre\n How bizarre, how bizarre\n \n [Break]\n Ooh, baby, (ooh, baby)\n It\'s making me crazy, (it\'s making me crazy)\n Every time I look around (look around)\n Every time I look around (Every time I look around)\n Every time I look around\n It\'s in my face\n (It\'s in my face)\n \n Ooh, baby, (ooh, baby)\n It\'s making me crazy, (it\'s making me crazy)\n Every time I look around (look around)\n Every time I look around (Every time I look around)\n Every time I look around\n It\'s in my face\n Ooh, baby, (ooh, baby)\n It\'s making me crazy, (it\'s making me crazy)\n Every time I look around (look around)\n Every time I look around (look around)\n Every time I look around\n It\'s in my face', 'video_category': '10', 'video_view_count': '45927699', 'video_comment_count': '22931', 'video_like_count': '399320', 'video_dislike_count': None, 'video_thumbnail': 'https://i.ytimg.com/vi/C2cMG33mWVY/hqdefault.jpg', 'video_tags': 'Otara Millionaires Club|Otara|South Auckland|Auckland|New Zealand|Land Of Plenty|Universal Music|90s Music|OMC|How Bizarre|Pauly Fuemana|Phil Fuemana|Tony Fuemana|Christina Fuemana|Matty Ruys|Huh! Records|Polygram|Mercury Records|Southside Records|Urban Pasifika Records|Deepgrooves Entertainment|Kiwi|Pop|how bizarre|omc how bizarre|everytime look around|how bazaar|how bizzare|omc|how bizzah|how bizzah lyrics', 'collection_date': datetime.datetime(2025, 4, 25, 17, 24, 19, 51288)}"
