keyword,video_id
fantastic,"{'video_id': 'QgvtmO7c-UU', 'channel_title': 'To kill a narrator', 'channel_id': 'UCmW3vwd_NpwjIS9V8NsHPLw', 'video_publish_date': 1476445386.0, 'video_title': 'Captain fantastic scene (Bill of rights)', 'video_description': 'Scene from the movie ""Captain fantastic""\nUploader does not claim ownership of any of the footage used in this video. All credit goes to the respective owners of the clips featured.', 'video_category': '22', 'video_view_count': '421698', 'video_comment_count': '666', 'video_like_count': '4324', 'video_dislike_count': None, 'video_thumbnail': 'https://i.ytimg.com/vi/QgvtmO7c-UU/hqdefault.jpg', 'video_tags': 'Matt Ross|Samantha Isler|Annalise Basso|Shree Crooks|viggo mortensen|Nicholas Hamilton|Charlie Shotwell|scene|bill of rights|your point|zaja|they are children|get them killed', 'collection_date': datetime.datetime(2025, 4, 25, 17, 45, 19, 549137)}"
fantastic,"{'video_id': 'a3ISYWWYgz8', 'channel_title': 'Slum Village - Topic', 'channel_id': 'UChjec6PW8WND5h9qjdRBKyQ', 'video_publish_date': 1476300210.0, 'video_title': 'Fantastic', 'video_description': 'Provided to YouTube by Virgin Music Group\n\nFantastic · Slum Village\n\nSlum Village\n\n℗ 2005 Barak Records\n\nReleased on: 2005-10-25\n\nComposer, Writer: RALPH RICE II\nWriter: RL Altman III\nWriter: JASON POWERS\nProducer: YOUNG RJ\n\nAuto-generated by YouTube.', 'video_category': '10', 'video_view_count': '59172', 'video_comment_count': '19', 'video_like_count': '1356', 'video_dislike_count': None, 'video_thumbnail': 'https://i.ytimg.com/vi/a3ISYWWYgz8/hqdefault.jpg', 'video_tags': 'Slum Village|Fantastic', 'collection_date': datetime.datetime(2025, 4, 25, 17, 45, 19, 549142)}"
fantastic,"{'video_id': 'IDRgLEkxxYk', 'channel_title': 'HENRY - Topic', 'channel_id': 'UCHNj6Ezibo5hDSMIfZyabLg', 'video_publish_date': 1487520388.0, 'video_title': 'Fantastic', 'video_description': ""Provided to YouTube by SM Entertainment\n\nFantastic · HENRY\n\nThe 2nd Mini Album 'Fantastic'\n\n℗ SM Entertainment\n\nReleased on: 2014-07-14\n\nAuto-generated by YouTube."", 'video_category': '10', 'video_view_count': '977589', 'video_comment_count': '78', 'video_like_count': '9230', 'video_dislike_count': None, 'video_thumbnail': 'https://i.ytimg.com/vi/IDRgLEkxxYk/hqdefault.jpg', 'video_tags': ""HENRY|The 2nd Mini Album 'Fantastic'|Fantastic"", 'collection_date': datetime.datetime(2025, 4, 25, 17, 45, 19, 549147)}"
fantastic,"{'video_id': 'Yma188Fjllo', 'channel_title': 'BIGBANG', 'channel_id': 'UCzw-C7fNfs018R1FzIKnlaA', 'video_publish_date': 1489726801.0, 'video_title': 'BIGBANG - FANTASTIC BABY (BIGBANG10 THE CONCERT : 0.TO.10 -THE FINAL-)', 'video_description': 'BIGBANG\nLIVE DVD & Blu-ray\n『BIGBANG10 THE CONCERT : 0.TO.10 -THE FINAL-』\n2017.3.29 on sale in Japan\n\n[BIGBANG OFFICIAL HP JP] http://ygex.jp/bigbang/\n[YGEX OFFICIAL SHOP] http://bit.ly/29dsHWn\n[YGEX Twitter] https://twitter.com/?lang=ja\n\n海外アーティスト史上初の4年連続ドームツアー【BIGBANG10 THE CONCERT : 0.TO.10 -THE FINAL-】!!\nT.O.Pの入隊前、BIGBANGフルメンバーでの最後のジャパンツアーとなった【BIGBANG10 THE CONCERT : 0.TO.10 -THE FINAL-】より、\n熱狂と感動のツアーファイナル@京セラドーム大阪公演(2016.12.29)を完全収録したLIVE DVD & Blu-ray、3月29日(水)発売決定！\n\n\n・DELUXE EDITION [DVD(4枚組)+LIVE CD(2枚組)+PHOTO BOOK+スマプラムービー&ミュージック] \nAVBY-58473～6/B～C  12,300円(本体価格+税)\n・DELUXE EDITION [Blu-ray(3枚組)+LIVE CD(2枚組)+PHOTO BOOK+スマプラムービー&ミュージック]\nAVXY-58477～9/B～C  13,300円(本体価格+税)\n・[DVD(2枚組)+スマプラムービー]AVBY-58480～1  7,300円(本体価格+税)\n・[Blu-ray(2枚組)+スマプラムービー]AVXY-58482～3  8,300円(本体価格+税)', 'video_category': '10', 'video_view_count': '714807', 'video_comment_count': '545', 'video_like_count': '17592', 'video_dislike_count': None, 'video_thumbnail': 'https://i.ytimg.com/vi/Yma188Fjllo/hqdefault.jpg', 'video_tags': 'BIGBANG|TOP|TAEYANG|DEASUNG|SEUNGRI|GD|G-DRAGON|태양|탑|지디|지드래곤|승리|대성|일본|콘서트|DVD', 'collection_date': datetime.datetime(2025, 4, 25, 17, 45, 19, 549154)}"
fantastic,"{'video_id': 'cHSk606yFas', 'channel_title': 'vaso ochigava', 'channel_id': 'UCo0KLoAboN8M-1qL1k4vFow', 'video_publish_date': 1476722798.0, 'video_title': ""Captain fantastic Sweet child o' mine scene"", 'video_description': ""Sweet child o' mine scene"", 'video_category': '22', 'video_view_count': '519220', 'video_comment_count': None, 'video_like_count': '6319', 'video_dislike_count': None, 'video_thumbnail': 'https://i.ytimg.com/vi/cHSk606yFas/hqdefault.jpg', 'video_tags': ""Sweet child o' mine scene|captain fantastic|sweet child o mine cover|sweet child o mine|guns and roses|cover|amazing cover|matt ross|Viggo Mortense|viggo mortensen|2016 Cannes Film Festival|Frank Langella|Steve Zahn"", 'collection_date': datetime.datetime(2025, 4, 25, 17, 45, 19, 549159)}"
fantastic,"{'video_id': 'iuKNXP9LcSg', 'channel_title': 'Movieclips', 'channel_id': 'UC3gNmTGu-TTbFPpfSs5kNkg', 'video_publish_date': 1455303745.0, 'video_title': 'Fantastic Mr. Fox (1/5) Movie CLIP - Boggis, Bunce and Bean (2009) HD', 'video_description': ""Fantastic Mr. Fox movie clips: http://j.mp/1o3B0rI\nBUY THE MOVIE:\nFandangoNOW - https://www.fandangonow.com/details/movie/ever-after-a-cinderella-story-1998/1MVe06c5cd11521e8247cdbbf3fade35d33?cmp=Movieclips_YT_Description\niTunes - http://apple.co/1JH50kQ\nGoogle Play - http://bit.ly/1Js6FHi\nAmazon - http://amzn.to/1fRuvnr\nFox Movies - http://fox.co/2zNweIz\nDon't miss the HOTTEST NEW TRAILERS: http://bit.ly/1u2y6pr\n\nCLIP DESCRIPTION:\nBadger (Bill Murray) explains to Mr. Fox (George Clooney) the precariousness of his realty decision.\n\nFILM DESCRIPTION:\nA wily fox uses his formidable cunning to outsmart three feeble-minded farmers, who resort to extreme tactics to protect their chickens in director Wes Anderson's animated adaptation of the popular Roald Dahl children's book. For 12 years, Mr. and Mrs. Fox (voices of George Clooney and Meryl Streep) have lived a peaceful life in the wilderness with their son, Ash (voice of Jason Schwartzman). Shortly after their young nephew Kristofferson (voice of Eric Anderson) arrives for a visit, Mr. Fox's long-suppressed animal instincts begin to take over and the faithful family man resorts back to his old ways as a cunning chicken thief, endangering not only his family but the entire animal community as well. When evil farmers Boggis, Bunce, and Bean force the animals underground in a desperate attempt to capture the audacious Mr. Fox, dwindling food supplies force the frightened animals to band together in one last attempt to fight for the land that is rightfully theirs. Bill Murray, Michael Gambon, Willem Dafoe, and Owen Wilson provide additional voices.\n\nCREDITS:\nTM & © Fox (2009)\nCourtesy of Twentieth Century Fox Film Corporation\nCast: George Clooney, Michael Gambon, Hugo Guinness, Brian Cox, Bill Murray\nDirector: Wes Anderson\nProducers: Molly Cooper, Arnon Milchan, Steven M. Rales, Scott Rudin, Allison Abbate, Wes Anderson, Simon Quinn, Jeremy Dawson\nScreenwriters: Noah Baumbach, Roald Dahl, Wes Anderson\n\nWHO ARE WE?\nThe MOVIECLIPS channel is the largest collection of licensed movie clips on the web. Here you will find unforgettable moments, scenes and lines from all your favorite films. Made by movie fans, for movie fans.\n\nSUBSCRIBE TO OUR MOVIE CHANNELS:\nMOVIECLIPS: http://bit.ly/1u2yaWd\nComingSoon: http://bit.ly/1DVpgtR\nIndie & Film Festivals: http://bit.ly/1wbkfYg\nHero Central: http://bit.ly/1AMUZwv\nExtras: http://bit.ly/1u431fr\nClassic Trailers: http://bit.ly/1u43jDe\nPop-Up Trailers: http://bit.ly/1z7EtZR\nMovie News: http://bit.ly/1C3Ncd2\nMovie Games: http://bit.ly/1ygDV13\nFandango: http://bit.ly/1Bl79ye\nFandango FrontRunners: http://bit.ly/1CggQfC\n\nHIT US UP:\nFacebook: http://on.fb.me/1y8M8ax\nTwitter: http://bit.ly/1ghOWmt\nPinterest: http://bit.ly/14wL9De\nTumblr: http://bit.ly/1vUwhH7"", 'video_category': '1', 'video_view_count': '2227986', 'video_comment_count': '0', 'video_like_count': '24027', 'video_dislike_count': None, 'video_thumbnail': 'https://i.ytimg.com/vi/iuKNXP9LcSg/hqdefault.jpg', 'video_tags': 'fantastic mr. fox|fantastic mr. fox trailer|fantastic mr. fox part 1|fantastic mr. fox soundtrack|ages 5-7|bill murray|children family|jeremy dawson|conflict videos|badger|hugo guinness|molly cooper|brian cox|book characters|wes anderson|steven m rales|michael gambon|ages 8-10|office videos|farm videos|nathan bunce|choice videos|boggis|animal videos|george clooney|arnon milchan|scott rudin', 'collection_date': datetime.datetime(2025, 4, 25, 17, 45, 19, 549165)}"
fantastic,"{'video_id': 'c-aOWzQ4dF0', 'channel_title': 'AMBI Distribution', 'channel_id': 'UCey8RPyKpSSgog0hX5Nef-A', 'video_publish_date': 1492425000.0, 'video_title': 'This Beautiful Fantastic - 2016 Drama Movie - Official Trailer HD', 'video_description': ""THIS BEAUTIFUL FANTASTIC\n\nA young woman who dreams of being a children's author makes an unlikely friendship with a cantankerous, rich old widower.\n\nDirector: Simon Aboud\nCast: Jessica Brown Findlay, Jeremy Irvine, Andrew Scott"", 'video_category': '1', 'video_view_count': '23797', 'video_comment_count': '1', 'video_like_count': '78', 'video_dislike_count': None, 'video_thumbnail': 'https://i.ytimg.com/vi/c-aOWzQ4dF0/hqdefault.jpg', 'video_tags': 'Simon Aboud|Jessica Brown Findlay|Jeremy Irvine|Andrew Scott|AMBI|AMBI Distribution|AMBI Pictures|AMBI Group|Drama|Film|Trailer|Offical Trailer|Comedy|Fantasy|Movie Trailer|This Beautiful Fantastic', 'collection_date': datetime.datetime(2025, 4, 25, 17, 45, 19, 549171)}"
fantastic,"{'video_id': 'l9rCND89LOc', 'channel_title': 'SBS Entertainment', 'channel_id': 'UCmjNKt6kITwaZTqvWuaSPLg', 'video_publish_date': 1479019902.0, 'video_title': ""필리핀 경호사모, 첫인상 무대 부터 기립을 부르는 폭발력 '비련' 《Fantastic Duo》판타스틱 듀오 EP29"", 'video_description': ""Fantastic Duo 판타스틱 듀오 EP29 20161113 SBS\n\n김경호와 판듀가 되기 위해 도전하는 '필리핀 경호사모'는 첫인상 무대부터 엄청난 가창력을 선보여 모두를 놀라게 한다.\n\n'판타스틱 듀오' 응모는 앱스토어에서 [에브리싱]을 검색해주세요.\n\n“Shall we sing a song together?”\nWhat if you can received a love call from the top singers in Korea?\n\nAnyone who has a smart phone can sing duet songs with Korea's top singers in “Fantastic Duo”! Incredible collaboration and Amazing duet performances of singers and their fans starts here.\n\nSBS Mucis Show ‘Singers in My Hands - Fantastic Duo’ to be aired for the first time on April 17 2016 and it aris on every Sunday at 4:50pm.\n\n☞ Visit 'Fantastic Duo' official website and get more information:\nhttp://goo.gl/wWLq8m\n\n☞ Enjoy watching other best clips of 'Fantastic Duo' to follow:\nhttps://goo.gl/CoHNXF"", 'video_category': '24', 'video_view_count': '10673565', 'video_comment_count': '6002', 'video_like_count': '78618', 'video_dislike_count': None, 'video_thumbnail': 'https://i.ytimg.com/vi/l9rCND89LOc/hqdefault.jpg', 'video_tags': 'SBS|SBS 예능|SBS Entertainment|뮤직쇼|music show|한류|Korean wave|Kpop|Korean music|판타스틱 듀오|Fantastic Duo|판타스틱 듀오 29회|Fantastic Duo ep29|20161113|전현무|Jeon Hyun Moo|김경호|비련|필리핀경호사모|기립|폭발', 'collection_date': datetime.datetime(2025, 4, 25, 17, 45, 19, 549176)}"
stunning,"{'video_id': '4hWMTSnP1AQ', 'channel_title': 'The Stunning - official', 'channel_id': 'UCiLCNCLwPkvzwVhMZLax3Nw', 'video_publish_date': 1509665301.0, 'video_title': 'The Stunning - Brewing Up A Storm [with Lyrics]', 'video_description': ""The best version, with lyrics. Purchase/download The Stunning's music: https://thestunning.net/music-store\nFeatures photos taken at the band's first major Dublin show in the National Stadium in 1990 and again twenty seven years later in the Olympia Theatre in 2017. Photos: Richie Smyth and Dara Munnis."", 'video_category': '10', 'video_view_count': '96168', 'video_comment_count': '42', 'video_like_count': '748', 'video_dislike_count': None, 'video_thumbnail': 'https://i.ytimg.com/vi/4hWMTSnP1AQ/hqdefault.jpg', 'video_tags': 'the stunning|Ireland|band|brewing up a storm|storm|hurricane', 'collection_date': datetime.datetime(2025, 4, 25, 17, 45, 19, 553319)}"
stunning,"{'video_id': '5Q5twIpY8uM', 'channel_title': 'Michael Bolton - Topic', 'channel_id': 'UC2OYAQ8gkHxDyeV8SMTNdgw', 'video_publish_date': 1491629059.0, 'video_title': 'A Love So Beautiful', 'video_description': 'Provided to YouTube by Columbia\n\nA Love So Beautiful · Michael Bolton\n\nGreatest Hits 1985-1995\n\n℗ 1995 Sony Music Entertainment\n\nReleased on: 1995-09-01\n\nBass, Drums, Keyboards, Synthesizer, Arranger, Producer: Walter Afanasieff\nComposer, Lyricist: Jeff Lynne\nBackground  Vocal: Philip Ingram\nEngineer: Dana Jon Chappelle\nComposer, Lyricist: Roy Orbison\nBackground  Vocal: Jim Gilstrap\nEngineer: Jan Mullaney\nBackground  Vocal: Rose Stone\nEngineer: David Gleeson\nBackground  Vocal: Alex Brown\nAssistant  Engineer: Brandon Harris\nGuitar: Dann Huff\nAssistant  Engineer: Steve Milo\nAssistant  Engineer: Craig Silvey\nMixing  Engineer: Mick Guzauski\nMastering  Engineer: Mark Wilder\nMastering  Engineer: Vic Anesini\n\nAuto-generated by YouTube.', 'video_category': '10', 'video_view_count': '30106202', 'video_comment_count': '7214', 'video_like_count': '207735', 'video_dislike_count': None, 'video_thumbnail': 'https://i.ytimg.com/vi/5Q5twIpY8uM/hqdefault.jpg', 'video_tags': 'Michael Bolton|マイケルボルトン|麥可伯特恩|Greatest Hits 1985-1995|A Love So Beautiful', 'collection_date': datetime.datetime(2025, 4, 25, 17, 45, 19, 553328)}"
stunning,"{'video_id': 'EUoe7cf0HYw', 'channel_title': 'TaylorSwiftVEVO', 'channel_id': 'UCANLZYMidaCbLQFWXBC95Jg', 'video_publish_date': 1508461282.0, 'video_title': 'Taylor Swift - Gorgeous (Lyric Video)', 'video_description': '►Exclusive Merch: https://store.taylorswift.com\n \n►Follow Taylor Swift Online\nInstagram: http://www.instagram.com/taylorswift\nFacebook: http://www.facebook.com/taylorswift\nTumblr: http://taylorswift.tumblr.com\nTwitter: http://www.twitter.com/taylorswift13\nWebsite: http://www.taylorswift.com\n \n►Follow Taylor Nation Online\nInstagram: http://www.instagram.com/taylornation\nTumblr: http://taylornation.tumblr.com\nTwitter: http://www.twitter.com/taylornation13', 'video_category': '10', 'video_view_count': '176046043', 'video_comment_count': '75269', 'video_like_count': '1584602', 'video_dislike_count': None, 'video_thumbnail': 'https://i.ytimg.com/vi/EUoe7cf0HYw/hqdefault.jpg', 'video_tags': 'Taylor Swift|Gorgeous|reputation', 'collection_date': datetime.datetime(2025, 4, 25, 17, 45, 19, 553335)}"
stunning,"{'video_id': '9Tr3FRc-I7I', 'channel_title': 'TheProphetsPath', 'channel_id': 'UCJ37YA_iAzyMwWekDZmgE1g', 'video_publish_date': 1472988006.0, 'video_title': 'Surah Al Waqiah: STUNNING RECITATION', 'video_description': ""Video Made By Omar Hisham Al Arabi For TheProphetsPath\nVideo Credits Goes To: https://www.youtube.com/omarhishamala...\n-------------------------------------------------------------------------------------------\nBuy TheProphetsPath Official Clothing Here: https://getdawah.refersion.com/c/e24771\n-------------------------------------------------------------------------------------------\n\nStay Updated With TheProphetsPath Through These Pages:\n\nTheProphetsPath Official Website: http://goo.gl/bBtT0q\nTheProphetsPath Main Channel: http://goo.gl/y502nN\nTheProphetsPath HD Channel: http://goo.gl/4RBP4P\nTheProphetsPath Facebook: http://goo.gl/YHiyQG\nTheProphetsPath Instagram: http://goo.gl/68PC4s\nTheProphetsPath Twitter: http://goo.gl/f5beVQ\n----------------------------------------------------------------------------------------------\nFor all business or non-business related questions, feel free to email us at: theprophetspath@gmail.com \n\nWe will get back to you within 3 business days Insha'Allah."", 'video_category': '27', 'video_view_count': '3199952', 'video_comment_count': '1661', 'video_like_count': '25613', 'video_dislike_count': None, 'video_thumbnail': 'https://i.ytimg.com/vi/9Tr3FRc-I7I/hqdefault.jpg', 'video_tags': 'Allah|Rasul (S.A.W.)|Sahabah|Emotional|HD|Speech|Bayaan|Love|Respect|Quran|Hadith|Sunnah|Bukahri|Muslim|Fiqh|TheMercifulServant|SIKM4N|LoveAllah328|Hanfifiqh|InkOfScholars|SoldierOfAllah2|AlQadrMedia|pray|slalah|fast|islamic speech|Shaykh Ahmed Ali|Shaykh Zahir Mehmood|IslamiFavourites|Mercy To Mankind|TheProphetsPath|islamic reminder|shaykh abdul majid|powerful bayaan|powerful speech|shaykh sulaiman khatani|friends of Allah|Shaykh Hasan Ali|Mufti Menk', 'collection_date': datetime.datetime(2025, 4, 25, 17, 45, 19, 553342)}"
stunning,"{'video_id': 'bPMe9dMFHEA', 'channel_title': 'Gordon Lightfoot - Topic', 'channel_id': 'UCEx92reYe5I762oF5knkO2w', 'video_publish_date': 1485359610.0, 'video_title': 'Beautiful', 'video_description': ""Provided to YouTube by Rhino/Warner Records\n\nBeautiful · Gordon Lightfoot\n\nGord's Gold\n\n℗ 1994 Reprise Records\n\nAcoustic  Guitar: Gordon Lightfoot\nVocals: Gordon Lightfoot\nUnknown: Lee Herschberg\nUnknown: Lee Herschberg\nAudio  Recording  Engineer: Lee Herschberg\nProducer: Lenny Waronker\nString  Arranger: Nick DeCaro\nClassical  Guitar: Red Shea\nAcoustic  Guitar: Red Shea\nHi- String  Guitar: Red Shea\nBass  Guitar: Ricky Haynes\nAcoustic  Guitar: Terry Clements\nWriter: Gordon Lightfoot\n\nAuto-generated by YouTube."", 'video_category': '10', 'video_view_count': '3448392', 'video_comment_count': '1362', 'video_like_count': '25072', 'video_dislike_count': None, 'video_thumbnail': 'https://i.ytimg.com/vi/bPMe9dMFHEA/hqdefault.jpg', 'video_tags': ""Gordon Lightfoot|Gord's Gold|Beautiful"", 'collection_date': datetime.datetime(2025, 4, 25, 17, 45, 19, 553348)}"
stunning,"{'video_id': 'saRR6n0IYwY', 'channel_title': 'Soundeo Mixtape', 'channel_id': 'UC9JwZiaWudOWmw2TOjWyyVg', 'video_publish_date': 1498887236.0, 'video_title': 'Stunning Deep Mix | Deep House, Vocal House, Nu Disco | Soundeo Mixtape', 'video_description': ""Soundeo Mixtape - House music source.\n• Spotify: https://open.spotify.com/user/lhkvsa9saavfqxxbgk30wnkk7\n• SoundCloud: https://soundcloud.com/soundeorecords\n• Facebook: https://facebook.com/soundeorecords\n• Instagram: https://instagram.com/soundeorecords\n• Releases: http://soundeorecords.com/#releases\n• Website: http://soundeorecords.com\n\nStunning Deep Mix | Deep House, Vocal House, Nu Disco | Soundeo Mixtape\n\nTracklist:\n00:00 ► Delyno - Private Love (DJ Junior CNYTFK & Dirty Vick Remix)\n05:09 ► Tosel & Hale, Heavy Pins ft. Veselina Popova - Read The Signs (Original Mix)\n10:20 ► Sergen Tekin - Sunshine Of Your Love (Radio Edit)\n12:29 ► Maylo & Josh - Baby It's You (Original Mix)\n16:43 ► Dmitri Saidi & Vicent Ballester ft. Vessy Boneva - World Comes Over You (Juloboy Remix)\n21:55 ► DA BUZZ - Still Miss You (Mr. DJ MONJ Remix)\n25:45 ► Kenno - Mouna Kea (Original Mix)\n29:48 ► Anymars - Slow It Down (Original Mix)\n33:00 ► Maxx Play ft. Cotry - Don't You Know (MP Remix)\n37:08 ► Francis Mercier & Alodot ft. Beatrice Thomas - Waiting For (MonoTone Remix)\n\n• Visual identity by Tom Mitchell:\nhttps://vimeo.com/allergonoise\nhttps://instagram.com/tommitchellphoto\nhttp://tommitchellphoto.format.com\n\nThe channel was created to promote the already well-known as well as beginning their career talented artists & musicians, record labels, filmmakers & photographers.\n\n— Submit your content here:\nhttp://soundeorecords.com/#submission\n\n— Management / contact:\ninfo@soundeorecords.com"", 'video_category': '10', 'video_view_count': '769205', 'video_comment_count': '153', 'video_like_count': '8073', 'video_dislike_count': None, 'video_thumbnail': 'https://i.ytimg.com/vi/saRR6n0IYwY/hqdefault.jpg', 'video_tags': 'Deep House|House|Deep|Vocal House|Mix|Mixtape|Best Deep House Music Mix 2017|Best House Music Mix 2017|Best Vocal House Music Mix 2017|Deep Mix 2017|New Music 2017|Sessions Deep House|Deep House Video Edit|Stunning Music|Soundeo Mixtape|Best Nu Disco Music Mix 2017|Best Chill Out Chillout Music Mix 2017|Top|New|Best|Music|Best Remixes|Set|SoundeoMixtape|Soundeo|Soundeo Music', 'collection_date': datetime.datetime(2025, 4, 25, 17, 45, 19, 553353)}"
stunning,"{'video_id': 'cLSHjCiB7Xs', 'channel_title': 'FanshakiraLyrics', 'channel_id': 'UCZs799HJNl7lj7bBwGNRsIg', 'video_publish_date': 1451808073.0, 'video_title': 'Beyoncé & Shakira - Beautiful Liar [Lyrics]', 'video_description': 'Music video by Beyoncé performing Beautiful Liar (feat. Shakira). (C) 2007 Sony Urban Music/Columbia.', 'video_category': '10', 'video_view_count': '55746679', 'video_comment_count': '1306', 'video_like_count': '325387', 'video_dislike_count': None, 'video_thumbnail': 'https://i.ytimg.com/vi/cLSHjCiB7Xs/hqdefault.jpg', 'video_tags': 'Beyoncé|Shakira|Beautiful Liar|Lyrics|Letra|R&B|Latin Pop (Musical Genre)', 'collection_date': datetime.datetime(2025, 4, 25, 17, 45, 19, 553359)}"
stunning,"{'video_id': '9Sm5vK5YTFE', 'channel_title': 'Sarah Brightman - Topic', 'channel_id': 'UC0Ri-H48bj2hSa9VfwNkCiQ', 'video_publish_date': 1486624191.0, 'video_title': 'Beautiful', 'video_description': 'Provided to YouTube by Universal Music Group\n\nBeautiful · Sarah Brightman\n\nHarem\n\n℗ 2003 Nemo Studios, under exclusive license to Angel Records\n\nReleased on: 2003-01-01\n\nMixing  Engineer: Michael Soltau\nMixing  Engineer, Producer: Frank Peterson\nMastering  Engineer: Bob Ludwig\nBackground  Vocalist: Gunther Laudahn\nChoir: The Bach Choir\nOrchestra: Prague Symphony Orchestra\nComposer  Lyricist: Nicola Hitchcock\nComposer  Lyricist: Shara Freeman\n\nAuto-generated by YouTube.', 'video_category': '10', 'video_view_count': '1241893', 'video_comment_count': '110', 'video_like_count': '7049', 'video_dislike_count': None, 'video_thumbnail': 'https://i.ytimg.com/vi/9Sm5vK5YTFE/hqdefault.jpg', 'video_tags': 'Sarah Brightman|サラブライトマン|サラ・ブライトマン|Harem|Beautiful|ビューティフル', 'collection_date': datetime.datetime(2025, 4, 25, 17, 45, 19, 553364)}"
stunning,"{'video_id': '9mYVi7WHyiU', 'channel_title': 'CNN', 'channel_id': 'UCupvZG-5ko_eiXAupbDfxWw', 'video_publish_date': 1478669872.0, 'video_title': ""Relive the Trump's stunning win in under 2 minutes"", 'video_description': ""Moments from CNN's coverage of a historic night on CNN when Donald Trump was elected the 45th President of the United States."", 'video_category': '25', 'video_view_count': '9960487', 'video_comment_count': '21915', 'video_like_count': '68270', 'video_dislike_count': None, 'video_thumbnail': 'https://i.ytimg.com/vi/9mYVi7WHyiU/hqdefault.jpg', 'video_tags': 'CNN|News|2016-elections|politics|2016 elections|us news', 'collection_date': datetime.datetime(2025, 4, 25, 17, 45, 19, 553369)}"
stunning,"{'video_id': '1tAvYhW1ZLI', 'channel_title': 'AlessiaCaraVEVO', 'channel_id': 'UC1EwyHfJHEKnA7kKfcGhlIw', 'video_publish_date': 1504302488.0, 'video_title': 'Alessia Cara - Scars To Your Beautiful  (Live At The MTV VMAs / 2017)', 'video_description': 'Courtesy of MTV\n\nhttp://vevo.ly/QE3t30\nBest of Alessia Cara: https://goo.gl/CfGpNV\nSubscribe here: https://goo.gl/WjihRR', 'video_category': '10', 'video_view_count': '45825916', 'video_comment_count': '18154', 'video_like_count': '1414350', 'video_dislike_count': None, 'video_thumbnail': 'https://i.ytimg.com/vi/1tAvYhW1ZLI/hqdefault.jpg', 'video_tags': 'Alessia|Cara|Scars|To|Your|Beautiful|(Live|At|The|MTV|VMAs|2017)|Def|Jam|Pop', 'collection_date': datetime.datetime(2025, 4, 25, 17, 45, 19, 553375)}"
stunning,"{'video_id': 'ROuWBdmZhvY', 'channel_title': 'alfonso jimenez - vídeos', 'channel_id': 'UCpLOEmqPDJrWB6Upe8FxVDQ', 'video_publish_date': 1494079951.0, 'video_title': 'Marillion - Beautiful  (1995)', 'video_description': 'Marillion - Beautiful\nÁlbum: Afraid of Sunlight (1995)\nEdited by  alfonsojimenezvídeos: https://goo.gl/MiovzC\nSubscribe for more / Suscríbete: https://goo.gl/jiS9yW\nPlaylist Best of alfonsojimenez-vídeos\nhttps://goo.gl/T48GKE\n---------------------------------------------------------------\n- AVISO -\n- All music and images belong to their rightful owners. No copyright infringement intended.\n- Toda la música e imágenes pertenecen a sus legítimos propietarios. Sin intenciones de infringir los derechos de autor.\n-----------------------------------------------------------\nVer más de alfonso jimenez - vídeos:\nYouTube : https://goo.gl/MiovzC\nFacebook: https://goo.gl/BqfZBV\n------------------------------------------------------------\nRock - Blues : https://goo.gl/icNTJ6\nThe best songs of the 70s, 80s and 90s: https://goo.gl/ojmnGR\nRomantic songs: https://goo.gl/JNGzdP \nPop - Indie - Disco : https://goo.gl/B7oi7z\nFusion of images + music: https://goo.gl/HJ4m5o\n------------------', 'video_category': '22', 'video_view_count': '1633627', 'video_comment_count': '737', 'video_like_count': '25728', 'video_dislike_count': None, 'video_thumbnail': 'https://i.ytimg.com/vi/ROuWBdmZhvY/hqdefault.jpg', 'video_tags': 'Marillion|Beautiful|Rock|Romantica|Balada', 'collection_date': datetime.datetime(2025, 4, 25, 17, 45, 19, 553380)}"
