keyword,video_id
shocking,"{'video_id': 'ikmj1w13YFU', 'channel_title': 'Quick Top', 'channel_id': 'UCjvxq2l7nmXjdrTXvtvXH1Q', 'video_publish_date': 1730098845.0, 'video_title': '""75 Shocking Natural Disasters Ever Caught on Camera!""', 'video_description': 'In this video, we bring you 75 of the most jaw-dropping natural disasters ever caught on camera—from massive landslides and powerful storms to Terrifying floods and more. These real-life moments remind us of how unpredictable and powerful our planet can be. Each clip offers a glimpse into the breathtaking and sometimes terrifying force of nature.\n\n\n[Affiliate Link]\n\n""4-Pack Portable Water Filter Straws - Perfect for Camping & Emergencies!""\n\nhttps://amzn.to/48qITz8\n\n\nWatch now \n \nhttps://youtu.be/Z-x_EaYWA6M\n\nhttps://youtu.be/QPJQWVo1XSI\n\nhttps://youtu.be/LD83E-KCbNk\n\n\n\n\n""Copyright Disclaimer:\n This video contains clips used under Fair Use for commentary, criticism, and educational purposes. All credit goes to the respective owners. If any content belongs to you and you’d like it removed, please contact us directly.""\n\nbas8800nam@gmail.com \n\nMUSIC USE\nCredits:\n     Music: Investigation by Soundridemusic\n     Link to Video: \xa0\xa0\xa0\xa0•\xa0Investigation\xa0Crime\xa0My...\xa0\xa0\n\n\n\n#nature  #flood  #storm #naturaldisasters', 'video_category': '27', 'video_view_count': '29938694', 'video_comment_count': '3494', 'video_like_count': '91509', 'video_dislike_count': None, 'video_thumbnail': 'https://i.ytimg.com/vi/ikmj1w13YFU/hqdefault.jpg', 'video_tags': 'Top 10|Quick Top|Shocking Natural Disasters|Caught on camera|Unbelievable|Dangerous|Top 50|Flood|Moments|Natural', 'collection_date': datetime.datetime(2025, 4, 25, 17, 24, 19, 150776)}"
shocking,"{'video_id': 'lXQ2EF-8vB4', 'channel_title': 'universal-travelers', 'channel_id': 'UCCQ2-Fnod6gDe6qb7Ty-ygg', 'video_publish_date': 1704871876.0, 'video_title': 'Komodo Dragon Gets Shocked By Electric Eel  #animals #nature #wildlife', 'video_description': '', 'video_category': '22', 'video_view_count': '12960990', 'video_comment_count': '7321', 'video_like_count': '239205', 'video_dislike_count': None, 'video_thumbnail': 'https://i.ytimg.com/vi/lXQ2EF-8vB4/hqdefault.jpg', 'video_tags': '', 'collection_date': datetime.datetime(2025, 4, 25, 17, 24, 19, 150781)}"
insane,"{'video_id': 'juJkNKodgdE', 'channel_title': 'Black Gryph0n', 'channel_id': 'UCvzWGXYFDiiJ338KIJPhbhQ', 'video_publish_date': 1623420085.0, 'video_title': 'INSANE (A Hazbin Hotel Song) - Black Gryph0n & Baasik', 'video_description': 'STREAM #INSANE ON SPOTIFY: https://open.spotify.com/track/5flerg6aEao2VayZezVlgu?si=dEFvFn77TI6hGC50kBbHyg&dl_branch=1\n\nLike this song enough to WEAR it?! 🤔 Then get official “INSANE” merch HERE 😈 (while you still can): https://shop.flyp.space/u/insane\n\nOR you can customize your own using our “Insane” design pack on FLYP! 🔥👕 https://apps.apple.com/us/app/flyp/id1605986264\n\nMORE ORIGINAL MUSIC HERE: https://www.youtube.com/watch?v=PrMjrvz5hyc&list=PLv1P-6YxEm6AgF6yiKtydFevNQV4RxKn4&index=1\n-- ALBUMS AVAILABLE HERE: https://blackgryph0n.bandcamp.com/album/diamond\nExtra stuff available on Patreon! Support goes towards producing new music and videos: https://www.patreon.com/BlackGryph0n \n\n-- YOU CAN GET ALL THE GEAR I USE HERE: \nhttps://www.amazon.com/shop/blackgryph0n\n\n\nIt\'s about time I did a #HazbinHotel song! To be honest, I wasn\'t even sure if I was allowed to do this, since I\'m the singing voice of #Alastor in the pilot, but Viv said she loved it, so I guess it\'s ok?...  Nate and I wrote this song in about 8 hours! It was one of those songs that kinda wrote itself! I showed up to his house at noon, and by 9:00pm we were wrapping up recording!\n\n\nCredits:\n\nTrack written, produced & mastered by Nate (Baasik) SUBSCRIBE TO HIM:\nhttps://www.youtube.com/user/Baasikmusic\n\nLyrics and melody written and performed by me. SUBSCRIBE TO ME TOO, PLEASE! https://www.youtube.com/c/BlackGryph0n\n\n\nYou can also follow me on:\n\nPatreon: https://www.patreon.com/BlackGryph0n\n\nTwitter: https://twitter.com/BlackGryph0n\n\nInstagram: https://www.instagram.com/blackgryph0n/\n\nMerch: www.BlackGryph0n.shop\n\n\nBusiness Inquiries: GabrielBrownInfo@gmail.com\n\n\n\n- -- --- ---- -----Lyrics ----- ---- --- -- -\n\nDearly beloved,\nFor your entertainment, it\'s my pleasure to introduce to you Hell’s latest arrival\nThe equal-opportunity killer,\xa0Alastor!\n\nHello, it’s nice to meet you!\nCan you tell me where I am?\nI don’t know how I got here\nBut I think I’m starting to understand.\nI don’t belong among the angles\nAnd baby that’s just fine with me.\nThe things I did up there were high school\nBut now I’m going for my degree\n\nHey\nSorry but you just got in my way\nI promise honey I can feel your pain\nAnd maybe I enjoy just a little bit\nDoes that make me insane?\nHaven’t been the same since I expired\nDoesn’t mean that I plan to retire\nAnd now I have the power to bathe all of you in entertaining fire!\n\n- CHORUS -\n\nWait a minute, do I know you?\nWeren’t an old pal of mine?\nDeparted from us far too early\nBut now we’re meeting a second time.\nWe used to have such fun together\nAnd maybe you have what I need\nBut first I have one tiny question\nTell me, do you demons bleed?\n\n- CHORUS -\n\nHey\nSorry but you just got in my way\nI promise honey I can feel your pain\nAnd maybe I enjoy just a little bit\nDoes that make me insane?\nHaven’t been the same since I expired\nDoesn’t mean that I plan to retire\nAnd now I have the power to bathe all of you in entertaining fire!\n\nHey\nSorry but you just got in my way\nI promise honey I can feel your pain\nAnd maybe I enjoy just a little bit\nDoes that make me insane?\n\n- -- --- ---- -----END ----- ---- --- -- -\n\n\nHELLO DDR\'S (Dedicated Description Readers)!!\n\nI really hope you like this song! IDK if you\'ve ever watched Hazbin Hotel but it\'s basically a show about life in hell. This song is about the character Alastor, who is a very powerful demon. He was a DJ in the 1920\'s and ALSO a serial killer. I like to think that the power he has in hell is proportionate to the amount of unspeakable crimes he committed on earth, but IDK if that\'s canon. Anyway, this song takes place at the moment of his death on earth and subsequent arrival in hell. He quickly begins to accept his fate, come into his power, and he even meet\'s an old ""friend"" from earth. I\'m sure Alastor\'s friend is happy to see him too!... ;-)\n\nANYWAY, enough about the song! I just got back from a week-long trip to LA for a super-secret thingy... I promise I\'ll give you more details when I can. It was pretty intense, but Claire and I had a blast in my off time! We met up with a bunch of friends, ate a bunch of food, and even went to Disney Land! We wanted to see the Avengers Campus but there was a four-hour line just to GET IN!! So we road the Incredicoaster, Sorin, and Cars instead.\nWant an easter egg? Of course, you do! Here\'s a video of me and an old buddy hanging out in LA: https://youtu.be/z1WKhVVLlpY\n\nOK, I GOTTA GO TO BED SO I CAN WAKE UP SO I CAN GO TO BED UNTIL I DIE!\n\nLove you all!\n\n~Gabe', 'video_category': '24', 'video_view_count': '123960980', 'video_comment_count': '33904', 'video_like_count': '1536699', 'video_dislike_count': None, 'video_thumbnail': 'https://i.ytimg.com/vi/juJkNKodgdE/hqdefault.jpg', 'video_tags': 'Hazbin Hotel|Alastor|A24|Helluva Boss|Angel Dust|Addict|Music|Radio Demon|Original Music|Swing Step|Dubstep|Electronic|Epic|TLT|The Living Tombstone|FNAF|Five Nights At Freddies', 'collection_date': datetime.datetime(2025, 4, 25, 17, 24, 19, 151927)}"
insane,"{'video_id': 'AicztQ69Uy8', 'channel_title': 'Music Terminal', 'channel_id': 'UCbsF_lTmKMtRSgf_tirCHKw', 'video_publish_date': 1662377502.0, 'video_title': 'Black Grpyh0n & Baasik- Insane (Lyrics Video)', 'video_description': 'Note: Don\'t Forget to Like and Subscribe for new content every single day and hit the notification bell to be notify when every content is being published by me\n\nHope You Enjoy The Video\n\nWallpaper:https://unsplash.com/s/photos/clouds\nOriginalMusicVideo:https://youtu.be/juJkNKodgdE\n \nFull Lyrics Of\nInsane-\n\nDearly beloved,\nFor your entertainment, it\'s my pleasure to introduce to you Hell’s latest arrival\nThe equal-opportunity killer, Alastor!\nHello, it’s nice to meet you!\nCan you tell me where I am?\nI don’t know how I got here\nBut I think I’m starting to understand.\nI don’t belong among the angles\nAnd baby that’s just fine with me.\nThe things I did up there were high school\nBut now I’m going for my degree\nHey\nSorry but you just got in my way\nI promise honey I can feel your pain\nAnd maybe I enjoy just a little bit\nDoes that make me insane?\nHaven’t been the same since I expired\nDoesn’t mean that I plan to retire\nAnd now I have the power to bathe all of you in entertaining fire!\nWait a minute, do I know you?\nWeren’t an old pal of mine?\nDeparted from us far too early\nBut now we’re meeting a second time.\nWe used to have such fun together\nAnd maybe you have what I need\nBut first I have one tiny question\nTell me, do you demons bleed?\nHey\nSorry but you just got in my way\nI promise honey I can feel your pain\nAnd maybe I enjoy just a little bit\nDoes that make me insane?\nHaven’t been the same since I expired\nDoesn’t mean that I plan to retire\nAnd now I have the power to bathe all of you in entertaining fire! (x2)\nHey\nSorry but you just got in my way\nI promise honey I can feel your pain\nAnd maybe I enjoy just a little bit\nDoes that make me insane?\n\nFAIR USE DISCLAIMER:\n\nCopyright Disclaimer under section 107 of the Copyright Act 1976, allowance is made for “fair use” for purposes such as criticism, comment, news reporting, teaching, scholarship, education and research. Fair use is a use permitted by copyright statute that might otherwise be infringing. Non-profit, Educational or personal use tips the balance in favor of fair use\n""Fair Use"" Guidelines: https://www.multiplechronicconditions.org/fair-use-act-disclaimer#:~:text=Copyright%20Disclaimer%20under%20section%20107,that%20might%20otherwise%20be%20infringing.', 'video_category': '22', 'video_view_count': '9173379', 'video_comment_count': '3085', 'video_like_count': '98199', 'video_dislike_count': None, 'video_thumbnail': 'https://i.ytimg.com/vi/AicztQ69Uy8/hqdefault.jpg', 'video_tags': '', 'collection_date': datetime.datetime(2025, 4, 25, 17, 24, 19, 151936)}"
insane,"{'video_id': '_t7oMrDWiAs', 'channel_title': 'Xeorie', 'channel_id': 'UC42oNR4ifayjDhQQ5RJgFQQ', 'video_publish_date': 1647182444.0, 'video_title': 'INSANE (With Lyrics) // AMV // Hazbin Hotel', 'video_description': ""Hey folks!\n\nHere is an AMV on the first Hazbin Hotel song I discovered, and that made me love Alastor even more ^^\n\nEnjoy! And don't forget to like, subscribe and turn on notifications!\n-------------------------------------------------------------------------------\nCredits:\n\nAMV made by Xeorie\n\nHazbin Hotel belongs to Vivziepop:\nhttps://youtu.be/Zlmswo0S0e0\n\nSong: “INSANE” by Black Gryph0n & Baasik:\nhttps://youtu.be/juJkNKodgdE\n-------------------------------------------------------------------------------\nMy social networks:\n\nTiktok: @xeorie_\nhttps://www.tiktok.com/@xeorie_?lang=fr\nDeviantArt: @xeorie\nhttps://www.deviantart.com/xeorie\nInstagram: @xeorie\nhttps://www.instagram.com/xeorie/?hl=fr\n-------------------------------------------------------------------------------\n#insane #amv #hazbinhotel #vivziepop #hazbinhotelalastor #blackgryph0n #blackgryph0nbaasik #baasikblackgryph0n  #baasik #capcut"", 'video_category': '24', 'video_view_count': '9623219', 'video_comment_count': '2700', 'video_like_count': '120177', 'video_dislike_count': None, 'video_thumbnail': 'https://i.ytimg.com/vi/_t7oMrDWiAs/hqdefault.jpg', 'video_tags': '', 'collection_date': datetime.datetime(2025, 4, 25, 17, 24, 19, 151942)}"
insane,"{'video_id': 'lFDuvgDDgZg', 'channel_title': 'TinkVEVO', 'channel_id': 'UCkXNyZLZofqLZ7f6xs0ND9A', 'video_publish_date': 1737039637.0, 'video_title': 'Tink - Insane (Official Video)', 'video_description': 'Listen to the single “Songs About U"". Out Now!\nStream: https://music.empi.re/songsaboutu\n\n\n\n#Tink #Insane  #EMPIRE\n\n\n\nOfficial Videoby Tink  - ""Insane "" © 2025 Winter\'s Diary / WD Records / EMPIRE', 'video_category': '10', 'video_view_count': '1064614', 'video_comment_count': '520', 'video_like_count': '14657', 'video_dislike_count': None, 'video_thumbnail': 'https://i.ytimg.com/vi/lFDuvgDDgZg/hqdefault.jpg', 'video_tags': ""Tink|Winter's Diary WD Records EMPIRE|R&B/Soul"", 'collection_date': datetime.datetime(2025, 4, 25, 17, 24, 19, 151947)}"
insane,"{'video_id': 'aers_zbQLfA', 'channel_title': '☆Spirit Wolf☆', 'channel_id': 'UCo4YQh8QyAFgxxOZCQz6zGw', 'video_publish_date': 1712830491.0, 'video_title': ""REMOVING ALASTOR'S SMILE Part - 2     #hazbinhotel #hazbinhotelalastor  #alastor #radiodemon #insane"", 'video_description': '', 'video_category': '24', 'video_view_count': '2871576', 'video_comment_count': '1613', 'video_like_count': '192484', 'video_dislike_count': None, 'video_thumbnail': 'https://i.ytimg.com/vi/aers_zbQLfA/hqdefault.jpg', 'video_tags': '', 'collection_date': datetime.datetime(2025, 4, 25, 17, 24, 19, 151952)}"
insane,"{'video_id': '4Weoy2lfego', 'channel_title': 'Crypto Lifer', 'channel_id': 'UC4c5FPpwCpb6q8J--i8QHtA', 'video_publish_date': 1745577702.0, 'video_title': 'Bitcoin Live Trading: This Pattern is INSANE! PUMP Incoming? Altcoin PROFITS! EP1614', 'video_description': ""JOIN THE TRADING GROUP ➡️ https://www.cryptolifer.com\n\nAmazing Bitunix Campaign: https://www.bitunix.com/activity/partner-trading?actCode=CryptoLifer0412\n\nTrading Bot: https://www.minotaurtradingsystems.io/cryptolifer?sl=cryptolifer\n\n💱 My Exchanges💱\nBitunix: https://www.bitunix.com/register?vipCode=CryptoLifer\nWEEX: https://support.weex.com/en/register?vipCode=8six\nMEXC: https://www.mexc.com/register?inviteCode=mexc-1Ty1S\n\nLas Vegas Bitcoin Event (May 2025)\nhttps://tickets.b.tc/affiliate/lifer/event/bitcoin-2025\n\nLifer Trading Class:\nhttps://booking.appointy.com/CryptoLifer?sr=899190\n\nMerch ➡️ https://streamlabs.com/cryptolifer/merch\n\nLifer's Key Insight Newsletter signup:\nhttps://www.cryptolifer.com/#subscribe\n\nToken Metrics:\nhttps://www.tokenmetrics.com/pricing?ref=yta1nmz\n\n\nNord VPN: \nhttps://nordvpn.com/cryptolifervpn\n\nSocial Media Accounts ➡️ https://linktr.ee/realcryptolifer\n\nTrying to make sense of the Charts? Tune in daily for the most accurate Technical Analysis on YouTube. Crypto Lifer covers the global markets, S&P 500, DXY, Bitcoin, ETH & the top alts you need to know about including hidden alt-coin gems! Learn how to use all the top trading tools! Use a superchat to request TA for your hot coin of choice! \n\n💱 Other Exchanges💱\nBinance: https://accounts.binance.com/en/register?ref=YNXFFAA1\nBinance: (non-US residents): https://www.binance.com/?ref=10983583\n\n🛠Helpful Tools🛠\nALTRADY: https://app.altrady.com/?a=333\nBOOKMAP: https://bookmap.com/members/aff/go/cryptolifers?i=94\nKoinly: https://koinly.io/?via=24D2163A&utm_source=affiliate\nTrezor: https://trezor.go2cloud.org/SH2g\n\n🕒Timestamps\n0:00\n\nDisclaimer:\nPlease note that all information and opinions shared on the Crypto Lifer YouTube channel, as well as any affiliated channels or publications, are intended solely for educational, informational, and entertainment purposes. None of the content available on the platform should be viewed as legal, financial, investment, or tax advice, nor should it be viewed as guidance, solicitation, or suggestion regarding investment strategies or purchase/sale/retention of investments.\nAny and all information and opinions shared on Crypto Lifer are based purely on personal research and beliefs, and while such opinions are considered reliable, no guarantee or representation is made with respect to their accuracy, completeness, timeliness, or reliability. The information presented on Crypto Lifer is subject to change without notice, and should not be construed as specific advice or guidance to any individual or entity.\nIt is important to note that cryptocurrency trading and investing entails high risks and may result in significant losses; therefore, it is advisable to conduct one's own research and seek professional advice from a licensed financial professional. Crypto Lifer does not provide financial advice and is not a licensed financial professional. In addition, past performance does not necessarily predict future results, and should not be taken as a reliable indicator of future performance.\nPlease be advised that Crypto Lifer may, on occasion, discuss projects, tokens, services, or entities that have compensated the channel in some form, and in such cases, the channel will always disclose that relationship fully. It is important to take this information into account when considering opinions, strategies, or trades discussed on Crypto Lifer."", 'video_category': '24', 'video_view_count': '1851', 'video_comment_count': '0', 'video_like_count': '276', 'video_dislike_count': None, 'video_thumbnail': 'https://i.ytimg.com/vi/4Weoy2lfego/hqdefault_live.jpg', 'video_tags': '', 'collection_date': datetime.datetime(2025, 4, 25, 17, 24, 19, 151984)}"
insane,"{'video_id': 'nGP5fc-Eey8', 'channel_title': 'SAmiLose SAL', 'channel_id': 'UC38krDsh8n9IbJ_q8WFTjPw', 'video_publish_date': 1632599111.0, 'video_title': '[HazbinHotel/SFM] INSANE - (BlackGryp0n & Baasik)', 'video_description': 'After 3 months, I present to you all another full animation\nThis time its HazbinHotel related!\nHope you all enjoy it!!\n-The day this premieres is gonna be the day before my birthday-\n\nOriginal Song~\nhttps://www.youtube.com/watch?v=juJkNKodgdE\n\nSong Creator~\nhttps://www.youtube.com/channel/UCvzWGXYFDiiJ338KIJPhbhQ\n\nHazbinHotel~\nhttps://www.youtube.com/watch?v=Zlmswo0S0e0&t=1712s\n\nPerson Who Made The Birthday Image~\nhttps://www.youtube.com/channel/UCRe8CeF9LPlRx6mf1S_yRug\n\nMain Alastor Models~\nhttps://steamcommunity.com/sharedfiles/filedetails/?id=1911469532&searchtext=alastor\nhttps://steamcommunity.com/sharedfiles/filedetails/?id=2330371212&searchtext=alastor\n\nMy TickTock~\nhttps://www.tiktok.com/@samilosesal?lang=en\n\nReactions are allowed :3', 'video_category': '1', 'video_view_count': '4917847', 'video_comment_count': '2795', 'video_like_count': '79248', 'video_dislike_count': None, 'video_thumbnail': 'https://i.ytimg.com/vi/nGP5fc-Eey8/hqdefault.jpg', 'video_tags': '', 'collection_date': datetime.datetime(2025, 4, 25, 17, 24, 19, 151992)}"
insane,"{'video_id': 'cqP8I5aaud8', 'channel_title': 'APDHILLON', 'channel_id': 'UCsaXTlOmt0o9aGeC_n_r8VQ', 'video_publish_date': 1618534815.0, 'video_title': 'INSANE - AP DHILLON | GURINDER GILL | SHINDA KAHLON (Official Music Video)', 'video_description': 'Subscribe for 🔥: http://bit.ly/2qqGljI\n\nLatest Punjabi Song 2020\n""INSANE"" - AP DHILLON | GURINDER GILL | SHINDA KAHLON | GMINXR\n\nSong   : INSANE\nSinger : AP DHILLON | GURINDER GILL | SHINDA KAHLON\nMusic : GMINXR | PVLI \nLyrics :  SHINDA KAHLON\nMix / Master : AP DHILLON\nVideo : ZAC FACTS\nVideo Director : HERMAN ATWAL\n\nAll streaming platforms : \n\nAP DHILLON - www.instagram.com/apdhillon/\nGURINDER GILL - www.instagram.com/gurindergill96/\nSHINDA KAHLON - www.instagram.com/shinda.kahlon/\nGMINXR - www.instagram.com/gminxr/\n\nPUNJABI SONG 2021\nLATEST PUNJABI SONGS\nPUNJABI HIPHOP\nPUNJABI POP \nTRENDING PUNJABI SONGS\nNEW PUNJABI SONGS\nPAGAL', 'video_category': '10', 'video_view_count': '202626524', 'video_comment_count': '27482', 'video_like_count': '1961772', 'video_dislike_count': None, 'video_thumbnail': 'https://i.ytimg.com/vi/cqP8I5aaud8/hqdefault.jpg', 'video_tags': 'insane|pagal|ap dhillon|Gurinder gill|Shinda Kahlon|new Punjabi music 2021|punjabi pop|Bollywood 2021|trending|punjabi music|lates punjabi song|brown munde|latest punjabi music|excuses', 'collection_date': datetime.datetime(2025, 4, 25, 17, 24, 19, 151998)}"
insane,"{'video_id': 'xpuvRQgemZE', 'channel_title': 'Presto Preston', 'channel_id': 'UC1xd-GSE9WRj3TdvWY5bGhw', 'video_publish_date': 1745337696.0, 'video_title': 'Insane full court shot 🤯🔥🤯#shorts #trickshots #insane', 'video_description': '\u2060Get @dudeperfect  to put me in a video!', 'video_category': '17', 'video_view_count': '1549', 'video_comment_count': '2', 'video_like_count': '24', 'video_dislike_count': None, 'video_thumbnail': 'https://i.ytimg.com/vi/xpuvRQgemZE/hqdefault.jpg', 'video_tags': '', 'collection_date': datetime.datetime(2025, 4, 25, 17, 24, 19, 152003)}"
insane,"{'video_id': 'lprz-jF-_Bw', 'channel_title': 'Ricky Miles Music Ug', 'channel_id': 'UCoN8t0_F65jECKvXD9oF45g', 'video_publish_date': 1649665811.0, 'video_title': 'INSANE _RICKY MILES (OFFICIAL MUSIC VIDEO) LATEST UGANDAN MUSIC 2022 #so_nsonyi', 'video_description': ""This is a sweet love jam about a guy who's insane about a girl but is actually shy to take a shot, Ricky Miles comes steady with euphonious vocals and lyrics written by @mulix.performed by Ricky miles, produced by Ricky miles and Mulix, video directed by Prince (One Living Director) song mixed and mastered by Feelz Kabaka."", 'video_category': '10', 'video_view_count': '536314', 'video_comment_count': '514', 'video_like_count': '8563', 'video_dislike_count': None, 'video_thumbnail': 'https://i.ytimg.com/vi/lprz-jF-_Bw/hqdefault.jpg', 'video_tags': '', 'collection_date': datetime.datetime(2025, 4, 25, 17, 24, 19, 152008)}"
insane,"{'video_id': 'nZ5SfoLB5yA', 'channel_title': 'Dream Perfect Regime', 'channel_id': 'UCtG5oKSlksz-QmD_2uI4WBw', 'video_publish_date': 1696554009.0, 'video_title': ""DPR IAN - Don't Go Insane (Official Music Video) | Dear Insanity..."", 'video_description': ""DPR IAN - Don't Go Insane (Official Music Video) | Dear Insanity...\n\nOut Now → https://orcd.co/dearinsanity\n\n_ DPR IAN \nInstagram: http://instagram.com/DPRIAN\nTwitter: http://twitter.com/DPRIAN_\nTikTok: https://www.tiktok.com/@mito.is.real\n\n_ DPR \nInstagram: http://instagram.com/dpr_official \nFacebook: https://www.facebook.com/dreamperfectregime\nYoutube: @DreamPerfectRegime\n\n#dprian #dontgoinsane #ian"", 'video_category': '10', 'video_view_count': '47641366', 'video_comment_count': '13853', 'video_like_count': '948633', 'video_dislike_count': None, 'video_thumbnail': 'https://i.ytimg.com/vi/nZ5SfoLB5yA/hqdefault.jpg', 'video_tags': ""DPR|dpr ian|Dear Insanity|Don't Go Insane|dpr|dprian|so i danced|official music video|mito|dream perfect regime|dear insanity|dear insanity dpr ian|dear insanity dpr ian album|dear insanity album|dpr ian don't go insane|don't go insane dpr ian|don't go insane|insane|dpr ian dear insanity|dpr ian music video"", 'collection_date': datetime.datetime(2025, 4, 25, 17, 24, 19, 152014)}"
insane,"{'video_id': 'R6FOFFPatds', 'channel_title': 'Eminem - Topic', 'channel_id': 'UCedvOgsKFzcK3hA5taf3KoQ', 'video_publish_date': 1532773330.0, 'video_title': 'Insane', 'video_description': 'Provided to YouTube by Universal Music Group\n\nInsane · Eminem\n\nRelapse\n\n℗ 2009 Aftermath Records\n\nReleased on: 2009-01-01\n\nMixer, Producer, Studio Personnel: Dr. Dre\nRecording Engineer, Studio Personnel: Mauricio Iragorri\nComposer Lyricist: Marshall Mathers\nComposer Lyricist: A. Young\nComposer Lyricist: M. Batson\nComposer Lyricist: D. Parker\nComposer Lyricist: T. Lawrence\nComposer Lyricist: Mike Elizondo\n\nAuto-generated by YouTube.', 'video_category': '10', 'video_view_count': '4735776', 'video_comment_count': '650', 'video_like_count': '50415', 'video_dislike_count': None, 'video_thumbnail': 'https://i.ytimg.com/vi/R6FOFFPatds/hqdefault.jpg', 'video_tags': 'Eminem|エミネム|Relapse|Insane|インセイン', 'collection_date': datetime.datetime(2025, 4, 25, 17, 24, 19, 152020)}"
