keyword,video_id
mind-blowing,"{'video_id': 'HHeYxzJFVKM', 'channel_title': 'SciShow', 'channel_id': 'UCZYTClx2T1of7BRZ86-8fow', 'video_publish_date': 1479063600.0, 'video_title': '8 Mind-Blowing Optical Illusions', 'video_description': ""Your brain does its best to inform you about the world around you, but sometimes it gets tricked. Enjoy eight optical illusions to test your brain’s sensory input.\n\nHosted by: Hank Green\n----------\nSupport SciShow by becoming a patron on Patreon: https://www.patreon.com/scishow\n----------\nDooblydoo thanks go to the following Patreon supporters -- we couldn't make SciShow without them! Shout out to James Harshaw, Kevin Bealer, Mark Terrio-Cameron, Patrick Merrithew, Accalia Elementia, Charles Southerland, Fatima Iqbal, Benny, Kyle Anderson, Tim Curwick, Will and Sonja Marple, Philippe von Bergen, Bryce Daifuku, Chris Peters, Kathy Philip, Patrick D. Ashmore, Charles George, Bader AlGhamdi.\n----------\nLike SciShow? Want to help support us, and also get things to put on your walls, cover your torso and hold your liquids? Check out our awesome products over at DFTBA Records: http://dftba.com/scishow\n----------\nLooking for SciShow elsewhere on the internet?\nFacebook: http://www.facebook.com/scishow\nTwitter: http://www.twitter.com/scishow\nTumblr: http://scishow.tumblr.com\nInstagram: http://instagram.com/thescishow\n----------\nSources:\nhttp://www.exploratorium.edu/snacks/persistence-of-vision, http://www.foundationsmag.com/persistence_of_vision.html  https://www.futurelearn.com/courses/explore-animation/0/steps/12222 \nhttp://brainden.com/afterimages.htm \nhttp://webvision.med.utah.edu/2012/06/your-brain-develops-the-negative/  http://www.animations.physics.unsw.edu.au/jw/light/complementary-colours.htm \nhttp://www.michaelbach.de/ot/mot-adapt/index.html \nhttp://www.pnas.org/content/108/45/E1080\nhttp://psylux.psych.tu-dresden.de/i1/kaw/diverses%20Material/www.illusionworks.com/html/motion_aftereffect.html http://wexler.free.fr/library/files/verstraten%20(1998)%20aftereffect%20of%20high-speed%20motion.pdf\nhttp://www.michaelbach.de/ot/mot-adapt/index.html\nhttp://www.nytimes.com/video/nyregion/100000003978572/camping-down-broadway.html  https://quote.ucsd.edu/anstislab/files/2012/12/1998-the-motion-aftereffect.pdf http://www.pnas.org/content/108/45/E1080 \nhttp://mentalfloss.com/article/28862/brainworks-explaining-optical-illusions-and-other-mental-tricks http://www.opticalillusion.net/optical-illusions/shepards-tables-whats-up/ http://www.psychologyconcepts.com/shepards-tables-illusion/ \nhttp://www.procreo.jp/labo.html \nhttp://well.blogs.nytimes.com/2008/04/28/the-truth-about-the-spinning-dancer/?_r=0 \nhttp://ipe.sagepub.com/content/1/3/143.full.pdf  http://www.medicaldaily.com/right-your-eyes-science-behind-famous-spinning-dancer-optical-illusion-336122 \nhttp://msl.cs.uiuc.edu/vr/vrch6.pdf \nhttp://www.ncbi.nlm.nih.gov/pmc/articles/PMC3761598/ \nhttp://www.med.nyu.edu/helab/sites/default/files/helab/wang-artega-he-pnas-2013-bistable-perception-wsi.pdf\nhttp://adsabs.harvard.edu/abs/2015SPIE.9487E..0VM \nhttp://www.michaelbach.de/ot/sze_silhouette/ \nhttp://psylux.psych.tu-dresden.de/i1/kaw/diverses%20Material/www.illusionworks.com/html/hermann_grid.html\nhttp://serendip.brynmawr.edu/bb/latinhib.html, http://www.indiana.edu/~p1013447/dictionary/lat_i.htm \nhttp://psylux.psych.tu-dresden.de/i1/kaw/diverses%20Material/www.illusionworks.com/html/hermann_grid.html \nhttp://www.physicsclassroom.com/class/refrn/Lesson-4/Mirages \nhttp://www.wired.com/2015/01/fantastically-wrong-fata-morgana/  http://knowledgenuts.com/2014/03/28/the-strange-explanation-for-the-flying-dutchman/ http://h2g2.com/edited_entry/A13900178 \n\n\nImages:\nRabbit Duck Illusion: https://commons.wikimedia.org/wiki/File:Duck-Rabbit_illusion.jpg\nSpinning Dancer: https://en.wikipedia.org/wiki/File:Spinning_Dancer.gif\nHerman Optical Illusion: https://commons.wikimedia.org/wiki/File:Zludzenie_Hermana.png"", 'video_category': '27', 'video_view_count': '886836', 'video_comment_count': '988', 'video_like_count': '17065', 'video_dislike_count': None, 'video_thumbnail': 'https://i.ytimg.com/vi/HHeYxzJFVKM/hqdefault.jpg', 'video_tags': 'SciShow|science|Hank|Green|education|learn|eyes|optical|illusions|cones|rods|sensory|input|mirages|mirage|stretches|intersections|Hermann-grid illusion|grid illusion|lateral inhibition|checkered square illusion|gray square|bistable illusion|spinning dancer|shepard’s tables|waterfall illusion|motion aftereffect|afterimage|retinal fatigue|afterimages|persistence of vision|video|brain|cell|cells', 'collection_date': datetime.datetime(2025, 4, 25, 17, 45, 19, 505394)}"
mind-blowing,"{'video_id': 'LcpliVYfEqk', 'channel_title': '5-Minute Crafts', 'channel_id': 'UC295-Dw_tDNtZXFeAPAW6Aw', 'video_publish_date': 1490013001.0, 'video_title': '11 MIND-BLOWING OPTICAL ILLUSIONS', 'video_description': ""Subscribe to 5-Minute Crafts here: https://www.goo.gl/8JVmuC\xa0\n\nFacebook: https://www.facebook.com/5min.crafts/\nInstagram: https://www.instagram.com/5.min.crafts/ This video is made for entertainment purposes. We do not make any warranties about the completeness, safety and reliability. Any action you take upon the information on this video is strictly at your own risk, and we will not be liable for any damages or losses. It is the viewer's responsibility to use judgment, care and precautions if one plans to replicate.\n\nThe following video might feature activity performed by our actors within controlled environment- please use judgment, care, and precaution if you plan to replicate."", 'video_category': '26', 'video_view_count': '13029730', 'video_comment_count': '4172', 'video_like_count': '86177', 'video_dislike_count': None, 'video_thumbnail': 'https://i.ytimg.com/vi/LcpliVYfEqk/hqdefault.jpg', 'video_tags': ""5-Minute Crafts|DIY|Do it yourself|crafts|useful things|lifehacks|tricks|tips|DIY projects|DIY activities|Handcraft|Tutorial|brain|brains|mind|optical|optical illusion|optical illusions|illusions|illusion|dot|point|colors|colours|trick|trick your brain|trick your eyes|eyes|spheres|line|lines|Rubik's Cube"", 'collection_date': datetime.datetime(2025, 4, 25, 17, 45, 19, 505401)}"
mind-blowing,"{'video_id': 'RKapUWxTvWI', 'channel_title': 'JRE Clips', 'channel_id': 'UCnxGkOGNMqQEUMvroOWps6Q', 'video_publish_date': 1490743748.0, 'video_title': 'Joe Rogan has his mind blown by Lawrence Krauss', 'video_description': 'Joe Rogan has his mind blown when Lawrence Krauss discusses the universe, and the possibility of the multi-verse.\n\nTaken from Joe Rogan Experience #938.', 'video_category': '23', 'video_view_count': '4114112', 'video_comment_count': '8330', 'video_like_count': '63481', 'video_dislike_count': None, 'video_thumbnail': 'https://i.ytimg.com/vi/RKapUWxTvWI/hqdefault.jpg', 'video_tags': 'Joe Rogan Experience|podcast|MMA|UFC|comedy|comedian|stand up|funny|JRE|clip|favorite|best of|Joe Rogan', 'collection_date': datetime.datetime(2025, 4, 25, 17, 45, 19, 505406)}"
mind-blowing,"{'video_id': 'FlHroIeWpW0', 'channel_title': 'ZNN Network', 'channel_id': 'UC0SQ2dn42tp74pBPofcZvLw', 'video_publish_date': 1464674201.0, 'video_title': 'Mind Blowing Breakthroughs - Akıl Uçuran Buluşlar', 'video_description': '', 'video_category': '1', 'video_view_count': '1498', 'video_comment_count': '0', 'video_like_count': '3', 'video_dislike_count': None, 'video_thumbnail': 'https://i.ytimg.com/vi/FlHroIeWpW0/hqdefault.jpg', 'video_tags': 'mind blowing|comic|animation|4k screen|tv series|scientist|science', 'collection_date': datetime.datetime(2025, 4, 25, 17, 45, 19, 505412)}"
mind-blowing,"{'video_id': 'tTbY_EeC9Wg', 'channel_title': 'tothszabi', 'channel_id': 'UC5ADnWun2lZUHgqZXa9Q3Hw', 'video_publish_date': 1485056603.0, 'video_title': 'A mind-blowing Sitar player', 'video_description': 'A mind-blowing Sitar of Rajeev Janardan: Raga Khammaj\n\nLightspeed musical movements, 6 cameras 1 amazing musician 1 amazing instrument. A mind-blowing 3-minute Raga Khammaj on Sitar.\nRajeev Janardan is a proud torchbearer of the Imdadkhani Etawah Gharana and following the legacy of his gurus, Pandit Bimlendu Mukherjee and Pandit Arvind Parikh.\n\nhttp://rajeevjanardan.com/\n\nAt the beginning of the 20th century, because of the limitations of gramophone recordings, the greatest artists of that age, like Imdad Khan, Enayat Khan recorded proper, but 3-minute long ragas, showing the beauty of the music and the possibilities of the Sitar as well.\n\nVideo: Oliver Sin (http://1foto.hu)\nCameramen: Bihari András (https://www.facebook.com/everybodyisone)\nZafir Daniel (http://look-c.net/)', 'video_category': '10', 'video_view_count': '2406523', 'video_comment_count': '1990', 'video_like_count': '43867', 'video_dislike_count': None, 'video_thumbnail': 'https://i.ytimg.com/vi/tTbY_EeC9Wg/hqdefault.jpg', 'video_tags': 'Imdad Khani Gharana|Sitar|lightspeed|vilayat|khan|vilayat khan|raag|live|pandit|ustad|khammaj|india|top 5 sitar', 'collection_date': datetime.datetime(2025, 4, 25, 17, 45, 19, 505417)}"
mind-blowing,"{'video_id': 'cs1CbiYuCoo', 'channel_title': 'Tasty', 'channel_id': 'UCJFp8uSYCjXOMnkUyb3CQ3Q', 'video_publish_date': 1509620424.0, 'video_title': '9 Mind-Blowing Food Party Rings', 'video_description': 'Reserve the One Top: http://bit.ly/2v0iast\n\nGet the recipes: http://bzfd.it/2ykYqCT\n\nCheck us out on Facebook! - facebook.com/buzzfeedtasty\n\nCredits: https://www.buzzfeed.com/bfmp/videos/35819\n\nMUSIC\nLicensed via Audio Network', 'video_category': '26', 'video_view_count': '13550317', 'video_comment_count': '2265', 'video_like_count': '192804', 'video_dislike_count': None, 'video_thumbnail': 'https://i.ytimg.com/vi/cs1CbiYuCoo/hqdefault.jpg', 'video_tags': 'K_fe|alfredo|appetizer|artichoke|bbq chicken|bread|buffalo chicken|buzzfeed|buzzfeed tasty|cheese|chicken|chili dog|dinner|diy|do it yourself|food|garlic knot|ham|lasagna|meatball|party|party food|pasta|quesadilla|recipe|recipes|sandwich|snack|spinach|spinach and artichoke dip|tasty', 'collection_date': datetime.datetime(2025, 4, 25, 17, 45, 19, 505423)}"
mind-blowing,"{'video_id': 'WeLQpUC2IW4', 'channel_title': 'Steve TV Show', 'channel_id': 'UCEs-zSwH2NYGskxF-ptoT1w', 'video_publish_date': 1507920668.0, 'video_title': 'Watch This Mind Blowing Magic Trick', 'video_description': 'Not only can this magician unlock Steve Harvey’s phone, he leaves wondering what’s reality with his mind-boggling, show-stopping trick.\n\n\nSUBSCRIBE to get the latest #STEVETVShow:\n\nConnect with STEVE online!\n\nVisit the STEVE WEBSITE: http://www.stevetv.com\nLike STEVE on FACEBOOK: https://www.facebook.com/SteveTVShow/\nLike Steve Harvey on FACEBOOK: \nhttps://www.facebook.com/SteveHarvey/\nFollow @SteveTVShow on TWITTER: http://twitter.com/stevetvshow\nFollow @IamSteveHarvey on TWITTER: https://twitter.com/IAmSteveHarvey\nFollow @SteveTVShow on INSTAGRAM: https://www.instagram.com/stevetvshow/', 'video_category': '24', 'video_view_count': '13134853', 'video_comment_count': '4112', 'video_like_count': '131378', 'video_dislike_count': None, 'video_thumbnail': 'https://i.ytimg.com/vi/WeLQpUC2IW4/hqdefault.jpg', 'video_tags': 'Steve|Harvey|funny|humor|comedy|tv|steve harvey|steve harvey daytime|steve harvey show|Talk Show (TV Genre)', 'collection_date': datetime.datetime(2025, 4, 25, 17, 45, 19, 505429)}"
mind-blowing,"{'video_id': 'Ed31RVDofs8', 'channel_title': 'Da Vinci Quint', 'channel_id': 'UCIAxQhRxWrAYfWUjdLYcSTw', 'video_publish_date': 1484118775.0, 'video_title': 'MIND BLOWING BREAKTHROUGHS', 'video_description': '', 'video_category': '22', 'video_view_count': '1629', 'video_comment_count': '0', 'video_like_count': '5', 'video_dislike_count': None, 'video_thumbnail': 'https://i.ytimg.com/vi/Ed31RVDofs8/hqdefault.jpg', 'video_tags': '', 'collection_date': datetime.datetime(2025, 4, 25, 17, 45, 19, 505446)}"
mind-blowing,"{'video_id': 'pRRUgI_iUXI', 'channel_title': 'Top Trending', 'channel_id': 'UCtg5C-d_3rPUgMaxr285mQQ', 'video_publish_date': 1492200953.0, 'video_title': '10 Mind Blowing Tricks Advertisers Use to Manipulate Photos', 'video_description': 'Here are 10 crazy tricks advertisers use to manipulate photos\n\nMade In France ASMR: https://www.youtube.com/user/MadeInFranceASMR\n\nWATCH MORE VIDEOS LIKE THIS ONE HERE:\n10 Biggest Advertising Fails: https://www.youtube.com/watch?v=vwL9kkZAI9w\n10 Riddles That Will Blow Your Mind: https://www.youtube.com/watch?v=EiWdTTRVX-Y\n10 Biggest Magic Tricks REVEALED: https://www.youtube.com/watch?v=j1auDbCpz1o\n\nVisit our site: http://www.TopTrending.com\nLike us on Facebook: https://www.facebook.com/TopTrending\nFollow us on Twitter: https://twitter.com/TopTrending\n\nCommentator: http://www.youtube.com/user/BaerTaffy\n\n10 Mind Blowing Tricks Advertisers Use to Manipulate Photos', 'video_category': '24', 'video_view_count': '2468706', 'video_comment_count': '1365', 'video_like_count': '22880', 'video_dislike_count': None, 'video_thumbnail': 'https://i.ytimg.com/vi/pRRUgI_iUXI/hqdefault.jpg', 'video_tags': 'advertising|facts|mind blowing|tricks|fake|real|blow your mind|manipulate|advertiser tricks|marketing|fast food|photography', 'collection_date': datetime.datetime(2025, 4, 25, 17, 45, 19, 505454)}"
mind-blowing,"{'video_id': 'tpLLst4-3fw', 'channel_title': 'BRIGHT SIDE', 'channel_id': 'UC4rlAVgAK0SGk-yTfe48Qpw', 'video_publish_date': 1506988805.0, 'video_title': '7 Riddles That Will Test Your Brain Power', 'video_description': ""💡 Brighten your style with our MERCH (open globally!) here: http://bit.ly/2OJubyA\n\nThese 7 puzzles will trick your brain. 😉 Take this fun test to\xa0check the sharpness and productivity of\xa0your brain. Try to\xa0answer these questions as\xa0quickly as\xa0possible and see the results! 👍\n\nOur brain is a mysterious thing. We know more about stars than about the things inside our heads! But what we do know about the brain is that it gets less sharp and productive with age. \nYou have a maximum of 20 seconds for each task, but try to answer the questions as fast as possible. \n\nTIMESTAMPS\nWhat is the mistake two photos have in common? 0:45\nHow many holes does the T-shirt have? 1:53\nHow would you name this tree? 2:40\nCan you solve this riddle one in 5 seconds? 3:21\nDo you see a hidden baby? 4:26\nWhich line is longer? 5:12\nCan you spot Mike Wazowski? 6:30\n\n#riddles #hardtest #brainteasers \n\nSUMMARY\nIf it took you more than 20 seconds to answer each question, or you didn't manage all the tasks, it means that you have the brain of a mature person. It 's hard for you to make your mind see beyond the obvious and you can't handle change easily. \nIf took you less than 20 seconds, your brain is quite young, and you can approach tasks from different angles. \nIf you answered each question correctly in less than 5 seconds, your brain is very young and flexible! You can notice the tiniest details right away and adapt to new situations easily! \n\nWhat is your result? Tell us in the comment section below! \n\nSubscribe to our new channel 'SLICK SLIME SAM' - https://goo.gl/zarVZo\nGive a thumbs–up to see more adventures! \n\n\nSubscribe to Bright Side : https://goo.gl/rQTJZz\n\n----------------------------------------------------------------------------------------\nOur Social Media:\n\nFacebook: https://www.facebook.com/brightside/\nInstagram: https://www.instagram.com/brightgram/\n5-Minute Crafts Youtube: https://www.goo.gl/8JVmuC\xa0\n\n----------------------------------------------------------------------------------------\nFor more videos and articles visit:\nhttp://www.brightside.me/"", 'video_category': '26', 'video_view_count': '60054915', 'video_comment_count': '85381', 'video_like_count': '759540', 'video_dislike_count': None, 'video_thumbnail': 'https://i.ytimg.com/vi/tpLLst4-3fw/hqdefault.jpg', 'video_tags': 'riddles|brainteasers|riddles that will trick your friends|riddles that will blow your mind|riddles and brain teasers with answers|puzzles|riddles for kids|tricky questions|hard riddles|riddles with answers|riddles that will trick your mind|your personality|personality test|test your brain|test your personality|reveals the truth', 'collection_date': datetime.datetime(2025, 4, 25, 17, 45, 19, 505461)}"
mind-blowing,"{'video_id': 'OpOT4QD3CeE', 'channel_title': 'YamoonaSong', 'channel_id': 'UC3T9zccaNU0itrMl_nKS0dg', 'video_publish_date': 1466362041.0, 'video_title': 'Mind Blowing Michael Jackson 2/2', 'video_description': ""Greatness of MJ performances live.\nGrand, mesmerizing, mind blowing. He gave it all on stage.\nSome of King of Pop's best dance moves.\nPublic and fans going crazy and fainting.\n\nMichael Jackson, à la folie, à la démesure (partie 2) :\nLes performances live époustouflantes de MJ.\nGrandiose, hypnotisant. Il se donnait à fond sur scène.\n\nMusic : Freedom Fighters by Two Steps from Hell"", 'video_category': '10', 'video_view_count': '3174', 'video_comment_count': '6', 'video_like_count': '75', 'video_dislike_count': None, 'video_thumbnail': 'https://i.ytimg.com/vi/OpOT4QD3CeE/hqdefault.jpg', 'video_tags': 'Michael Jackson|MJJ|King of Pop|Live|fans|fainting|performance|dance moves|on stage|mind blowing|amazing|MJ', 'collection_date': datetime.datetime(2025, 4, 25, 17, 45, 19, 505467)}"
mind-blowing,"{'video_id': 'bHAcRWmDSCk', 'channel_title': 'Balakrishna Muduli', 'channel_id': 'UC1MWYSYdKaGOaCXR1jm5wBA', 'video_publish_date': 1476699381.0, 'video_title': '@Mind Blowing Dance song', 'video_description': '@Mind Blowing Dance song', 'video_category': '10', 'video_view_count': '96983003', 'video_comment_count': '3434', 'video_like_count': '206234', 'video_dislike_count': None, 'video_thumbnail': 'https://i.ytimg.com/vi/bHAcRWmDSCk/hqdefault.jpg', 'video_tags': 'song|dance|mind fresh|dj song|mindblowing|party|bass|blowup', 'collection_date': datetime.datetime(2025, 4, 25, 17, 45, 19, 505472)}"
mind-blowing,"{'video_id': 'FgRGOqd09ms', 'channel_title': 'Top 10 Archive', 'channel_id': 'UCa03bf8gAS2EtffptV-_jfA', 'video_publish_date': 1462850850.0, 'video_title': 'TOP 10 MIND BLOWING OPTICAL ILLUSIONS', 'video_description': ""Welcome to Top10Archive! Optical illusions are characterized by visually perceived images that differ from objective reality. Optical illusions are pretty neat little tricks of the brain, and the ability for it to not recognize certain patterns in the such. in our Top10 Best Optical Illusions.\n\nSupport us by shopping on Amazon! http://tinyurl.com/njwyzzn\nCheck out our website: http://www.top10archive.net\nGEEK FUEL: http://geekfuel.com/top10\nFollow Us on Twitter: https://twitter.com/top10archives\nFollow Us on Facebook: https://www.facebook.com/top10archives\n\n10. Ambiguous Image\n9. Afterimage Illusion\n8. Fading Image Illusion\n7. False Spiral Illusion (Fraser Spiral)\n6. Impossible Object\n5. Troxler's Fading (Lilac Chaser)\n4. Thaumatrope\n3. Müller-Lyer illusion\n2. Hering Illusion\n1. Devil's Fork Illusion (Blivet)\n\nReferences:\nhttps://psychlopedia.wikispaces.com/Ambigous+Figures\nhttp://mathworld.wolfram.com/YoungGirl-OldWomanIllusion.html\nhttp://brainden.com/images/jesus-illusion-big.jpg\nhttp://brainden.com/afterimages.htm\nhttp://cdn4.list25.com/wp-content/uploads/2011/11/235.jpg\nhttp://www.moillusions.com/troxlers-fading-optical-illusion/\nhttp://mathworld.wolfram.com/FrasersSpiral.html\nhttp://brainden.com/impossible-objects.htm\nhttp://www.123opticalillusions.com/pages/lilac_chaser.php\nhttp://www.livescience.com/33664-amazing-optical-illusions-work.html\nhttp://courses.ncssm.edu/gallery/collections/toys/html/exhibit06.htm\nhttps://en.wikipedia.org/wiki/Persistence_of_vision\nhttp://www.foundationsmag.com/persistence_of_vision.html\nhttps://www.rit.edu/cla/gssp400/muller/muller.html\nhttp://mathworld.wolfram.com/HeringIllusion.html\nhttp://www.newworldencyclopedia.org/entry/Hering_illusion\nhttp://luxemodo.com/wp-content/uploads/2014/06/pic-blivet_1121096i.jpg\nhttp://www.moillusions.com/blivet-devils-fork-illusion-collecton/\n\nVoice Over Talent:\nwww.JimDenisonVoice.com\nwww.Facebook.com/denisonvoice\nTwitter: @JimDenisonVoice\nAudio Books: http://tinyurl.com/nlrjbyb"", 'video_category': '27', 'video_view_count': '95201', 'video_comment_count': '152', 'video_like_count': '1358', 'video_dislike_count': None, 'video_thumbnail': 'https://i.ytimg.com/vi/FgRGOqd09ms/hqdefault.jpg', 'video_tags': 'Top 10|Optical Illusions|Optical Illusion|Illusion|top10archive|top 10 archive|illusions|top 10 optical illusions|10 optical illusions|best optical illusions|top 10 illusions|top optical illusions|top 10 best illusions ever|spiral illusions|10 illusions|top illusions|blow your mind|spiral illusion|optical illusions jesus|blivet or not|top 5 illusions|optical illusions spiral|jesus optical illusion|mind tricks illusions|10 best optical illusions', 'collection_date': datetime.datetime(2025, 4, 25, 17, 45, 19, 505478)}"
mind-blowing,"{'video_id': 'A5_i2JDZH38', 'channel_title': 'SHOT GLASS PICTURES', 'channel_id': 'UCBDO2b0iVC3mvCNUPO1VFpg', 'video_publish_date': 1481165195.0, 'video_title': ""Mind Blowing 5 / Colgate (Director's Cut)"", 'video_description': '', 'video_category': '22', 'video_view_count': '313446', 'video_comment_count': '5', 'video_like_count': '299', 'video_dislike_count': None, 'video_thumbnail': 'https://i.ytimg.com/vi/A5_i2JDZH38/hqdefault.jpg', 'video_tags': '', 'collection_date': datetime.datetime(2025, 4, 25, 17, 45, 19, 505484)}"
mind-blowing,"{'video_id': 'nIbnUMqLQ78', 'channel_title': 'MercifulServant', 'channel_id': 'UCHGAqdQBKTVON_FUCIYCh3Q', 'video_publish_date': 1454166604.0, 'video_title': 'The Throne of Allah - Mindblowing', 'video_description': 'Mercifulservant Merch: https://teespring.com/stores/mercifulservant-brand\n\nThis production was created in partnership with Ayat, and has been reacted to by hundreds of YouTubers! the video gives the viewer a brief but powerful explanation of who Allah is and His greatness.\n\nAyatul Kursi at the end of the video is Quran 2:255* (please ignore the typo)\n\nAyat: https://goo.gl/fF09sn\nwww.facebook.com/AyatofLife\n\nMERCIFULSERVANT SUPPORTERS: https://www.patreon.com/mercifulservant\n► Subscribe Now: https://goo.gl/2tmfa8\n► Telegram Group: https://t.me/officialmercifulservant\n► Become A Member: https://www.patreon.com/mercifulservant\n► https://www.mercifulservant.tv/ (coming soon)\n\nMS Website: https://www.mercifulservant.tv/ (coming soon)\nMS Telegram: https://t.me/officialmercifulservant\nMS Facebook: https://www.facebook.com/MercifulServantHD\nMS Twitter: https://twitter.com/MercifulServnt\nMS Instagram: http://instagram.com/mercifulservant\nMS SoundCloud: http://www.soundcloud.com/mercifulservant\nPersonal Facebook: https://www.facebook.com/mercifulservant\n\nCOPYRIGHT NOTICE:\nWe allow others to translate our content for educational purposes only and please do not reupload without prior permission.\n\nVideo Footage: All footage and Images used in this production are licensed to MercifulServant Media, you are not permitted to cut clips and use in your own videos (without permission from the owner of the stock footage) Please contact us for more information.\n\nContact: themercifulservant@gmail.com with any queries', 'video_category': '27', 'video_view_count': '7238951', 'video_comment_count': '27174', 'video_like_count': '166426', 'video_dislike_count': None, 'video_thumbnail': 'https://i.ytimg.com/vi/nIbnUMqLQ78/hqdefault.jpg', 'video_tags': ""Islam|Muslim|Allah|lecture|Reminder|merciful|servant|themercifulservant|islamic|allah|god|Allah's throne|amazing|powerful|reminder|throne of god|who is god|where is God|God"", 'collection_date': datetime.datetime(2025, 4, 25, 17, 45, 19, 505490)}"
mind-blowing,"{'video_id': 'X35c-KwKZYA', 'channel_title': 'Elite Facts    1.8m views     2 days ago', 'channel_id': 'UCKXpm9r0WE-0xdJl6hjyT8g', 'video_publish_date': 1455487201.0, 'video_title': '20 Mind Blowing Optical Illusions', 'video_description': ""20 Most Amazing Optical Illusions that will melt your mind!\n\n1. Is the cat coming up some stairs or walking down towards you?\n\n2. I bet this seat had you fooled\n\n3. Just follow the instructions for a good laugh\n\n4. Some simple lines can make objects seem much larger\n\n5. What is this an image of?\n\n6. What woman do you see?\n\n7. First see the ducks, now tilt your head\n\n8. This dress took the internet by storm; is it white and gold or black and blue?\n\n9. What 2 images can you make out here?\n\n10. If you're colorblind you're gonna find this difficult\n\n11. Which level did you look at first?\n\n12. Another example of using colour to become a completely new image\n\n13. This amazing image seamlessly intertwines with each other\n\n14. A very clever use of colour and imagery here\n\n15. What image do you see here?\n\n16. First look at the elephant from top to bottom and then look from bottom to top\n\n17. Which of the yellow lines is bigger?\n\n18. These stairs are never ending\n\n19. Do you see the hidden images here?\n\n20. No matter how hard you try you can't focus on either of the faces"", 'video_category': '24', 'video_view_count': '2277524', 'video_comment_count': '1044', 'video_like_count': '6753', 'video_dislike_count': None, 'video_thumbnail': 'https://i.ytimg.com/vi/X35c-KwKZYA/hqdefault.jpg', 'video_tags': '10 amazing illusions|11 optical illusions that will trick your eyes|15 easy magic tricks to amaze your friends|best minecraft optical illusions|mindblowing illusions in lego|mindblowing minecraft illusions|only 1 can see this|the best optical illusion|this minecraft illusion will blow your mind|this optical illusion will trick your mind|this will confuse you|this will trick your eyes|ultimate mind bending illusions', 'collection_date': datetime.datetime(2025, 4, 25, 17, 45, 19, 505496)}"
