keyword,video_id
incredible,"{'video_id': 'ql_hDyyeO-Q', 'channel_title': 'New Music Friday', 'channel_id': 'UCu2mzi-mqjsAM-xw5iXNJUA', 'video_publish_date': 1491935437.0, 'video_title': 'Future - Incredible (HNDRXX)', 'video_description': '""Hndrxx"" Available at iTunes: http://smarturl.it/HNDRXX\nApple Music: http://smarturl.it/HNDRXX.AM\nSpotify: http://smarturl.it/HNDRXX.Sptfy\nGoogle Play: http://smarturl.it/HNDRXX.GP\nAmazon Digital: http://smarturl.it/HNDRXX.Dig\nDeezer: http://smarturl.it/HNDRXX.Dzr\nSoundcloud: http://smarturl.it/HNDRXX.SC\nTidal: http://smarturl.it/HNDRXX.Tidal\n\nFuture ""FUTURE"" available at: iTunes: http://smarturl.it/FUTURE.iTunes\nApple Music: http://smarturl.it/FUTURE.AM\nSpotify: http://smarturl.it/FUTURE.Sptfy\nGoogle Play: http://smarturl.it/FUTURE.GP\nAmazon Digital: http://smarturl.it/FUTURE.Dig\nDeezer: http://smarturl.it/FUTURE.Dzr\nSoundcloud: http://smarturl.it/FUTURE.SC\nTidal: http://smarturl.it/FUTURE.Tidal\n\nFollow Future:\nhttps://twitter.com/1future\nhttps://facebook.com/futureofficial\nhttps://instagram.com/future\nhttps://youtube.com/officialfuturevideos\nhttps://soundcloud.com/futureisnow\nhttps://futurefreebandz.com\n\nAll songs uploaded to this channel are done so with permission from the legal rights holders', 'video_category': '24', 'video_view_count': '16373817', 'video_comment_count': '2377', 'video_like_count': '112101', 'video_dislike_count': None, 'video_thumbnail': 'https://i.ytimg.com/vi/ql_hDyyeO-Q/hqdefault.jpg', 'video_tags': 'future|incredible|hndrxx', 'collection_date': datetime.datetime(2025, 4, 25, 17, 45, 19, 394651)}"
incredible,"{'video_id': 'pAa8SRAPGAw', 'channel_title': 'M-Beat - Topic', 'channel_id': 'UCeep6-46n_F1EJ_tUw2vEuA', 'video_publish_date': 1452707949.0, 'video_title': 'Incredible', 'video_description': 'Provided to YouTube by The Orchard Enterprises\n\nIncredible · General Levy · M Beat\n\nJungle Hits, Vol. 1\n\n℗ 1994 Jet Star Music\n\nReleased on: 1994-02-11\n\nAuto-generated by YouTube.', 'video_category': '10', 'video_view_count': '378207', 'video_comment_count': '34', 'video_like_count': '5926', 'video_dislike_count': None, 'video_thumbnail': 'https://i.ytimg.com/vi/pAa8SRAPGAw/hqdefault.jpg', 'video_tags': 'General Levy M Beat Jungle Hits|Vol. 1 Incredible', 'collection_date': datetime.datetime(2025, 4, 25, 17, 45, 19, 394662)}"
incredible,"{'video_id': '-UaGUdNJdRQ', 'channel_title': 'Rotten Tomatoes Classic Trailers', 'channel_id': 'UCTCjFFoX1un-j7ni4B6HJ3Q', 'video_publish_date': 1510343415.0, 'video_title': 'The Incredibles (2004) Trailer #1 | Movieclips Classic Trailers', 'video_description': ""The Incredibles (2004) Trailer #1: Check out the trailer starring Craig T. Nelson, Samuel L. Jackson, and Holly Hunter! Be the first to watch, comment, and share old trailers dropping @MovieclipsClassicTrailers.\n\n► Buy or Rent on FandangoNOW: https://www.fandangonow.com/details/movie/the-incredibles-2004/MMV2405C125068ECB289E8CB7A3C19EEA2B6?ele=searchresult&elc=the%20incredible&eli=0&eci=movies?cmp=MCYT_YouTube_Desc \n\nWatch more Classic Trailers: \n► Classic Horror Films Playlist http://bit.ly/2ovE2sV \n► Classic Remade Films Playlist http://bit.ly/2nQX1eG \n► Classic Superhero Films Playlist http://bit.ly/2o3saxE \n\nIn this lauded Pixar animated film, married superheroes Mr. Incredible (Craig T. Nelson) and Elastigirl (Holly Hunter) are forced to assume mundane lives as Bob and Helen Parr after all super-powered activities have been banned by the government. While Mr. Incredible loves his wife and kids, he longs to return to a life of adventure, and he gets a chance when summoned to an island to battle an out-of-control robot. Soon, Mr. Incredible is in trouble, and it's up to his family to save him.\n\nSubscribe to CLASSIC TRAILERS: http://bit.ly/1u43jDe\nWe're on SNAPCHAT: http://bit.ly/2cOzfcy\nLike us on FACEBOOK: http://bit.ly/1QyRMsE\nFollow us on TWITTER: http://bit.ly/1ghOWmt\n\nWelcome to the Fandango MOVIECLIPS Trailer Vault Channel. Where trailers from the past, from recent to long ago, from a time before YouTube, can be enjoyed by all. We search near and far for original movie trailer from all decades. Feel free to send us your trailer requests and we will do our best to hunt it down."", 'video_category': '1', 'video_view_count': '4846792', 'video_comment_count': '0', 'video_like_count': '17034', 'video_dislike_count': None, 'video_thumbnail': 'https://i.ytimg.com/vi/-UaGUdNJdRQ/hqdefault.jpg', 'video_tags': 'the incredibles|the incredibles trailer|2004|the incredibles movie|craig t. nelson|samuel l. jackson|holly hunter|jason lee|mr. incredible|elastigirl|frozone|syndrome|jack jack|dash parr|violet|superhero|superhero family|family|animated|animation|animated movie|undercover|pixar|pixar movie', 'collection_date': datetime.datetime(2025, 4, 25, 17, 45, 19, 394671)}"
incredible,"{'video_id': 'CYoThQVJ5aE', 'channel_title': '4agin', 'channel_id': 'UCWa_BB8xwSsQaGeRMaMQ3eg', 'video_publish_date': 1497497613.0, 'video_title': 'E3 Cringe — Incredible', 'video_description': '', 'video_category': '20', 'video_view_count': '91621', 'video_comment_count': '139', 'video_like_count': '2728', 'video_dislike_count': None, 'video_thumbnail': 'https://i.ytimg.com/vi/CYoThQVJ5aE/hqdefault.jpg', 'video_tags': '', 'collection_date': datetime.datetime(2025, 4, 25, 17, 45, 19, 394744)}"
incredible,"{'video_id': 'IRPI3lSACFc', 'channel_title': 'TripleKillionare', 'channel_id': 'UCYH7AOURhl2YnnF_p7eQXmA', 'video_publish_date': 1464811001.0, 'video_title': 'Mr. Incredible learns the truth...', 'video_description': ""After escaping the attempt on his life, Mr. Incredible sneaks back into Syndrome's lair to find out a dirty secret."", 'video_category': '1', 'video_view_count': '6254214', 'video_comment_count': '10954', 'video_like_count': '90222', 'video_dislike_count': None, 'video_thumbnail': 'https://i.ytimg.com/vi/IRPI3lSACFc/hqdefault.jpg', 'video_tags': 'Gazerbeam|mr incredible|the incredibles|2004|pixar|disney|sequel|stealth|spy|espionage|truth', 'collection_date': datetime.datetime(2025, 4, 25, 17, 45, 19, 394751)}"
incredible,"{'video_id': 'tFmqiGjVpg8', 'channel_title': 'Ocean Adventures', 'channel_id': 'UC0wkDrm8nQ7XeqcFj7VM7gw', 'video_publish_date': 1504778643.0, 'video_title': 'TOP 10 SHIPS in STORM! Incredible Monster Waves! A Video You Must See!', 'video_description': 'A TOP 10 compilation with monster waves.\nWatch also this increbile video: https://www.youtube.com/watch?v=1hwg_1-1jwE The most dangerous railways in the world!\nSHARE ON FACEBOOK: http://goo.gl/VwpSQN\nThe largest ships in the world, ships in storm and rough seas, awesome big ships and much more\n\nAn incredible compilation having navy ships in extreme ocean storm and heavy wind, cruise ships and merchant ships in a storm force 10, ocean big and giant waves, world\'s largest cruise ship, epic waves, luxury criuses in the Caribbean sea, 10 meters and 80 know winds, grand voyager ship, Luno ship, yacht and crazy boats, awesome big ship launches and more.\n\n\n\nCREDITS\n\nSome videos are used in accordance with CC license:\n- ""Charles est photographe de mer et Danielle compose avec ses coquillages"" from ""France 3 Bretagne"" (youtube.com/francetroisbretagne)\n- ""Video looking out cabin window at 15 ft. plus waves"" from Kathy (flickr.com/44603071@N00)\n\nAny issue, please contact: ytchannel.nospam(at)gmail .com', 'video_category': '19', 'video_view_count': '28945210', 'video_comment_count': '675', 'video_like_count': '58853', 'video_dislike_count': None, 'video_thumbnail': 'https://i.ytimg.com/vi/tFmqiGjVpg8/hqdefault.jpg', 'video_tags': 'ship|ships|ships in storm|storm|ship in storm|monster waves of the sea|monster waves|waves|wave|incredible|epic|boat|boats|cruise|bahamas|fishing|water|ocean|concordia|navy|rough seas|rough sea|compilation|top 10|heavy sea|seafarers|discovery|pacific|adventures|big ship|holiday|luxury|vacation|extreme|Oasis of the Seas|Caribbean|yacht|cabin|first class|suite|airport|airports|airplane|tropical|tornado|hurricane|florida|cruises|pier|coast|thunderstorm', 'collection_date': datetime.datetime(2025, 4, 25, 17, 45, 19, 394757)}"
incredible,"{'video_id': 'vBk0P27QGmc', 'channel_title': 'Lucas', 'channel_id': 'UCqcsSO1pUtUegIpxQHXCFkA', 'video_publish_date': 1457566127.0, 'video_title': 'Talented, brilliant, incredible, amazing, show stopping, spectacular, never the same, totally unique', 'video_description': 'Talented, brilliant, incredible, amazing, show stopping, spectacular, never the same, totally unique, completely not ever been done before, unafraid to reference or not reference, put it in a blender, shit on it, vomit on it, eat it, give birth to it', 'video_category': '24', 'video_view_count': '2765115', 'video_comment_count': '4269', 'video_like_count': '111932', 'video_dislike_count': None, 'video_thumbnail': 'https://i.ytimg.com/vi/vBk0P27QGmc/hqdefault.jpg', 'video_tags': 'gaga|lady gaga|ahs', 'collection_date': datetime.datetime(2025, 4, 25, 17, 45, 19, 394762)}"
incredible,"{'video_id': 'ZWRySOtRuiQ', 'channel_title': 'GuitarXplosion', 'channel_id': 'UCEl6loxUWLIF67lb8rPIyCQ', 'video_publish_date': 1510817236.0, 'video_title': 'Steve Vai - Incredible ""Whispering A Prayer"" - New York 2016', 'video_description': 'Live in New York, 2016.05.11', 'video_category': '10', 'video_view_count': '5732196', 'video_comment_count': '2563', 'video_like_count': '46877', 'video_dislike_count': None, 'video_thumbnail': 'https://i.ytimg.com/vi/ZWRySOtRuiQ/hqdefault.jpg', 'video_tags': 'Steve Vai|Whispering A Prayer|New York|whispering a prayer live|ibanez guitars|jem|steve vai live|vai crossroads|jeremy colson|alien love secrets|for the love of god|liberty|passion and warfare|carvin amps', 'collection_date': datetime.datetime(2025, 4, 25, 17, 45, 19, 394768)}"
incredible,"{'video_id': 'SqMCYdqaFCQ', 'channel_title': 'Joulu', 'channel_id': 'UC6PKOPRZq2uUW6NAOGVPw4A', 'video_publish_date': 1505639591.0, 'video_title': 'Mr. Incredible meets Syndrome scene Full HD', 'video_description': 'I do not own this movie', 'video_category': '22', 'video_view_count': '1998705', 'video_comment_count': '0', 'video_like_count': '18584', 'video_dislike_count': None, 'video_thumbnail': 'https://i.ytimg.com/vi/SqMCYdqaFCQ/hqdefault.jpg', 'video_tags': 'Incredibles|Syndrome|Syndrome scene|pixar|The Incredibles Syndrome scene Full HD|Mr Incredible meets Syndrome|Syndorme first scene|down Syndrome|syndrome hd|syndrome full hd|Mr Incredible', 'collection_date': datetime.datetime(2025, 4, 25, 17, 45, 19, 394773)}"
incredible,"{'video_id': '3KPYIaks1UY', 'channel_title': 'CNET', 'channel_id': 'UCOmcA3f_RrH6b9NmcNa4tdg', 'video_publish_date': 1454498893.0, 'video_title': ""Watch Bose's incredible electromagnetic car suspension system in action"", 'video_description': ""Bose's new beat - http://www.cnet.com/news/bose-behind-the-scenes/\n\nBose spent years developing the ultimate suspension system that offered a super smooth, magic-carpet like ride. It was a technical success but a commercial flop. See why.\n\nNever miss a deal again! See CNET’s browser extension 👉 https://bit.ly/3lO7sOU\nSubscribe to CNET: http://bit.ly/17qqqCs\nWatch more CNET videos: http://www.cnet.com/video\nFollow CNET on Twitter: http://twitter.com/CNET\nFollow CNET on Facebook: http://www.facebook.com/cnet"", 'video_category': '28', 'video_view_count': '9291593', 'video_comment_count': '5018', 'video_like_count': '103180', 'video_dislike_count': None, 'video_thumbnail': 'https://i.ytimg.com/vi/3KPYIaks1UY/hqdefault.jpg', 'video_tags': 'Bose|Car Tech|David Carnoy|suspension|bose|active suspension|bose product video|bose video|potholes on cars|off road|off-road|suspension lifts|suspension lift|suspension lift kit|suspension lift kits|first look|bose corporation|shock absorber|car suspension|speaker tech|automotive|automobile|Bose system|car suspension test|suspension test|check your suspension|damper|suspension inspection|suspension check|car diy|where is car suspension|Bose Ride', 'collection_date': datetime.datetime(2025, 4, 25, 17, 45, 19, 394779)}"
incredible,"{'video_id': 'zEkYAzSpHnA', 'channel_title': 'Netflix', 'channel_id': 'UCWOA1ZGywLbqmigxE4Qlvuw', 'video_publish_date': 1501021194.0, 'video_title': 'The Incredible Jessica James | Official Trailer [HD] | Netflix', 'video_description': ""Fierce, passionate, and unapologetic: The Incredible Jessica James is now streaming on Netflix.\n\nWatch Jessica James:\nhttps://www.netflix.com/title/80171022\n\nSUBSCRIBE: http://bit.ly/29qBUt7\n\nAbout Netflix:\nNetflix is the world's leading internet entertainment service with 130 million memberships in over 190 countries enjoying TV series, documentaries and feature films across a wide variety of genres and languages. Members can watch as much as they want, anytime, anywhere, on any internet-connected screen. Members can play, pause and resume watching, all without commercials or commitments.\n\nConnect with Netflix Online:\nVisit Netflix WEBSITE: http://nflx.it/29BcWb5\nLike Netflix on FACEBOOK: http://bit.ly/29kkAtN\nFollow Netflix on TWITTER: http://bit.ly/29gswqd\nFollow Netflix on INSTAGRAM: http://bit.ly/29oO4UP\nFollow Netflix on TUMBLR: http://bit.ly/29kkemT\n\nThe Incredible Jessica James | Official Trailer [HD] | Netflix\nhttp://youtube.com/netflix"", 'video_category': '24', 'video_view_count': '947453', 'video_comment_count': '502', 'video_like_count': '4745', 'video_dislike_count': None, 'video_thumbnail': 'https://i.ytimg.com/vi/zEkYAzSpHnA/hqdefault.jpg', 'video_tags': ""Netflix|Trailer|Netflix Original Series|Netflix Series|television|movies|streaming|movies online|television online|documentary|comedy|drama|08282016NtflxUSCAN|watch movies|The Incredible Jessica James|Jessica James|Teaser|Original Series|Jessica Williams|Chris O'Dowd|Keith Stanfield|James C. Strouse|the daily show|Playwright|New York City|Noel Wells|Susan Heyward|Megan Ketch|PLvahqwMqN4M0_eOsCRg4rInOe-yxm0uAr|PLvahqwMqN4M1VvGtFng3qLuz13DiSbOoy|Official Trailer"", 'collection_date': datetime.datetime(2025, 4, 25, 17, 45, 19, 394785)}"
incredible,"{'video_id': 'zG_9Jh174dk', 'channel_title': 'Sargon Oshana', 'channel_id': 'UCv6gDEBtJZ36kQ4nQCY9CDQ', 'video_publish_date': 1495206690.0, 'video_title': 'The Incredible Hulk 2008 full movie HD', 'video_description': 'please like and subscribe.', 'video_category': '22', 'video_view_count': '452552', 'video_comment_count': '402', 'video_like_count': '6818', 'video_dislike_count': None, 'video_thumbnail': 'https://i.ytimg.com/vi/zG_9Jh174dk/hqdefault.jpg', 'video_tags': '', 'collection_date': datetime.datetime(2025, 4, 25, 17, 45, 19, 394790)}"
incredible,"{'video_id': '09VJW8M_TIc', 'channel_title': 'CashmereCatVEVO', 'channel_id': 'UCo7cU9dvnhzBr2Et2f8O4ww', 'video_publish_date': 1487728800.0, 'video_title': 'Cashmere Cat - Love Incredible ft. Camila Cabello (Official Audio)', 'video_description': 'Listen to the official audio for ""Love Incredible"" by Cashmere Cat ft. Camila Cabello \n\nCashmere Cat Ft. Camilla Cabello “Love Incredible\'” available now for download and streaming.\niTunes: http://smarturl.it/LoveIncredible.it \nSpotify: http://smarturl.it/LoveIncredible.sp \n \n Follow Cashmere Cat: \nFacebook: https://www.facebook.com/cashmerecatdog/ \nTwitter: twitter.com/CASHMERECAT \nInstagram: https://www.instagram.com/cashmerecat/ \nSoundcloud: https://soundcloud.com/cashmerecat\n\nMusic video by Cashmere Cat performing Love Incredible. (C) 2017 Mad Love/Interscope Records\n\nhttp://vevo.ly/wgsal3\n\n#CashmereCat #LoveIncredible #Vevo #Electronic #VevoOfficial', 'video_category': '10', 'video_view_count': '2962147', 'video_comment_count': '2630', 'video_like_count': '76901', 'video_dislike_count': None, 'video_thumbnail': 'https://i.ytimg.com/vi/09VJW8M_TIc/hqdefault.jpg', 'video_tags': 'Cashmere|Cat|Love|Incredible|Mad|Love/Interscope|Records|Electronic|Love Incredible|Love Incredible vevo|Love Incredible vevo official|cashmere cat|cashmere vevo|vevo|vevo official', 'collection_date': datetime.datetime(2025, 4, 25, 17, 45, 19, 394795)}"
incredible,"{'video_id': 'a6oYtfxxPJQ', 'channel_title': 'DisneyChannelIT', 'channel_id': 'UCTLBJ_2dg5G109qFR34wRRA', 'video_publish_date': 1454230861.0, 'video_title': 'Alex & Co. - ""Incredibile"" Leonardo Cecchi e Beatrice Vendramin - Music Video', 'video_description': 'Solo per voi il primo music video di Alex & Co. “Incredibile” interpretato da Leonardo Cecchi e Beatrice Vendramin.\n\n“Incredibile” è tratta dall’album ""We Are One"" disponibile in tutti i negozi e gli store digitali http://dis.ne/6185BZM1z\n\nSolo su Disney Channel!\n\nGuardate tutti i video di Alex & Co. : http://bit.ly/AlexECoPlaylist\n\nSeguici anche su:\nFacebook: http://www.facebook.com/DisneyChannel...\nTwitter: http://twitter.com/disneychanit\nInstagram: http://www.instagram.com/disneychanne...\nSnapchat: disneychannelit\n\nCollegati al sito http://www.disney.it/tv-disney/ e alla Disney Channel Community http://community.disneychannel.it/', 'video_category': '24', 'video_view_count': '16638102', 'video_comment_count': '0', 'video_like_count': '199868', 'video_dislike_count': None, 'video_thumbnail': 'https://i.ytimg.com/vi/a6oYtfxxPJQ/hqdefault.jpg', 'video_tags': 'Disney Channel (Organization)|Disney Channel (TV Network)|canzoni|personaggi|serie|tv|it|italia|italiano|episodi|hd|attori|attrici|Alex & Co|alex|sam|saul|christian|nicole|emma|federico russo|saul nanni|leonardo cecchi|beatrice vendramin|chiara iezzi|Carola Campagna|seconda stagione|Sam|Barto|music video|Incredibile|Video|Unbelievable|cd|we are one|music speaks|musica|album|unbelievable italiano|incredibile video', 'collection_date': datetime.datetime(2025, 4, 25, 17, 45, 19, 394800)}"
incredible,"{'video_id': 'XaZDOj23KIU', 'channel_title': 'Global Talent', 'channel_id': 'UCG99ejclk8QB8TT4LDu0UVA', 'video_publish_date': 1459286833.0, 'video_title': 'Judges Huge Mistake - Switzerland Got Talent - Incredible Performance', 'video_description': 'Make 100$/day on Youtube with this easy to follow method: https://linktr.ee/online.jobs\n\nHuge mistake made by the judges of Switzerland Got Talent. Incredible talented woman proves to the judges that you should never judge a ""book"" by its cover.\nAmazing performance!\n\nMust read articles:\nhttp://bit.ly/5-Must-Have-Gadgets-2021\nhttp://bit.ly/Overnight-Millionaire-Course', 'video_category': '24', 'video_view_count': '5338392', 'video_comment_count': '9117', 'video_like_count': '55403', 'video_dislike_count': None, 'video_thumbnail': 'https://i.ytimg.com/vi/XaZDOj23KIU/hqdefault.jpg', 'video_tags': 'got talent|switzerland got talent|talent|talented woman|painting|incredible performance|amazing|judges|judges mistake|talent show', 'collection_date': datetime.datetime(2025, 4, 25, 17, 45, 19, 394805)}"
incredible,"{'video_id': 'ivrZMGK6cMw', 'channel_title': 'The Dodo', 'channel_id': 'UCINb0wqPz-A0dV9nARjJlOQ', 'video_publish_date': 1490014827.0, 'video_title': 'Incredible Service Dog Takes The Best Care Of His Mom | The Dodo', 'video_description': 'This amazing service dog knows EXACTLY how to take care of his mom after her brain injury 👏👏👏\n\nVideo by: Laszlo Toth\nTo see more of this incredible service dog Colt, you can subscribe to his YouTube channel: http://thedo.do/colt and follow him on Instagram: http://thedo.do/servicedogcolt.\n\nLove animals? Watch more videos from The Dodo: https://www.thedodo.com/video/\n \nSubscribe to The Dodo channel: https://www.youtube.com/subscription_center?add_user=TheDodoSite\n\n \nFollow The Dodo!\nLike us on Facebook: https://www.facebook.com/thedodosite/timeline\nFollow us on Twitter: https://twitter.com/dodo\nWatch our Snapchats: https://www.snapchat.com/add/thedodo.com\nLove our Instagram: https://www.instagram.com/thedodo/\nReblog us on Tumblr: http://the-dodo.tumblr.com/\nCheck us out on Pinterest: https://www.pinterest.com/dodoforanimals/  \n \nFor the love of animals. Pass it on.\n\n#dog #thedodo #animals', 'video_category': '15', 'video_view_count': '10814901', 'video_comment_count': '9695', 'video_like_count': '182557', 'video_dislike_count': None, 'video_thumbnail': 'https://i.ytimg.com/vi/ivrZMGK6cMw/hqdefault.jpg', 'video_tags': 'animal video|animals|the dodo|dogs|Incredible Service Dog|Service Dog|super smart dogs|service dog|Puppies|guide dog|dog training|guide dog training|service dogs|vet dogs|puppy training|puppies barking|puppies crying|puppies playing|puppies puppies|puppies whining|guide dog in action|guide dog puppy|guide dog puppy training|guide dogs are great|guide dogs for kids|guide dogs for the blind|guide dogs for the blind in action|guide dogs of americas', 'collection_date': datetime.datetime(2025, 4, 25, 17, 45, 19, 394810)}"
incredible,"{'video_id': 'ThQc7ANRJu0', 'channel_title': 'SecretsOfficial', 'channel_id': 'UCuAnkDNAtXnnSzXEmIMqPfQ', 'video_publish_date': 1504231918.0, 'video_title': 'SECRETS - Incredible (Official Music Video)', 'video_description': ""SECRETS - Incredible (Official Music Video)\n\nBUY THE NEW 'SELF-TITLED RECORD' NOW! \nhttp://secrets.absolutemerch.com/\n\nWebsite: http://secretsofficialband.com\nFacebook: https://www.facebook.com/secretsofficial\nTwitter: https://twitter.com/secretsofficial\nInstagram: https://www.instagram.com/secretsofficial/\n\nListen on Spotify: \nhttps://open.spotify.com/track/1fpQItVXeiJogwxdBBQ4Ny\n\nAvailable on iTunes, Amazon, and Google Play:\nhttps://itunes.apple.com/us/album/incredible/id1275744574?i=1275744718\nhttps://fanlink.to/incredible\n\nGuitar and Clean Vocals: Richard Rogers\nVocals: Wade Walters\nBass: Connor Branigan\n\nLyrics:\n\nI spent 8 years down inside a hole\nTo convince myself where I was was home (oh no)\nBut the better part of giving up was awoken in you\n\nMistook comfort for love\nI lost myself and gave the searching up (f***) \nYou found me at my worst from there \nYou got me seeing things brand new. \n\nWhen I’m with you\nTheres a freedom\nThat I know me\nAnd it deepens who we are\nI feel stronger\nThat I know you\nHad to break myself just to show you\nBut it feels so\n\nIncredible \n\nGetting off my feet was pulling teeth\nLosing everything to gain everything (my god)\n50 stories down to cold concrete\nIt was worth it for you\n\nSo confused but content\nSick inside but I got over it\n\nYou got me feeling like brand new\n\nWhen I’m with you\nTheres a freedom\nThat I know me\nAnd it deepens who we are\nI feel stronger\nThat I know you\nHad to break myself just to show you\nBut it feels so\n\nIncredible \n\nThrough the pain and all the guilt\nYou’re all I needed to rebuild\nWe never knew but it was so inevitable\nYou brought to life inside of me\nThe man I never thought I'd be\nA place I know that I can call \n\nIncredible\n\nBroken down\nI was all alone \nStuck in a hell hole I called home\nI never thought I could be saved \nBut then \nBy grace\nYou found me down in a dark place\nPulled me out of all my old ways\nSince then I've never felt anymore shame\n\nI feel stronger\nThat I know you\nHad to break myself just to show you\nBut it feels so\n\nIncredible \n\nThrough the pain and all the guilt\nYou’re all I needed to rebuild\nWe never knew but it was so inevitable\nYou brought to life inside of me\nThe man I never thought id be\nA place I know that i can call \n\nIncredible\n\nVideo Directed by Jakob Owens\n\n#SECRETS #Incredible"", 'video_category': '10', 'video_view_count': '598980', 'video_comment_count': '540', 'video_like_count': '8877', 'video_dislike_count': None, 'video_thumbnail': 'https://i.ytimg.com/vi/ThQc7ANRJu0/hqdefault.jpg', 'video_tags': 'secrets|secretsband|post hardcore|san diego|warped tour|incredible|new music|pop punk|secrets band|SECRETS - Incredible|secrets offical|secrets incredible|incredible secrets|secrets band acoustic|sixteen music|incredible music|secrets ready for repair|metalcore|live|music|a day to remember|eminem godzilla reaction|dance monkey 7clouds|dance monkey cover|rock|hands like houses|artist on the rise|official music video|march 2020', 'collection_date': datetime.datetime(2025, 4, 25, 17, 45, 19, 394815)}"
incredible,"{'video_id': 'B85VhGm200Q', 'channel_title': 'L2M', 'channel_id': 'UC_4G8YkHFMC2xukuVziP7xA', 'video_publish_date': 1478258562.0, 'video_title': 'L2M - “INCREDIBLE” - [Official Lyric Video]', 'video_description': 'Hi Listeners! Hope you enjoy our new official lyric video. You are all INCREDIBLE!! Purchase INCREDIBLE here: http://smarturl.it/L2MIncredible\n***And make sure to subscribe to our YouTube Channel. More music soon:) https://www.youtube.com/L2M?sub_confirmation=1\n\nINCREDIBLE is the tittle song for ""Target"" Back to School 2016 campaign: https://youtu.be/9p_PwFRtI8E\n\nSee more L2M music videos:\nL2M - ""Living For The Rhythm"" - [Official Music Video]\nhttps://youtu.be/0BWF3JwG-rc\n\nL2M - ""B.E.A.T."" [Official Music Video]: \nhttps://youtu.be/0BWF3JwG-rc\n\nL2M - ""GIRLZ"" [Official Music Video] \nhttps://youtu.be/VwqeDV1II74\n\nL2M - ""GIRLZ"" [Official Lyric Video] \nhttps://youtu.be/MO8nwyRlipk\n\nMeghan Trainor - No (Cover by L2M, Grant from KIDZ BOP and Willdabeast) \nhttps://youtu.be/7YpCtn1xJK0', 'video_category': '10', 'video_view_count': '561222', 'video_comment_count': None, 'video_like_count': '4518', 'video_dislike_count': None, 'video_thumbnail': 'https://i.ytimg.com/vi/B85VhGm200Q/hqdefault.jpg', 'video_tags': 'l2m|pop music|l2m video|girlz|girl band|l2m girlz|l2m girls|l2m songs|living for the rhythm l2m|girl group|l2m lyric|l2m music|music|pop|teen music|tati mcquay|lexi drew|jenna simmons|l2m song|kids music|mckenzie mack|mariangeli collado|music video|lego song|living for the rhythm|teen girl band|jenna raine|youtube kids|incredible l2m|l2m incredible|lm2|Official Lyric Video|INCREDIBLE|l2m song incredible|lyric video|lego girl band|m2l', 'collection_date': datetime.datetime(2025, 4, 25, 17, 45, 19, 394821)}"
