keyword,video_id
remarkable,"{'video_id': 'IPdb1oHEGu0', 'channel_title': 'Jason Spencer', 'channel_id': 'UC6JKt25xkeVn8ccSlKmlmZQ', 'video_publish_date': 1464796360.0, 'video_title': 'Win the Ultimate ReMARKable Tech Bundle', 'video_description': 'Win the Ultimate ReMARKable Tech Bundle! https://www.remarkablecoating.com/ultimate-tech-bundle\n\niPad Pro 128GB 9.7 inch + SmartMarker + Apple Pencil + 100 Square Foot Whiteboard Paint Kit\n\nRegistration Deadline: 7/22/16\nWinner Announcement: 7/25/16\n\nOne random winner will be chosen from all contest entries. To enter the contest, click the button below and submit your email address. You must be an active, subscribed member of the email list to win this prize.', 'video_category': '22', 'video_view_count': '56', 'video_comment_count': '0', 'video_like_count': '1', 'video_dislike_count': None, 'video_thumbnail': 'https://i.ytimg.com/vi/IPdb1oHEGu0/hqdefault.jpg', 'video_tags': 'whiteboard paint|contest|win|sweepstakes|ipad pro|ipad|smartmarker', 'collection_date': datetime.datetime(2025, 4, 25, 17, 45, 19, 604415)}"
remarkable,"{'video_id': 'IvF_AaCU2QQ', 'channel_title': 'Jaheim - Topic', 'channel_id': 'UC3M24p4yJ-yHTHaVXZWBoHw', 'video_publish_date': 1496789949.0, 'video_title': 'Remarkable (feat. Terry Dexter)', 'video_description': 'Provided to YouTube by Warner Records\n\nRemarkable (feat. Terry Dexter) · Jaheim · Terry Dexter\n\nGhetto Love\n\n℗ 2001 Warner Records Inc.\n\nMixing Engineer: Adam Kudzin\nUnknown: Adam Kudzin\nAssociate Producer: DeeDee Gist\nExecutive Producer: Denise Brown\nProducer: Eddie Berkeley\nUnknown: Eric Schlotzer\nAssociate Producer: Face\nLead Vocals: Jaheim\nMixing Engineer: KayGee\nProducer: KayGee\nExecutive Producer: KayGee\nExecutive Producer: Phil Quartararo\nAssociate Producer: Pookie Gist\nBackground Vocals: R.L. Huggar\nExecutive Producer: SHAKIM\nBackground Vocals: Shaquana Elam\nFeatured Vocals: Terry Dexter\nBackground Vocals: Yummy\nWriter: Edward Berkeley\nWriter: Keir Gist\nWriter: Robert Huggar\n\nAuto-generated by YouTube.', 'video_category': '10', 'video_view_count': '13330065', 'video_comment_count': '359', 'video_like_count': '101992', 'video_dislike_count': None, 'video_thumbnail': 'https://i.ytimg.com/vi/IvF_AaCU2QQ/hqdefault.jpg', 'video_tags': 'Jaheim|Terry Dexter|Ghetto Love|Remarkable (feat. Terry Dexter)', 'collection_date': datetime.datetime(2025, 4, 25, 17, 45, 19, 604423)}"
remarkable,"{'video_id': 'mNkg2b3qyTQ', 'channel_title': 'Dan Rascal', 'channel_id': 'UCd7Mm0jPAlY7ynmyAUdbWBQ', 'video_publish_date': 1477497112.0, 'video_title': 'Seedless Apps - Remarkable | Seedless Apps', 'video_description': 'Get your rascal on at http://danrascal.com/\n\nReMarkable is an application that was conceptualized and created by Seedless Apps after it’s founder, Alok Ahuja, had an AH HA moment about producing a paperless classroom.  The application went through months of research with a global network of teachers who were willing to donate their time and daily struggles when it came to accepting and marking student documents.  This research allowed teachers to pinpoint some of their daily struggles, and create a tailored application that speaks to these hurdles and makes the process of accepting and marking student documents enjoyable and easy all over the world.\n\nDirector / Adriano Pagliarello\nEditor & Color / Luca Fiore\nMotion Graphics / Luca Fiore\n\nCamera / Red Epic\n\nNeed a live action or animated demo to educate prospective clients and move them to action?\n\nWe’re a phone call away (613 226 8282)\n\nOur D-Mail works too: info@danrascal.com', 'video_category': '27', 'video_view_count': '78', 'video_comment_count': '0', 'video_like_count': '2', 'video_dislike_count': None, 'video_thumbnail': 'https://i.ytimg.com/vi/mNkg2b3qyTQ/hqdefault.jpg', 'video_tags': 'Dan Rascal|Ottawa Video Production|Animation|Demo|How To|Explainer|Branded Content|School Ap|Marking Ap|Education|online video|agency|creative|video|surface|ipad|tablet|back to school|teachers|teaching tools|ottawa|education tips|teaching tips|paperless|environement|environmental|trees|greenpeace|environmentalism|Company|Ottawa Media Production|Ottawa Film|Ottawa Commercial|Ottawa Music Video Productions', 'collection_date': datetime.datetime(2025, 4, 25, 17, 45, 19, 604429)}"
remarkable,"{'video_id': '2qqrDO0KtuM', 'channel_title': 'My Deep Guide', 'channel_id': 'UCUox4vsU0kP2STRyN0zUNhw', 'video_publish_date': 1508583890.0, 'video_title': '""reMarkable"" Paper Tablet - First Month Impressions', 'video_description': '00:00 - Intro\n01:42 - Additional Questions\n19:56 - Maka :)\n20:20 - reMarkable Resonse\n24:01 - First Month\n\nSo, here is the summation of impressions after the first month of using and living with the reMarkable paper tablet. I also address some of the questions that have popped up over the course of the last month, and you get a gratuitous shot of the main star of the show, Maka! :)\n\nThanks for the support, hope you are getting your reMarkable devices now and that you are able to enjoy them :)', 'video_category': '10', 'video_view_count': '22274', 'video_comment_count': '83', 'video_like_count': '429', 'video_dislike_count': None, 'video_thumbnail': 'https://i.ytimg.com/vi/2qqrDO0KtuM/hqdefault.jpg', 'video_tags': 'remarkable|paper tablet|paper|tablet|questions|impressions|first month|review', 'collection_date': datetime.datetime(2025, 4, 25, 17, 45, 19, 604435)}"
remarkable,"{'video_id': 'Ujl1fDgeQJQ', 'channel_title': 'Jason Spencer', 'channel_id': 'UC6JKt25xkeVn8ccSlKmlmZQ', 'video_publish_date': 1464953206.0, 'video_title': 'Win the Ultimate ReMARKable Whiteboard Paint Tech Bundle', 'video_description': 'Register to win here: https://www.remarkablecoating.com/ultimate-tech-bundle\n\niPad Pro 128GB 9.7 inch + SmartMarker + Apple Pencil + 100 Square Foot Whiteboard Paint Kit\n\nRegistration Deadline: 7/22/16\nWinner Announcement: 7/25/16\n\nOne random winner will be chosen from all contest entries. To enter the contest, click the button below and submit your email address. You must be an active, subscribed member of the email list to win this prize.', 'video_category': '22', 'video_view_count': '1589', 'video_comment_count': '0', 'video_like_count': '2', 'video_dislike_count': None, 'video_thumbnail': 'https://i.ytimg.com/vi/Ujl1fDgeQJQ/hqdefault.jpg', 'video_tags': 'whiteboard paint|contest|sweepstakes|ipad pro|ipad|apple pencil|smartmarker|win|dry erase paint|whiteboard wall', 'collection_date': datetime.datetime(2025, 4, 25, 17, 45, 19, 604440)}"
remarkable,"{'video_id': 'hwwMpodmYLc', 'channel_title': 'Greg Taube', 'channel_id': 'UCFcy6_TBBiSdzGlGdmSI5TA', 'video_publish_date': 1514015139.0, 'video_title': 'Remarkable paper tablet  review', 'video_description': 'This video is a review of the remarkable paper tablet.\n\nBuy at: https://remarkable.com/', 'video_category': '28', 'video_view_count': '2367', 'video_comment_count': '4', 'video_like_count': '11', 'video_dislike_count': None, 'video_thumbnail': 'https://i.ytimg.com/vi/hwwMpodmYLc/hqdefault.jpg', 'video_tags': 'iMovie|remarkable|eink|reading|science|tech|technology|onyx|boox|onyx boox|onyx boox max|writing|sketching|drawing|university|note|notes|note-taking|note taking|review|remarkable paper tablet|tablet|paper tablet', 'collection_date': datetime.datetime(2025, 4, 25, 17, 45, 19, 604446)}"
remarkable,"{'video_id': 'FF6FufigzFA', 'channel_title': 'waffler', 'channel_id': 'UCDFq3fY_um7i79byhjChc6Q', 'video_publish_date': 1511242237.0, 'video_title': 'reMarkable tablet unboxing', 'video_description': 'My reMarkable just arrived today! Let’s open it!', 'video_category': '10', 'video_view_count': '240', 'video_comment_count': '1', 'video_like_count': '5', 'video_dislike_count': None, 'video_thumbnail': 'https://i.ytimg.com/vi/FF6FufigzFA/hqdefault.jpg', 'video_tags': '', 'collection_date': datetime.datetime(2025, 4, 25, 17, 45, 19, 604451)}"
remarkable,"{'video_id': 'nL9_fvrjHV0', 'channel_title': 'Christian Bergler', 'channel_id': 'UCYU5Kt5BtGUHR-pBtPaRwVw', 'video_publish_date': 1507657304.0, 'video_title': 'unboxing reMarkable', 'video_description': 'Finally I got my reMarkable. Here are my first impressions on unboxing it.', 'video_category': '22', 'video_view_count': '1173', 'video_comment_count': '1', 'video_like_count': '13', 'video_dislike_count': None, 'video_thumbnail': 'https://i.ytimg.com/vi/nL9_fvrjHV0/hqdefault.jpg', 'video_tags': 'remarkable|tablet|e-ink|device|notebook', 'collection_date': datetime.datetime(2025, 4, 25, 17, 45, 19, 604457)}"
remarkable,"{'video_id': 'R3R0Ef9APgk', 'channel_title': 'Ignorica', 'channel_id': 'UCZe7nRHLYw_cwPF1VmKNo7Q', 'video_publish_date': 1507054939.0, 'video_title': 'reMarkable Paper Table - simply amazing :) unboxing', 'video_description': ""I finally got my reMarkable tablet and wanted to share this with you. After a long wait, it's here and it performs just as I want it to (no noticeable lag, nothing annoying about its performance, just the natural feeling of writing on paper with ease and comfort).\nTo anyone else that bought it and is still waiting...it's definitely worth it!!\nI also got quite a lot of replacement tips so I won't have to worry too soon about changing / replacing any.\nThe only initial con I found was that the interface for the setup wizzard was a bit unresponsive, but after that it worked like a charm :)"", 'video_category': '22', 'video_view_count': '11291', 'video_comment_count': '39', 'video_like_count': '90', 'video_dislike_count': None, 'video_thumbnail': 'https://i.ytimg.com/vi/R3R0Ef9APgk/hqdefault.jpg', 'video_tags': 'remarkable tablet unboxing first run', 'collection_date': datetime.datetime(2025, 4, 25, 17, 45, 19, 604462)}"
remarkable,"{'video_id': 'hxTYZKc20D4', 'channel_title': 'Good e-Reader', 'channel_id': 'UCHhy08xelXhKIOwgsFssaTQ', 'video_publish_date': 1506368971.0, 'video_title': 'Remarkable Folio Case Unboxing and Review', 'video_description': 'The Remarkable Digital Note Taking Device and e-book reader comes with a case. This is the case that they are sending to customers and today we take a look at it and give you our impressions.', 'video_category': '28', 'video_view_count': '10040', 'video_comment_count': '9', 'video_like_count': '43', 'video_dislike_count': None, 'video_thumbnail': 'https://i.ytimg.com/vi/hxTYZKc20D4/hqdefault.jpg', 'video_tags': 'remarkable|remarkable case|kindle|paperwhite', 'collection_date': datetime.datetime(2025, 4, 25, 17, 45, 19, 604468)}"
epic,"{'video_id': 'EO6JN3LLTz8', 'channel_title': 'Faith No More - Topic', 'channel_id': 'UCw0J9lusvvGJ7VVZDuQnotA', 'video_publish_date': 1500679306.0, 'video_title': 'Epic', 'video_description': 'Provided to YouTube by London Records\n\nEpic · Faith No More\n\nThe Real Thing\n\n℗ 1989 Slash Records\n\nBass Guitar: Billy Gould\nProducer: Billy Gould\nExecutive Producer: Billy Gould\nAssistant Engineer: Craig Doubet\nGuitar: James Martin\nProducer: James Martin\nEngineer: Jim ""Watts"" Vereecke\nMastering Engineer: John Golden\nEngineer: Matt Wallace\nProducer: Matt Wallace\nDrums: Mike Bordin\nProducer: Mike Bordin\nProducer: Mike Patton\nVocals: Mike Patton\nKeyboards: Roddy Bottum\nProducer: Roddy Bottum\nWriter: Billy Gould\nWriter: James Martin\nWriter: Mike Bordin\nWriter: Mike Patton\nWriter: Roddy Bottum\n\nAuto-generated by YouTube.', 'video_category': '10', 'video_view_count': '5812230', 'video_comment_count': '759', 'video_like_count': '91741', 'video_dislike_count': None, 'video_thumbnail': 'https://i.ytimg.com/vi/EO6JN3LLTz8/hqdefault.jpg', 'video_tags': 'Faith No More|The Real Thing|Epic', 'collection_date': datetime.datetime(2025, 4, 25, 17, 45, 19, 606896)}"
epic,"{'video_id': 'Jz7ZWKumqfQ', 'channel_title': 'Movieclips', 'channel_id': 'UC3gNmTGu-TTbFPpfSs5kNkg', 'video_publish_date': 1461858730.0, 'video_title': 'Epic (1/3) Movie CLIP - War for the Forest (2013) HD', 'video_description': ""Epic movie clips: http://j.mp/1SUY6c6\nBUY THE MOVIE:\nFandangoNOW - https://www.fandangonow.com/details/movie/epic-2013/MMV30618B52E136CB0BBF6456C07F82DC2B0?cmp=Movieclips_YT_Description\niTunes - http://apple.co/1fRtKe0\nGoogle Play - http://bit.ly/1MXYM12\nFox Movies - http://fox.co/2AOqv2f\nDon't miss the HOTTEST NEW TRAILERS: http://bit.ly/1u2y6pr\n\nCLIP DESCRIPTION:\nRonin (Colin Farrell) defends Queen Tara (Beyonc Knowles) from an onslaught of Boggans.\n\nFILM DESCRIPTION:\nA fearless troupe of bugs assigned the task of protecting the garden enlist the aid of the mythical Leaf Men to defeat the dreaded Spider Queen and keep the vegetable patch safe in this animated adventure based on author William Joyce's illustrated children's book of the same name. Oscar-winning director Chris Wedge takes the reins to helm a screenplay penned by Joyce and Jim V. Hart.\n\nCREDITS:\nTM & © Fox (2013)\nCourtesy of Twentieth Century Fox Film Corporation\nCast: Beyonc Knowles, Colin Farrell\nDirector: Chris Wedge\nProducers: James V. Hart, Jerry Davis, Lori Forte, William Joyce\nScreenwriters: Tom J. Astle, James V. Hart, William Joyce, Matt Ember\n\nWHO ARE WE?\nThe MOVIECLIPS channel is the largest collection of licensed movie clips on the web. Here you will find unforgettable moments, scenes and lines from all your favorite films. Made by movie fans, for movie fans.\n\nSUBSCRIBE TO OUR MOVIE CHANNELS:\nMOVIECLIPS: http://bit.ly/1u2yaWd\nComingSoon: http://bit.ly/1DVpgtR\nIndie & Film Festivals: http://bit.ly/1wbkfYg\nHero Central: http://bit.ly/1AMUZwv\nExtras: http://bit.ly/1u431fr\nClassic Trailers: http://bit.ly/1u43jDe\nPop-Up Trailers: http://bit.ly/1z7EtZR\nMovie News: http://bit.ly/1C3Ncd2\nMovie Games: http://bit.ly/1ygDV13\nFandango: http://bit.ly/1Bl79ye\nFandango FrontRunners: http://bit.ly/1CggQfC\n\nHIT US UP:\nFacebook: http://on.fb.me/1y8M8ax\nTwitter: http://bit.ly/1ghOWmt\nPinterest: http://bit.ly/14wL9De\nTumblr: http://bit.ly/1vUwhH7"", 'video_category': '1', 'video_view_count': '6489727', 'video_comment_count': '0', 'video_like_count': '40427', 'video_dislike_count': None, 'video_thumbnail': 'https://i.ytimg.com/vi/Jz7ZWKumqfQ/hqdefault.jpg', 'video_tags': 'epic|epic trailer|epic rap battles of history|epic meal time|epic fails 2013|epic rap battles|epic music|fantasy|william joyce|adventures|children family|forest videos|jerry davis|sword videos|chris wedge|ronin|bird videos|beyonc knowles|spear videos|lori forte|james v hart|war videos|bow and arrow videos|colin farrell|queen tara', 'collection_date': datetime.datetime(2025, 4, 25, 17, 45, 19, 606906)}"
epic,"{'video_id': 'WkqPVMKsN20', 'channel_title': 'Faith No More - Topic', 'channel_id': 'UCw0J9lusvvGJ7VVZDuQnotA', 'video_publish_date': 1485199425.0, 'video_title': 'Epic', 'video_description': 'Provided to YouTube by Rhino/Slash\n\nEpic · Faith No More\n\nThis Is It: The Best of Faith No More\n\n℗ 1989 Slash Records\n\nBass  Guitar: Billy Gould\nProducer: Billy Gould\nUnknown: Craig Doubet\nGuitar: James Martin\nProducer: James Martin\nEngineer: Jim ""Watts"" Vereecke\nUnknown: John Golden\nEngineer, Production: Matt Wallace\nDrums: Mike Bordin\nProducer: Mike Bordin\nProducer: Mike Patton\nVocals: Mike Patton\nKeyboards: Roddy Bottum\nProducer: Roddy Bottum\nWriter: Billy Gould\nWriter: James Martin\nWriter: Mike Bordin\nWriter: Mike Patton\nWriter: Roddy Bottum\n\nAuto-generated by YouTube.', 'video_category': '10', 'video_view_count': '11550021', 'video_comment_count': '234', 'video_like_count': '139691', 'video_dislike_count': None, 'video_thumbnail': 'https://i.ytimg.com/vi/WkqPVMKsN20/hqdefault.jpg', 'video_tags': 'Faith No More|This Is It: The Best of Faith No More|Epic', 'collection_date': datetime.datetime(2025, 4, 25, 17, 45, 19, 606913)}"
epic,"{'video_id': '7XqhD4CCBis', 'channel_title': 'Watch It Played', 'channel_id': 'UCGK9n7svoIjuaQfRIBJXkqQ', 'video_publish_date': 1469363307.0, 'video_title': 'Tiny Epic Western - How To Play', 'video_description': ""In this video, we're going to learn how to play Tiny Epic Western!  If you have any comments or questions, please do not hesitate to post them in the YouTube comments below. \n\nBecome a member of the Watch It Played Patreon Team! https://watchitplayed.tv/patreon/v=7XqhD4CCBis\n\nSupport us by picking up some promos here: https://watchitplayed.tv/promo-store/v=7XqhD4CCBis\n\nOur TeeSpring Store (get your shirts, mugs and other items!): https://watchitplayed.tv/teespring/v=7XqhD4CCBis\n\nGet the Watch It Played Game Shelf poster here: https://watchitplayed.tv/game-shelf-poster/v=7XqhD4CCBis\n\nThe BoardGameGeek list of ALL our videos: https://watchitplayed.tv/wip-geeklist/v=7XqhD4CCBis\n\nCheck out my personal vlog here: @RodneyJSmith \n\nGet A Watch It Played Microbadge: https://watchitplayed.tv/bgg-microbadge/v=7XqhD4CCBis\n\nEmail: watchitplayed(at)live(dot)com\nTwitter: @watchitplayed\nTwitch: https://www.twitch.tv/watchitplayed\nFacebook: https://www.facebook.com/WatchItPlayed/\nInstagram: @watchitplayed\n\nWe truly appreciate your views, feedback and subscriptions.\n\n00:51 - The Setup\n02:41 - Game Play Overview\n03:03 - Shuffle and Deal Phase\n03:34 - Posse Placement Phase\n03:53 - Placement Spots\n04:30 - Benefit Symbols\n06:51 - Duels\n08:44 - Being Wounded\n09:26 - The Wanted Card\n09:38 - The Resolution Phase\n10:08 - Comparing Hands At Location\n11:44 - Buy Phase\n13:17 - Third Posse benefit\n13:46 - Advancing Industry\n14:19 - End Of The Round\n14:49 - Boss Abilities\n14:58 - Ending The Game\n15:12 - Determining The Winner\n16:13 - Conclusion\n\n#watchitplayed #boardgames #tutorial"", 'video_category': '20', 'video_view_count': '92431', 'video_comment_count': '164', 'video_like_count': '1051', 'video_dislike_count': None, 'video_thumbnail': 'https://i.ytimg.com/vi/7XqhD4CCBis/hqdefault.jpg', 'video_tags': 'Board Games|Watch It Played|Card Games|How To Play|Learn|Learn To Play|Game Rules|Gamelyn Games|Rules|Tiny Epic Western|Instructions|Learn How To Play|Tabletop', 'collection_date': datetime.datetime(2025, 4, 25, 17, 45, 19, 606919)}"
epic,"{'video_id': '42Q3cNKoYxI', 'channel_title': 'AlmazanKitchen', 'channel_id': 'UCVVAnxQ2YMC_qlc7QfPA2YQ', 'video_publish_date': 1487862001.0, 'video_title': 'Epic Fried Whole Chicken! - feat. Mr.Ramsay the Owl', 'video_description': 'Secret Deals & More: https://almazankitchen.com\n\nMr.Ramsay the owl helped us find some horseradish for his signature aromatic deep-frying oil to cook our special chicken! This chicken is prepared from scratch in the mountain forest near the half-frozen river using our signature knife. We infused the meat with a fresh spicy marinade and made special cuts so the chicken could be fried whole. Crispy, spicy skin and meat falling off the bones... Enjoy the ultimate foodporn experience!\n\nFollow us:\n     ▶ Instagram: https://instagram.com/almazan_kitchen \n     ▶ Facebook: https://www.facebook.com/AlmazanKitchenRecipes\nHelp us to improve:\n     ▶ Patreon: https://www.patreon.com/AlmazanKtichen', 'video_category': '26', 'video_view_count': '41639707', 'video_comment_count': '15983', 'video_like_count': '428900', 'video_dislike_count': None, 'video_thumbnail': 'https://i.ytimg.com/vi/42Q3cNKoYxI/hqdefault.jpg', 'video_tags': 'EPICFRIEDWHOLECHICKEN|owl|almazankitchenknife|food|camping|recipe|asmr|epic|fire|chicken|outdoors|deep-fried|howto|primitive|almazankitchen|epic fried whole chicken|epic fried whole chicken top 1 yummy cook chicken survival in jungle roasted chicken forest|epic fried whole chicken - feat. mr.ramsay the owl|epic fried hwole chicken|epic fried hwole chicken top 1 yummy cook chicken survival in jungle roasted chicken forest|Epic fried hwole chicken - feat. mr.ramsay the owl', 'collection_date': datetime.datetime(2025, 4, 25, 17, 45, 19, 606926)}"
epic,"{'video_id': 'GhE31dFfooY', 'channel_title': 'teresatesssa', 'channel_id': 'UC094K_QnfCqZJiriRwz9Hnw', 'video_publish_date': 1486205368.0, 'video_title': 'Female Warriors - Two Steps From Hell - Never Back Down - Epic', 'video_description': 'Two Steps From Hell - Never Back Down - Women Warriors.\nFan made video. \nClips and song belong to their respective owners. \nWarrior Women in movies.', 'video_category': '1', 'video_view_count': '15422194', 'video_comment_count': '1957', 'video_like_count': '84665', 'video_dislike_count': None, 'video_thumbnail': 'https://i.ytimg.com/vi/GhE31dFfooY/hqdefault.jpg', 'video_tags': 'Female Warriors|Two Steps From Hell|Never Back Down|Epic|King Arthur|The Hobbit|Tauriel|Robin Hood Marion|Cate Blanchett|Vikings Lagertha|The Lord of the Rings Eowyn|Guinevere|Keira Knightley|Warrior Women', 'collection_date': datetime.datetime(2025, 4, 25, 17, 45, 19, 606932)}"
epic,"{'video_id': 'cQwsuR96pRk', 'channel_title': 'Secret Galaxy', 'channel_id': 'UCjoe3Qo_DymYyBR6X9VxFjQ', 'video_publish_date': 1496944802.0, 'video_title': 'Star Wars Lost Sequel: Star Wars The Epic Continues | Oddities #1', 'video_description': 'On this episode of Oddities we cover what could be considered the lost sequel to Star Wars, the never produced toyline Star Wars: The Epic Continues.\n\nIt was proposed by Kenner in 1986 as a way to refresh the line and continue the Star Wars story without another movie.\n\nFor even more information on this line: http://theswca.com/images-speci/85LineExt/index.html\n\n\n\nHelp the channel continue to grow: https://www.patreon.com/toygalaxy\n\nFollow Dan on Instagram. He posts lots of toy photos: http://instagram.com/toygalaxy\n\nhttp://www.twitter.com/toygalaxytv\nhttps://www.facebook.com/toygalaxytv\nhttps://www.twitch.tv/toygalaxy\nhttps://shop.spreadshirt.com/toygalaxy/', 'video_category': '24', 'video_view_count': '90316', 'video_comment_count': '200', 'video_like_count': '2933', 'video_dislike_count': None, 'video_thumbnail': 'https://i.ytimg.com/vi/cQwsuR96pRk/hqdefault.jpg', 'video_tags': 'star wars the epic continues|the epic continues|star wars oddities|lost star wars|star wars lost sequel|kenner the epic continues|toy galaxy oddities|toy galaxy star wars|star wars the lost sequel|lost toylines|unproduced star wars|vintage star wars|star wars toys|vintage star wars toys|star wars explained|kenner star wars|star wars deleted scenes|star wars trivia|star wars fun facts|oddities|toy galaxy|star wars|star wars black series|toy oddities', 'collection_date': datetime.datetime(2025, 4, 25, 17, 45, 19, 606938)}"
